h28g44h,nzm2oo,most of the comments in here make me realize the internet is full of people that just read headlines and never the article The article headline is flimsy at best based on the data as I see no strong correlation between covid numbers rising and getting the jab There are almost equal amounts of low vax rates and low cases as there are high vax rate low cases and further pa for example is almost above the national avg and yet advertises over a 70% vax rate If you consider those that had covid plus those that have been jabbed shouldnt pa be at herd immunity? What this also doesnt take into consideration are variants In certain counties which they curiously picked but I probably would have too in my study there is no differentiator for variants We are already seeing strong real world data showing that many of the vaccines are very ineffective against the D variant originally discovered in India Indias numbers have plummeted but there are widespread reports of falsification of data there so much like Chinas reporting I dont think we can trust that this will just disappear I think the UK is our canary in the coalmine at this point so early into the emergence of this variant There are many folks like myself that just simply dont trust the science behind so much of what has occurred since day 1 of this modern day plague Being allergic to PEG to the point that using shampoo with it causes a mild rash I was told not to take the current offerings and wait for better news to come out for the J/J But all we hear from them is bad news between blood clots and corrupted vials in the millions I feel like the entire globe especially reddit users would like to over simplify vaccines and how to stop this disease Remember the idea of a manufactured disease was laughed at and even censored on these very forums not too long ago Now both sides of the political spectrum are realizing there was an orchestrated cover up by Peter Daszak So what new discoveries will there be about the variants the effectiveness claims of the current vaccines against the new variants and long term effects of the vaccine that lets not forget were originally slated for emergency FDA clearance for older and immune compromised individuals because the potential risk of the vaccine far outweighed the potential risk of covid which for those in that category was a very strong chance of death or at a minimum a painful long possibly perpetual recovery period Harvard and Yale doctors came out together and said there is no reason to vaccinate the young the risks are unknown and the risk of covid for those is also low: [https://wwwmsncom/en-us/health/medical/harvard-stanford-doctors-say-mandating-the-coronavirus-vaccine-unethical/vi-AALbqNq?ocid=entnewsntp&pc=U531](https://wwwmsncom/en-us/health/medical/harvard-stanford-doctors-say-mandating-the-coronavirus-vaccine-unethical/vi-AALbqNq?ocid=entnewsntp&pc=U531) Heres my problem with their statements though As someone pointed out the effectiveness of the vaccines are high and your risk of having a break through case drops dramatically if others are also vaccinated Younger people have been known to be asymptomatic and as such are more likely to spread it as younger people are generally more social in person than older people I dont have the answers but to try and paint this as a black/white conversation is foolish I hope the vaccinated dont have long term health issues but if they did you could bet they wouldnt come back on these forums and apologize to those of us that cant get the current vaccines or are fearful because our scientists and medical community especially our government has shown to be at best a bit inept confused and politically motivated,HyprSl0th,16240387040,0
gv8uzqc,musi2f,Meanwhile in San Francisco our local government has [closed the park](https://sffuncheapcom/city-guide/sfs-hippie-hill-fenced-420/) *and I dont see free weed anywhere*,SluttyGandhi,16189508780,4
gxrjvcs,n9ye5v,Really really dumb Americans in a nutshell: I dont trust them doctors and my government But I know I can trust McDonalds,Rdr198829,16207606860,1
gxrwyv3,n9ye5v,Last time I got McDonalds for breakfast there was a government issued pamphlet inside about how to get the vaccine and some info Thought it was weird but good I cant imagine the mundane outrage theyll get over this by Karens everywhere This was in Canada for reference,lemonylol,16207661020,1
gxs6j0h,n9ye5v,McDonalds just talked the government into buying all their coffee cups for them There I fixed it,Nightstick911,16207702230,1
hqgvw33,rr7div,The government is going to need to pick a fucking lane because no one is convinced that everyone has to go back to work in person but is not to supposed to visit friends or family Does that make sense to fucking anyone?,DoktuhParadox,16408169980,1183
hqf9p52,rr7div,Not canceling any plans I bet most heads of government wont be home alone on New Years Everyone enjoy your Mew Years and be safe ,Cassiusjay1981,16407944650,47
hqf4alj,rr7div,Imagine telling people to cancel on friends and family but they have to go to work The government can fuck right off,etan1122,16407922160,44
hqgrq3w,rr7div,They ( the elected officials ) have money stocks wealth etc if they get sick All the Covid benefits are pretty much gone for the common people Cant run a state country with sick people - not working cant pay taxes and can only go to government handouts Or dead people cant vote This is why the push for the vaxx is so serious,Infinite-Phrase3815,16408153420,5
hqhatyb,rr7div,More and more people are done with the government telling them what to do Im talking about people that have been playing by the rules nearly two years,upearlyRVA,16408231920,4
hqg5kti,rr7div,Why did all my friends and myself get triple vaccinated if we cant ever see each other? Why is my firm never criticized for not working remotely every damn day but Im criticized for living my life? The government is weakening its own messages by holding so many different standards Either the virus is too much for us to be in person or it is not If there is a cap on gatherings it applies universally or it does not People are not going to take anything seriously when we have different rules everywhere we turn with the harshest only applying at home!,Sea_Mathematician_84,16408067840,3
hqg3yqa,rr7div,Im all for vaccines boosters and masking but I also understand the distrust and skepticism of many of my neighbors Our leaders have truly failed us in the response to this pandemic So many mixed messages so much "do as I say not as I do" and the drum for vaccines is beat so hard that the reluctance to comply of a population that distrusts their government is hardly surprising The messages to skip holiday and family gatherings but to not let Covid keep you from work is particularly jarring Low wage earners and healthcare professionals went from "everyday heroes" back to being treated poorly by management and customers alike Its hardly surprising so many got out of their respective industries and that is particularly true of healthcare workers This pandemic emotionally broke so many and who can blame them? A respiratory therapist I know retired this year Seeing so many people die slowly of Covid while there was little she could do to change the outcome was too much This was especially true after vaccines became available So much needless suffering and death,Nelliell,16408061560,1
hqn1jyz,rr7div,If covid is bad enough to warrant canceling your holiday plans its definitely bad enough to stop having people go into office jobs that can be done from home Too bad the government doesnt see it that way At this point the only people who should be working in-person are those people whose jobs absolutely require it such as healthcare workers grocery store workers warehouse workers etc If you can do your job sitting at a desk in an office all day theres no reason for you to have to drag your ass into a building crammed with other people just so some blowhard middle manager types can stand over peoples shoulders and feel important,See_You_Space_Coyote,16409229520,1
hqfeuxr,rr7div,I sure wish the quote unquote leaders would do the responsible thing and cancel student debt That would make it a lot easier to social distance knowing I dont have that hatchet hanging over my head Oh but they want citizens to do this that and whatever but dont do anything in return to stop the predatory loan companies or anything else the help the citizens of this country from the looming debt crisis or any other falsely made catastrophe with the government is solely responsible for,winkofafisheye,16407965100,-2
hrtni5u,ryzbou,Eat the rich and their government puppets,Spiritual_Future_119,16416750410,2
hru28sg,ryzbou,Wild question here: how feasible or practical would it be to draft people from non-critical industries and train them to be healthcare workers in the same way during wartime the government would draft people for the military?,omegadirectory,16416810220,2
hrrzy15,ryzbou,Quick someone send this to the quebec government oh wait that would require them to actually be proactive about externalities and unintended consequences,antrage,16416504760,-1
hrwgjsw,ryzbou,Gee how could that happen Can hospitals get sued? Can a government agency get sued like CDC for creating high risk to the vulnerable? Insane,geeshgeeshgeesh,16417264070,1
h72tbko,oujuo4,Texas its like a whole other country One with big government bossing small local governments around,Dcajunpimp,16276499010,331
h73etlt,oujuo4,Whats next banning seat belts? Banning sprinklers and fire alarms in large buildings? Banning restaurant health inspectors? What a bunch of dunces Can you imagine what history will say about this? "In the middle of a pandemic some state governments spent time and resources on banning efforts that reduced the severity of the pandemic" Texas is so backwards I cant imagine how a state can be pro-power outage and pro-pandemic,Blahkbustuh,16276597700,177
h73dizr,oujuo4,Because of this shit vaccinated people are now becoming contagious These selfish pricks are prolonging the pandemic indefinitely because they are self-absorbed enough to think the government/anyone would put the effort into controlling their paltry pathetic little lives,username_offline,16276593340,13
h73d1ns,oujuo4,The Texas state government is a national embarrassment,LorePeddler,16276591270,4
h73cw53,oujuo4,Down here in Texas we dont like big government Unless we are the big government \*pew pew\* (Imaging Im making finger guns and pointing them in air),MoistMough,16276590610,4
h73cy4c,oujuo4,The federal government should make states responsible for paying for covid related medical expenses Texas is milking this Every patient who gets sick is billed to the federal government under the CARES Act Its basically stimulus money for certain medical systems in the state Healthcare companies have a lot of pull in many states Some of the largest employers too Same thing Florida is doing Then they call this "economic growth" in their state since its a multi billion dollar infusion,pixel_of_moral_decay,16276590840,4
h73imnx,oujuo4,Serious question Is there a mechanism in the US for the Federal government to override a governor who is actively taking steps that put the population at risk?,groot_liga,16276613220,14
h737f97,oujuo4,The party of small government is at it again! \*gasp\*,HopefulObject,16276566610,3
h73ecw8,oujuo4,Love that small government am I rite Rs?!,JunkInTheTrunk,16276595680,3
h73y067,oujuo4,Im stuck on Texas for four more years I will vote in every single election until then but I cant wait to get out of here The current government is being artificially insane to drive liberals out and while Id love to stay and fight it out Im not going to die because some incompetent idiot accidentally shoots me while Im looking at bananas in the grocery store,DontShootTheFood,16276678310,3
h7489a7,oujuo4,So when are we going to start treating guys like Abbott like actual murderers? Hes literally setting up a situation where people will obviously die 100% avoidable deaths while very willfully preventing any sort of meaningful measure to keep those deaths from happening This is mass murder through political means for the pursuit of a political agenda GOP politicians are literally facilitating the deaths of American citizens and this definitely isnt the first instance of it Why the fuck are we tolerating murderers being allowed to operate freely within our countrys government?,Caaros,16276721730,3
h73a4tu,oujuo4,"Limited" government limited IQ,interstitialmusic,16276578620,9
h73rnce,oujuo4,Whew good thing the voted for Republicans Can you imagine if they had a Democrat governor? Trying to meddle in peoples lives making decisions for them? Good thing they voted for small government so they can be free like God intended!,terranq,16276651200,2
h73rrva,oujuo4,I love how these guys use big government to force local municipalities to do things while campaigning against bug government,extremenachos,16276651730,2
h73se9u,oujuo4,Aahhhh nothing says freedom from government like the government issuing executive orders preventing local governments to make their own choices,rippinpow,16276654390,2
h73uqke,oujuo4,I thought conservatives believe in small governments being able to make educated decisions based on what is happening in their local area? Isnt that against their beliefs? Big government stepping in and telling the little guys how to run their counties/cities?,mab552745,16276664330,2
h73wxmx,oujuo4,> The new Executive Order emphasizes that the path forward relies on personal responsibility rather than government mandates Uh like this exact mandate? For someone who claims to want less government interference he sure is using his government power to interfere,xaminmo,16276673730,2
h73wywc,oujuo4,Republican hypocrisy at its finest Conservatives really think this is "small government"? Insanity,stonewall386,16276673870,2
h73xy2m,oujuo4,"The new Executive Order emphasizes that the path forward relies on personal responsibility rather than government mandates" Abbott stated "Texans have the individual right and responsibility to decide for themselves and their children whether they will wear masks open their businesses and engage in leisure activities" Gov Abbott "If Gov Abbott really cares about the health and safety of Texas students educators and their communities he will give local school officials and health experts the option of requiring masks in their schools" Ovidia Molina president of the teachers union said in a statement" Why doesnt Gov Abbott just declare to do nothing That would be best for my personal freedom,blazingdragon65,16276678070,2
h74csq5,oujuo4,So they say that government should not interfere with business then turn around and pass a law interfering with a businesss right to require masks to enter They dont care about their principles as long as its what they want,DRob2388,16276740710,2
h73aqnp,oujuo4,So much for small government Republicans really seem to love covid cant get enough of it,whitehypeman,16276581310,4
h73b66t,oujuo4,Republicans limited government should be to not be in office thats how we limit it,Waste-Lettuce5219,16276583190,2
h74mpg9,oujuo4,Limited government is such a scam,jordanjj2004,16276783170,3
h73jtqv,oujuo4,But what about being the party of small government?,thedude0425,16276618270,1
h73k5ai,oujuo4,Those crazy conservatives All about their small government Wait,Lobanium,16276619610,1
h73otzt,oujuo4,The state governments are directly overpowering cities to prevent them from saving lives This is exactly what the small-government people said they feared the federal government doing to the states,GrossInsightfulness,16276639260,1
h73q601,oujuo4,Get fucked Texas government,Xazrael,16276644900,1
h73r520,oujuo4,Ironic how people who refuse to wear a mask claim the government just wants control over you Wouldnt a law banning cities from having a mask policy be controlling? Of all the ways to bury your head in the sand over covid19 this has got to be in the top 3,elister,16276649030,1
h73r9ya,oujuo4,So much for hating "big" government,JustiV18,16276649610,1
h73rcxk,oujuo4,Big government decision for a small minded government,Desaturating_Mario,16276649970,1
h73t6ag,oujuo4,Abbott is a dumb fuck I get not wanting to impose state-wide mask mandates when a large part of the state population is rural but at least let cities defend themselves Small government my ass,DazHawt,16276657640,1
h73w6av,oujuo4,Small-government conservative my ass,Mand125,16276670490,1
h73z6y7,oujuo4,Small government conservative RepubliQons strike again!,Ithedrunkgamer,16276683510,1
h740o3v,oujuo4,The party of small government,1gramweed2gramskief,16276689980,1
h740pgo,oujuo4,Party of small government tells other governments how to govern,atworkthough,16276690150,1
h740u34,oujuo4,As someone who believes the government should not be able to force you to do anything against your will This is just dumb I remember joking about all the anti vaxxers years ago thinking it was hilarious but now seeing all the people who are okay with letting a virus just run around and expect to just go away is stupid,muddybuttbrew,16276690700,1
h741d9h,oujuo4,sMaLL goVErnMeNt!!!,FairviewGuy2814,16276692970,1
h741w9m,oujuo4,pro-big government republican! whats his view on wheelchair ramps?,kkeennmm,16276695240,1
h7430pi,oujuo4,The power grid failed the people twice already this year down there Seems like that state government is taking a real hands off approach to just about everything Good luck,WaycoKid1129,16276700140,1
h74338v,oujuo4,The party of small government strikes again,Gnarlodious,16276700450,1
h745s8e,oujuo4,How exactly is this "small government"?,Substantial_Fail,16276711150,1
h7460fk,oujuo4,Stupid evil man does stupid evil thing &#x200B; "Limited government" my ass,Signiference,16276712120,1
h74c0xe,oujuo4,Prohibiting cities?? Arent the right for smaller government?? Doesnt seem like they are,Budcoffee,16276737330,1
h74g228,oujuo4,This asshole keeps blaming everything on the Federal Government while at the same time says he wants them out of Texas and out of Texas affairs Then he pulls shit like this while blaming COVID on immigrants I hope he catches the new variant and chokes on it!,Noctornola,16276754640,1
h74hlq1,oujuo4,Bet he says he hates government oversight on a daily basis,SentrySyndrome,16276761220,1
h74hn8j,oujuo4,Texas: were against government oversight Also Texas: we will stop local governments from doing what they think is right with oversight Also also Texas: if we (are paid) think a pipeline will help the community we will take your land,This-is-human-bot556,16276761390,1
h74jkz8,oujuo4,So much for "big government" not letting towns and cities decide whats right,tooheavybroo,16276769600,1
h74k48l,oujuo4,Why the hell would you ever live in Texas? You have the biggest buffons in government there Oh wait - the residents voted in those dumbasses Idk whos dumber,Harminarnar,16276771910,1
h74lbel,oujuo4,Its really courageous to stand up against the limited-government fundamentalism of your partys base in order to protect your citizens from predatory utility companies Oh no no wait the occasion he chose was to help kill more Texans,HagbardCelineHere,16276777120,1
h73fmpk,oujuo4,But he is against big government This is big government too!,cfo6,16276601210,-4
hb0feax,pef923,Good More companies need to show leadership Some School boards and locks units of government have their heads in orbit,Pikepv,16303783810,1
hro5nfj,ryb5hr,Tested positive yesterday and was told by my employee health I could stay at work and continue to come in because Im "mild" and have been symptomatic for 5 days Never mind that I feel like garbage This is part of the problem with our failing health system Edit: Am a healthcare worker I work the the government (VA),makeuplove,16415806000,474
hro4tpn,ryb5hr,Great piece Healthcare is headed towards a reckoning like weve never seen probably comparable to the UK after WWI Its probably going to lead us to a national healthcare system if were lucky or else an insanely terrible patchwork of bad healthcare systems if we do nothing Rural areas the ones most likely to vote against government "control" are in for a world of hurt as their hospitals die,darwinwoodka,16415803020,347
hronyuj,ryb5hr,This pandemic is a condemnation of the medical system in the US more than anything The US government spent more on healthcare than any other country at 168 percent of GDP In the same year US military expenditure was 37 percent of GDP Thats over 45 times at around $4 trillion How and where did this money go? How do we not have hundreds of new hospitals?,swz,16415873520,11
hrrw5sf,ryb5hr,Meanwhile Biden is saying that COVID will end and we must keep schools open This administration is either in denial and completely blind or they are purposefully lying It makes me sick to my stomach that our government has abandoned us,unicorn-bread,16416484170,4
hrp5x76,ryb5hr,Meanwhile where I live (in Australia) the number of ICU beds has decreased over the past two years and even though the evidence is coming in from every direction that no similar nation has been able to manage well the government is claiming the healthcare system will be able to take the hit The refusal to see what is right in front of us is staggering And its not like Covid is going to go anywhere anytime soon - most everyone just seems to have bought into the fantasy that since they are vaxxed and boostered the crisis wont really affect their health anymore,grismar-net,16415941160,1
hrb4q4g,rw0223,The vaccine is a joke Youre going to get COVID no matter how many shots you get If youre obese and live an unhealthy lifestyle God bless You better start exercising and dieting regularly Demand the government allow therapeutics and stop blocking them for when you get COVID The vaccine is not the solution it was an idea that people believed was the only way It isnt,kevinkarma,16413547170,7
hra9v4g,rw0223,Alright so heres whats up The beginning of this pandemic covid was STRONG We had high hospitalizations LOTS of deaths We needed a vaccine then more than we will ever need it again (making these assumptions from a shit ton of research but I could be completely wrong here) Delta was less severe Omicron is less severe and we have another new variant now IHU IHU like omicron is even MORE contagious and hopefully with more studies the results will be that it is even more mild than omicron We want this virus to mutate more contagious/less severe Keep getting your shots but essentially this will end up similar to the flu It is an endemic but eventually *hopefully* this will be another seasonal illness Vaccination rates will end up like the flu shot as everything progresses I dont get a flu shot because to me its just not worth it considering the efficacy rates every year Im also 30 and healthy We handled this entire pandemic TERRIBLY and fucking backwards as hell (American citizen here) A lot of folks died that didnt need to and we - both our government and citizens will forever and should be criticized for how stupid and spoiled and greedy we are Take care of yourselves Things are actually getting better and Im finally seeing a light in the tunnel,prisonerofshmazcaban,16413416190,5
hrb2q4g,rw0223,Historically Governments have been the most autocratic during times of an epidemic It takes a long time for the citizen State/ ruler balance to ease,funkeshwarnath,16413538020,1
hrb9msz,rw0223,What the fuck else are we going to do? I mean id be totally for a government owned and run company dedicated to finding long term inoculation vs this booster shot shit but thats all weve got right now,Cory123125,16413570350,1
hrbwut0,rw0223,I mean we could but im not sure governments all over the world would be up for investing billions in factorys to make vaccines and the delivery process it takes to deliver millions of vaccines a day,cammyk123,16413712960,1
hqrm3o3,rt54vc,Federal government basically is saying youre on your own is why And theyre not wrong since states dont want to cooperate and people are tired Some places like NYC are really good at wearing a mask Others like Philly not as much and where Im at for the holidays Houston well LOL COVID ended in March silly!,cougar618,16410083810,102
hqs62m2,rt54vc,If I never get COVID I really want a lifetime achievement award from the government or something It feels deserved at this point haha,laralye,16410206880,12
hqsyoj9,rt54vc,This reminds me of how cases exploded during the olympics here in Japan and the government replied with a line that the two were unrelated As soon as the olympics finish numbers plummet I put my faith in the people who go to school for this stuff but I have to say this seems an obvious case of the variant having gold-medal timing as far as the holidays are concerned,twistedstance,16410444700,2
hqskqi1,rt54vc,Because everybody is partying UK Government 2 years ago said they stand at herd immunity then shit got real in came the lock downs And now we playing the herd card Go enjoy Christmas and new year we also wont mention Omicron has the same symptoms as a common cold I had to learn that by myself after I passed it on to 4 other people Biggest sign Ive heard that relates to all is waking up with a sore throat And just keep lateral flowing,icedted,16410329730,2
hqsuoln,rt54vc,I can We stopped caring because our governments wont do about to help us We are on our own so we have to go work,Status-Stick,16410416220,1
