h7cxvh1,ovpxdj,Vaccinated guy here I spend my downtime getting high to distract me from my anger Not at governments not at the virus Its anger at other people Humans I barely tolerate the idea that I am of this species when fellow humans continue to whine and cry and fuss over a modern medical breakthrough like mRNA vaccines I heard on the radio today that the average reading level of American adults is 7th grade How the hell are these people supposed to understand mRNA vaccines? Maybe I should feel sad for these dumb people but I dont I do NOT,BadBoyGoneFat,16278542110,6
h7cf1iq,ovpxdj,Blame the government,skeet_shootn,16278451670,3
h7cwb35,ovpxdj,Actually Im mad at the government for giving a shit about unvaccinated people If they dont want to thats fine I am they can all go take their chances,nonamesleft79,16278534350,3
h7bkb7e,ovpxdj,Make it a pre-requisite for travel for school and for any government services/programs and watch how fast people get vaccinated,Hertules,16278308180,7
h7c13qs,ovpxdj,Im just so fucking sick of everything These people deny that the vaccines are safe despite infinite sources saying otherwise As well as every single arguement they make are disproven They are just trying to be annoying and being dangerous meanwhile Im not for the government being harsh on individuals for doing what they like But unvaccinated people are dangerous,Magnus250,16278385950,2
h7cnkdm,ovpxdj,"Vaccinated people are ready for normalcy-and angry at the totalitarian BS governments getting in their way",Skip-7o-my-lou-,16278492440,2
h7ccsyc,ovpxdj,Im not angry at unvaccinated we all spread Delta with equal viral load from what I heard as of today Im angry at state and local governments and WFH businesses big time though,hombreingwar,16278440980,2
h7bk28j,ovpxdj,Nobody is getting in your way besides the government Live your life normally if you are vaccinated The fear mongering needs to stop Going into lockdown or mask mandates at this point is ridiculous as deaths are down dramatically Deaths were hitting 3000 a day in January and the 7 day rolling average of deaths in the US is now hovering around 350 Most of these people are unvaccinated If you are vaccinated you will not die of COVID in all likelihood Stop letting the media and the government control your lives any longer,EggyEggBoy69,16278307020,4
h7bjqg4,ovpxdj,Im angry about government over reach Not at the people who arent comfortable getting it Just another issue to divide the people on,bbednarz57,16278305550,7
h7dhmw2,ovpxdj,you watch too much TV if you think its the unvaccinated taking away your freedoms and not the government,texgeorge,16278644200,3
h7djfg6,ovpxdj,Im angry because the anti-vaxers are trying to blame the federal or states governments or pretty much anyone else they can Anyone so they cant take the blame for more mask mandates and shutdowns,varyingopinions,16278653830,2
h7djkpg,ovpxdj,And the media does what the media does best: divide the American people The government is whats preventing normalcy not the un-vaxxed 99% of deaths at this point are non-vaccinated the rest of us could be back to normal if it werent for the government holding us back INB4 "but the more times it spreads the more it mutates and itll get worse and maybe the vaccines wont work" Thats happening anyway You dont think this thing is going to keep spreading in pockets of Africa? Theyve still got polio in Africa I guarantee even if we wipe COVID off the map in the West youll still have variants coming from the 3rd world This is a bad argument Stop blaming non-vaccinated people for lockdowns and masks The government is whats slowing us down,Doge_Of_Wall_Street,16278654610,3
h7djtcy,ovpxdj,Im actually angry at the government People are free to do as they please,Bowens1993,16278655890,2
h7cecrf,ovpxdj,Normal? you think the government is gonna let things ever go back to normal? have you been asleep the last few decades?? get real,Unable_Good1859,16278448360,2
h7cnylz,ovpxdj,crazy how the chinese government world governments pharma companies the media social media have succeeded in scape goating all their incompetence and corruption and placing it on to the people who dont bother to get vaccinated shoulders It shows you have fucking brain washed and blood thirsty the average idiot is Keep being mad at those who choose to not get the vaccineif you think they are the issue YOU ARE THE ISSUE your brainwashed savages,StayHealthyStaySafe,16278494290,2
h7cpdia,ovpxdj,Thinking its the fault of the unvaccinated for the shit policy decision of your governments bahaha 80% is as good as youre going to get,miniq,16278500930,2
h7axcie,ovpxdj,Vaccinated spread and get infected with the same virus No discussion Its ridiculous to blame the unvaccinated theyre only making it harder for themselves as theyre not as protected Blame the government not the people Just because youre vaccinated doesnt mean everything is going to get back to normal,klocucha,16278174250,-37
h7d15gm,ovpxdj,Im vaccinated and mad at the governments for confusing statements contradictions lies and mismanagement that turned a handful of nutters into hundreds of thousands of skeptics,chubbyprimate,16278558180,1
h7bood1,ovpxdj,The unvaccinated are not getting in my way the government restrictions are getting in my way Having the right to put yourself in danger is part of a free society,Sundance37,16278327940,1
h7bvs2r,ovpxdj,I think they are mostly angry at the government lying to them If you are vaccinated it doesnt matter if other people are not vaccinated That is the whole point of getting the vaccine The majority of new cases are in unvaccinated people This is why if youre vaccinated it doesnt matter if others are not The vaccine works The death rates are so low that this is no longer a crisis the requires granting emergency authority to the government They will continue to use fear to try and craft a narrative for political purposes So if youre not vaccinated I think youre making the wrong decision but Im not angry at you You can make a decision for yourself and deal with any consequences that may arise That is what living in a free society means Im angry at the government that is trying to maintain their control over people Im angry at the mixed messaging we have received from the government,treblewdlac,16278361030,1
h7c8y48,ovpxdj,Pretty sure that is the government and the unvaccinated together Im vaccinated but this line of thinking is so stupid its incredible and I can barely believe people believe that 100% vaccination will make it go away Were stuck with it forever,Sheister7789,16278422590,1
h7ck6v6,ovpxdj,Inaccurate Im angry at the government for getting in my way,Justamemer101,16278476380,1
h7blrre,ovpxdj,I saw someone whose videos Ive watched from time to time on youtube today I dont agree with a lot of what she says but she makes me think I dont find her too out of line However today she was very upset about the fact that her mother who is elderly took the vaccine and is now ill (not ill really in so much as it sounds aged related) She attributes her mothers decline to the vaccine and is convinced that this whole thing was a way for the government to rid themselves of a certain segment of the population &#x200B; She is very angry There is low levels of trust in the government (and I would say with good reason unrelated to the vaccine) But what struck me was the pain and anger she was displaying at how stupid she thought people could be to get the vaccine,vipergirl,16278314870,1
h7buf6j,ovpxdj,Been fully vaxxed since May Still wearing a goddamn mask so I dont inadvertently spread disease Yesterday sat opposite an antimasker watching a Katie Hopkins conspiracy video on the tube Legions of people blaming governments people are to blame You know who you are,willflameboy,16278354680,1
h7bw282,ovpxdj,No they arent its the government just let the people who are unvaccinated deal with the consequences of not having it Open up society let people live their own lives,SaintJames8th,16278362320,1
h7byt38,ovpxdj,The government should let them die instead of trying to protect them one anti-vaxxer life is not worth the time it takes for a real person to put on a mask,comradequicken,16278375220,1
h7bzfuv,ovpxdj,Ive had the disease and the shots I was willing to accept the risk of the shot If you chose no shots Im totally ok with that you accept the risk that goes with it But Im no longer willing to wear a totally f%%$%^;g useless mask for government backed eyewash So if that means Im not "protecting " unvaccinated thats the risk they were willing to take theres no do-over in this game I learned that from having the disease,kmz57,16278378160,1
h7c09n1,ovpxdj,So riddle me this We have been dealing with a virus with a survival rate that only becomes severe with those 75+ years old and we have had a vaccine that is readily available to everyone for free over the age of twelve in most places (at least in the us) If we return to full normalcy Sure the fualt can be placed on the unvaccinated but literally nothing is stopping people from going back aside from governments making rules according to the cdc who changes their mind on literally everything just to say "covid still bad Keep doing the things we said didnt work before until further notice" Not playing down the virus but this is hurting more healthy people then those at risk We have precautions we know how to treat it Nothing is stopping people from living their lives,berryboye1010,16278382050,1
h7c72ux,ovpxdj,Just another way for the governments to rip us apart,canehdianjoe,16278413740,1
h7cho06,ovpxdj,According to the research being done especially in places like Israel that has a population over 60 at 80% vaccinated by February data is showing the vaccine effectiveness is fading quick and dramatically Had you been vaccinated in January such as myself youll find youre at best walking around with an effectiveness of nearly 20% compared to someone vaccinated in June who is around 80% If unvaccinated people are the only ones getting sick the concern we are seeing wouldnt be there You would be protected with your vaccination and would have little to worry about The truth is we will see more variants and until we have boosters available and ones that can be made quickly before the new variants take hold we will continue to see spikes regardless of previous vaccinations Instead we are seeing vaccinated people spreading the virus and some knowingly I know first hand someone who is currently infected after being vaccinated in april and she continues to work at her job since the symptoms arent bad according to her and she is vaccinated The anti vaxxers are a problem but theyre a distraction from the real issue that your vaccine will only provide so much protection and its not a ticket to do whatever you want If the vaccine worked effectively for the current delta variant they would only be their own problem Kind of like driving a car with a seatbelt The direct impact is only to the individual I have and still continue to wear two masks including an n95 as well as limit my public interactions It isnt hard to wear a mask its not hard to use common sense even if youre vaccinated Weve had a hospital in my metropolitan area that had 20% of the admitted covid patients fully vaccinated It all depends on when your state started doing vaccines and how long ago it had been since you got yours And we will see a lot more of these so called "breakthrough" cases regardless of vaccination rates And government officials have been warned already of this and the CDC has discussed this internally and a lot of people are concerned about the effectiveness of the vaccines The mask mandate should have never been removed and local governments have also failed their constituents,mrnight8,16278464230,1
h7cw6ro,ovpxdj,The Israeli Prime Minister stated *"We do not know exactly to what degree the vaccine helps[vs Delta] but it is significantly less"* due to a rise in new and serious cases among vaccinated people *"The highest number of coronavirus cases in nearly four months"* It also affects children who are mostly unvaccinated so we need to get them vaccinated perhaps with an updated booster shot before its too late Over half their population is fully vaccinated and among everyone *"around 60% of the patients in serious conditions have been vaccinated Moreover according to Hebrew University researchers who advise the government around 90% of newly infected people over the age of 50 are fully vaccinated"* So the vaccine IS HELPING these statistics PROVE THAT but they also prove that the Delta Variant is not to be taken lightly and that a new vaccine MUST be developed to combat this deadly mutation,Candaianmann,16278533780,1
h7d2sme,ovpxdj,My country has decided not to do the vaccine passport but still offers some papers which serve as proof I think a company could step to the table and create a scannable hard to counterfeit vaccine passport with integrity behind it I normally would prefer government to do these (essential) things over companies but if they wont why not let a 3rd party do it? I get this isnt great for personal liberties (though we use to require people to show immunization records to get into school or enter the country) and we should keep an eye on the government so that things dont stick past the pandemic (like with the NSA and their anti-terrorism measures) but like most people I take this pandemic seriously and just want it to be over I dont believe in forcing people to take the shot with force (unless the virus was more deadly and Martial Law was declared) but restricting them from public places is good encouragement and helps keep immuno-compromised people and others who cant get vaccinated for medical reasons safe,Beeker93,16278566340,1
h7d3s8e,ovpxdj,If you are mad because your freedoms have eroded due to covid then dont blame the scapegoat of the people taking your freedoms Government officials are the people enforcing restrictions If you are vaccinated then you should ask why are they still restricting you and if vaccinated people are at a similiar risk than the unvaccinated then why did those officials lie to you about the effectiveness of the vaccine and then pit you against your fellow citizens,puffdigly,16278571360,1
h7dbdgj,ovpxdj,Be mad at the government not other people who dont care whether or not you wear a mask,bbednarz57,16278610470,1
h7de44f,ovpxdj,Obviously the government has the main responsibility to ensure high vaccination rate $100 cash incentive is a joke Its mean to say this but its a fact imo Im not suggesting cash incentive but this is the most effective mean and what they suggested,lordbaby1,16278625160,1
h7df1cp,ovpxdj,if you are vaccinated you are fine (unless you do not believe they work but that would be weird to get it and not) or you do not get it and that is your problem In my state people have been "doing normal" things for months like this Government has gotten used to controlling everything and want to keep it that way all around the world people are protesting their governments It isnt the unvaccinated it is the people whom are saying it is the unvaccinated as a scape goat,BRlEN,16278630130,1
h7dfgkh,ovpxdj,Im vaccinated Im not angry at the unvaccinated They arent the ones making the rules The government officials are THEYRE the ones in the way of normalcy Theyre just scapegoating the unvaccinated so no one blames them and threatens their power,post-mm,16278632460,1
h7bjv0g,ovpxdj,We would already have normalcy if we stopped pretending the government can be someones mom Let all just move on,BidenBootLiquor,16278306110,-2
h7bgjx5,ovpxdj,its not the unvaccinated getting in the way its the government if the unvaccinated want to die let them if youre vaccinated you no longer have anything to fear from covid,potionnot,16278290400,-6
h7bazil,ovpxdj,You know whos screwing you out of normalcy? Your government Dont let them,CunnilingusCrab,16278261550,-4
h7dcen4,ovpxdj,Im not getting vaccinated till the FDA approves it Youre a puppet if you take it now If something goes wrong down the road you wont be compensated for shit If the government wants people vaxed they need to fix their vaccine,Fabulous_Advisor4661,16278615970,-2
h7bh3hs,ovpxdj,Im not angry at the unvaccinated I just think theyre dumb Im angry at local and state governments for forcing vaccinated people to remask for the safety of antivaxers,parsimoniously,16278293080,-2
h7cz2y8,ovpxdj,This is what happens when people lose all of their trust and faith in the government The only solution is to get their trust back and our media here doesnt help that one bit because I dont know about everyone here but I sure as hell dont trust what I see on the news anymore I have to go digging online for bipartisan information and the amount of misinformation I go through to get to is a clusterf***,CalicoJak16,16278548080,-1
h7czfxd,ovpxdj,Ah yes normalcy Or as same would say complacency COVID opened the doors to the labor movement livable wages opened our eyes to false media narratives and exposed the governments loyalties to their pockets You mean you CAN just give us all thousands of dollars no problem eh? Normalcy? Thats going back to the "what can you do?" work till you die without speaking up about it lifestyle Yeah for sure lets gets rid of COVID and make these vaccines mandates but god dammit do NOT go back to how it was,Roombamyrooma,16278549820,-1
h7dd65s,ovpxdj,Lol we went back to normalcy when you sat at home terrorized by a flu and the media You want normalcy then go for it dont wait for daddy government to tell you,Dave22201,16278620080,-1
h7bq8a8,ovpxdj,The unvaccinated arent issuing new mandates or lockdowns They never asked to be protected by the government,FaultyProcessional,16278335080,0
h7c629y,ovpxdj,Yep But unfortunately unvaccinated people are confusing the direction of that anger and believe its aimed at the government,grtk_brandon,16278408870,0
h7ct63j,ovpxdj,Nah more upset with the government and the situation,NotTheChickPeas,16278519040,0
h7czkug,ovpxdj,They realize its the government getting in their way right? Im fine with whatever the unvaccinated does because its not stopping me from doing what I want,flymm,16278550500,0
h7d6ar3,ovpxdj,It isnt the unvaccinated getting in the way of normalcy it is the government,MentallyOffGrid,16278584050,0
ha17fl5,pa00vu,Just to rehash why this is so important: youre going to see a lot more employers schools etc require it now While the government said that you can require a EUA vaccine during a pandemic this area law has only been tested a little bit Requiring fully approved vaccines is very solid legally Businesses that were afraid of the potential for litigation after requiring a COVID vaccine no longer need to be,faceerase,16297272920,52
ha1mg0g,pa00vu,"I dont trust the government when it says to get the experimental vaccine Im going to wait for FDA approval" FDA approves "Uh I dont trust the FDA they are a part of the government yeah thats it" Itll be interesting what their next excuse to put off being responsible is,lowcrawler,16297337860,5
ha1e2ww,pa00vu,This is great news! Now more schools government institutions and businesses can require it Hopefully this moves the needle,WestFast,16297302430,2
ha25hfj,pa00vu,Im still a little confused on how approvals work between different vaccines If Pfizer is the only one fully approved and this means that companies governments etc can mandate it with little to no legal recourse what does that mean for people who got Moderna/J&J? Will these companies/governments be mandating Pfizer vaccines only? I guess this isnt really that big of an issue if Moderna is probably getting full approval soon but still curious,str1kebeam,16297415590,1
gxxbc9l,nb0qrm,Im from Canada and while there arent many differences between our countries this has got to be one of the most distinctly American headlines Ive seen in a while Creating a small lottery via state government to entice people to do something is hilarious :),iqcool,16208676640,54
gxxcy50,nb0qrm,A small chance of winning big is actually a huge enticement to most people Over in Taiwan they were having trouble getting businesses to pay their taxes so the government instituted a lottery Whenever you make any purchase at any store in Taiwan you are entered into a monthly lottery I believe the top prize is in the millions but they also have prizes all the way down to just a few dollars The idea is that customers will demand a receipt if it has a lottery ticket attached to it making it harder for businesses to dodge taxes Seems to have worked!,colbyjackrat222,16208684530,13
gxysp6j,nb0qrm,In other words "were not making it a law because were pussies Heres a bribe instead" Bribing is something shitty parents do to try to win their spoiled kids over This and the entire way the US government has been handling the covid-19 pandemic is hilariously pathetic,MulberryBlaze,16209056430,2
gxx4w9j,nb0qrm,I have complete faith in government that those chosen will in fact be random,gbfbjfjdnnsj,16208645880,1
gxxs3b4,nb0qrm,Why is the government just handing out $5 million? Seriously? People think this is a good idea?,wumbomobile,16208762680,1
gxxsdts,nb0qrm,Wow! So great! Praise our government for blowing our tax money! Nice to see Ohio is being responsible with the funding they received Wich is our money,Richandthecrew,16208764390,1
gxxuc0o,nb0qrm,The government steals so much of the peoples money Im all for a little citizen recapture even if the gimmick is stupid,o_p_d,16208775830,1
gxye7c1,nb0qrm,Who wants to bet a government official ends up with the winnings?,tetsusiega2,16208929960,1
gxykg1l,nb0qrm,Whats the next best thing to overthrowing the government for a redneck? Free lottery tickets,praefectus_praetorio,16208989710,1
gxykzb0,nb0qrm,I propose that governments now announce that as of July vaccination shots will cost $50 each (Waived if you got the first one before the deadline) Americans love a deal!,shafflo,16208994550,1
gxyoibr,nb0qrm,All these government handouts are the reason nobody wanna work for 5 dollars an hour anymore !!,bluepillcarl,16209025230,1
gxzlrj1,nb0qrm,Me: "Hey government can i get adequate healthcare and some stimulus since Ive been out of work for over a year?" Government: "how about a chance to win a million dollars if you get a vaccine?!",NotThatSeriousBro,16209201840,1
gzsa0uh,nb0qrm,Dont ever ask me for a dime again if the Ohio state government can give away 5 million taxpayer dollars to bribe people into getting the vaccine,Higher_Math,16222248350,1
gycf6yl,ndkvik,Actually its not the experts or the governments business what the hell we do if you think we should answer to them then youre part of the problem,howie6769,16211858480,-3
gyc4049,ndkvik,"China didnt do enough to contain the virus" "The US and local governments should not do anything to contain the virus" "I will lie instead of doing more to contain the virus",RedditRage,16211807930,1
gyc4vjb,ndkvik,What a joke Anyone who would follow CDC recommendations without teeth will follow the honor system Most of these people are already partially or fully vaccinated 30% of Americans who are absolute morons and believe the coronavirus is a conspiracy made by Bill Gates are going to lie about it because people are taking their freedom These people are unlikely to ever get vaccinated no matter what you do A lot of these people ALREADY refuse to wear a mask even when the government/business requires it Assume that if you live in a state like Florida or Texas 80% of the people walking around without masks are not vaccinated,Murbela,16211812020,1
gyc6qi7,ndkvik,Walmart and Amazon would like to personally thank the government for their care and attention to public health,redsaeok,16211820740,1
gycaaxy,ndkvik,So what if they lie I am sick of catering to the people who have willingly accepted their faith I for one am really happy that cdc lifted mask bans I will still have my mask in my pocket and it will go up if I feel I am around a crowd inside or outside if they want to walk around maskless and unprotected then I say let them find out the hard way I fact the government should take the extra 300 million doses and give it to the third world countries who are begging for this after all the kids vaccinated and say sorry no more,samiam0505,16211837050,1
gycj1m5,ndkvik,More than a third of this country believes the election was rigged What makes the government think they will be honest with reality?,Snipeye01,16211875380,1
gycmqa2,ndkvik,Well turnabout is fair play when the government and the so called "experts" have been lying to us for the last year,gadget0810,16211891820,1
gycnutv,ndkvik,I honestly dont think that this is the move the government is taking right now I think theyre realizing that our ICU capacity is going to be able to absorb whatever additional surge we get They are basically saying "anyone who is vaccinated is safe if you dont wanna wear a mask youre putting yourself at risk and you may die That is on you" I think we are approaching the point where we cant continue to keep the country on lockdown forever when30% of the country refuses to get vaccinated This would literally go on until at least the latter part of this year I have to say even though I understand there are large population of people that cannot get vaccinated theres not much else we can do,Z0idberg_MD,16211896780,1
