h6u18nl,ot7vtq,So im sure ill get some heat for this but just because I dont fully trust a vaccine yet does not mean im a Anti-vaxxer and im sure a lot of people feel the same Now just because im not vaccinated doesnt mean im out here in the public not wearing masks and acting like everything is sunshine and rainbows actually the opposite I stay home hardly go anywhere at all when I do its to get groceries and wearing a mask And i have done this since the pandemic started &#x200B; My point is Some unvaccinated people are refusing to get vaccinated for all different reasons a lot of us dont care for the political aspect here some of us actually dont trust a vaccine because who is to say they are not lying about what they do or the numbers I mean we have been lied too about everything else and now im supposed to just trust them? The US government totally fucked us all here and now we the people are being even further divided with the spin of "the unvaccinated is the reason for the current wave" &#x200B; This pandemic should of had us unite as people and help our neighbor and unite as one to overcome this instead the exact opposite its depressing I wish we had actual leaders lead instead of what we have &#x200B; Any who rant over enjoy yall day!,willg7607,16274825560,8
h6vdbuu,ot7vtq,I dont understand this at all 9999% of vaccinated people have not gotten the virus after being vaccinated (This number isnt arbitrary out of 160 million people vaccinated 6000 have gotten COVID) so why care about unvaccinated people? No more masks no more social distancing get sick and die I dont care Its a personal choice so why is the government bringing vaccine mandates and masks back? Literally get sick and die I do not care it was your decision to not get the vaccine,Andvaur73,16275026510,2
h6twa16,ot7vtq,Could someone explain to me why cant the government just mandate everyone to get vaccinated? Genuinely asking Its not a hyperbole to say were dealing with the fate of the entire human race here Vaccination should be mandatory,jao3003,16274803050,-31
h6v57tl,ot7vtq,Im so confused as to why people thought they could not wear a mask when being vaccinated? The CDC had been saying from the beginning to wear a mask regardless of vaccination status It was the local governments that said you dont have to wear a mask if youre vaccinated It wasnt the CDC that said that If you use the Wayback Machine on the CDCs website I chose a random date 8 April 2021 It literally says word for word >After youve been fully vaccinated against COVID-19 you should keep taking precautionslike wearing a mask staying 6 feet apart from others and avoiding crowds and poorly ventilated spaces https://webarchiveorg/web/20210408055011/https://wwwcdcgov/coronavirus/2019-ncov/vaccines/fully-vaccinatedhtml,Mookie_Merkk,16274992070,-1
h6ujhs2,ot7vtq,UK government: Nah,ManOnNoMission,16274902230,1
h6uw5cz,ot7vtq,I just wish the CDC/federal government would get its butt in gear and MANDATE IT Fuck I just want people to cooperate for a bit so we can go back to normal,partiallycylon,16274954220,1
h6vdz3d,ot7vtq,This is what gets me Plumpness kills When mixed with Covid So why not mandate healthier food and drinks during this health care emergency Maybe tell McDonalds And Coca-Cola they cant sell their stuff Thats if were trying to save lives We forced small restaurants closed but not the fast food that will be killing us even after Covid For the people that love those types of things who say government cant take bad choices away I say to them get vaccinated then lets talk,Oregonmushroomhunt,16275029220,1
hd0mds5,poqczw,Im vaccinated but blame your government for not investing enough to upscale healthcare Stop pitting groups of people against each other Freedom of choice is so important for future scenarios as well!,dark-forces,16317504370,3
hczutub,poqczw,Sounds more like s logistical and government failure I definitely know some hospitals are no longer receiving aid and resources to treat covid patients and non-covid patients A lot of this does fall on the irresponsibility of the general population for not getting vaccinated but also a large portion on elected officials who no longer feel public pressure to continue covid aid,Bigballerbooks,16317381980,1
h8ol5jh,p2wk4m,Im from MS At my old school 10 years ago theyd take a classroom the size of a small bedroom and force 36 kids and a teacher in there (were very slow to change so Im willing to believe this is still a practice) In public you still have stupid rednecks that think the virus is a hoax or think the vaccine is dangerous or worse religious fruitcakes that think that "God will cure it" instead of doing something for themselves Nobody enforces masks around here even in places that normally would in other states Most people here actively oppose social distancing masks and other precautions let alone washing hands after using the bathroom (that was an issue before Covid) Moms complain on fb that theyre ready to get kids in school and "out of their hair" all the time Worst yet we have a lot of Republicans who get their info from Newsmax who according to some people I know have been telling people that vaccines and masks no longer work because Fauci was wrong a couple of times and one doctor out of millions said so They dont care as long as things go back to "normal" They could have taken so many alternatives to prevent ONE THOUSAND *children* from contracting the virus and theres definitely thousands more that are being ignored or havent tested yet The government doesnt care as long as things go back to normal the schools dont care as long as things go back to normal the parents dont care as long as things go back to normal its sickening And since kids are walking petri dishes those 1k kids are going to spread it more People will die from this and nobody cares All because of an apathetic state Fuck Mississippi,DoubledDenDen,16287913650,5
h8oo4i6,p2wk4m,with 144k new cases yesterday and in average of almost 100k this past week what makes the government thinks its a good time to reopen it? Some countries consider a rise of 30k-40k as a huge spike I guess USA have a higher standard then the rest,sirmunnichs,16287925850,2
h8oie8z,p2wk4m,My fav part of all of this is how Tate Reeves said masks go against science on July 29 and now he has extended the state of emergency declaration because his state is fucked and he needs help from the federal government The federal gov who he so adamantly said are incapable of doing their jobs now that trump is gone,ohwhofuckincares,16287902750,1
h8qgkvo,p2wk4m,im not anti vax im just waiting for covaxin the media has divided the "vaccinated" and "unvaccinated " against eachother concerns with mrnas are valid and you can try to shame me but i assure you i have zero shame why isnt the government talking about covaxin? the only vaccine that uses inactivated virus to train the body to fight covid including the variants and is safe for children same vaccine platform that has been used since the polio vaccine and has proven itself over the test of time why is nobody talking about this? people are talking about making the unvaccinated suffer because they "deserve" it this is disgusting i wear my mask everywhere i go in public and keep my distance but im the asshole NOW that being said anyone who has underlying health issues should definitely consider taking the mrna if they havent already but its really none of my concern the amount of risk people want to expose themselves to,huskydannnn,16288209860,1
gwksrs6,n2hns4,Its the same pattern as with Israel during its vaccine rollout The overall numbers decreased as the Israeli government expanded the vaccine among all eligible age groups but the younger ones numbers increased until they got vaccinated My GUESS is that its behavior-related when mixing vaccinated vs unvaccinated Sounds like most breakthroughs are asymptotic or low symptomatic If people are letting their guard down around an unknowingly asymptomatic vaccinated parent or grand parent (for example) the bump in infection rate in the younger population makes sense Edited for typos,sunqueen73,16198981410,1
hq7st75,rpprbi,It may go over better if the same applied to every government job and office including Congress and Senate,DaleandI,16406522060,32
hq5nap1,rpprbi,The vaccine has been widely available in the US for *9 months* it is well past the time to do this The glacial pace of the federal government will never cease to amaze me Just do it!,Jakesta42,16406197630,799
hq74dgx,rpprbi,The amount of love for an overreaching government makes me sad for the future,InsaneBASS,16406416440,83
hq6w3ca,rpprbi,Unfortunately will never happen Out government has continued to refuse to do anything of substance Only things they really do is line the pockets of corporations and the rich,batkave,16406382380,1
hq9jag4,rpprbi,We are at 93% double vaccinated total population here now That means if that were the case here that many would be able to travel The rest fill follow We already have to show vaccination passports (simple check in app) to get into certain government places like rubbish tips Im 100% OK with that,Ya-Dikobraz,16406889760,1
hswvcca,rpprbi,What an unhinged administration letting one public official tank the ratings of POTUS and getting shlonged by SCOTUS I got the JnJ as soon as I got eligible and same with booster but wouldnt ever think about mandating it for fellow free Americans Remember: government isnt concerned one bit about your health If they were: theyd have banned sugar seed oils sugary drinks and ultra processed crap they call food,desiInMurica,16423489250,1
h9r1zvv,p8e6s6,Stand by for argument to change from Its not approved yet to It was only approved because the dems forced it through Also why do antivaxxers use this argument? All they do is talk about how horrible the CDC is and the government is but then for some reason think that the FDA is okay As if its not a part of the government,Dbsusn,16295184560,2
h9s6nos,p8e6s6,Before there were talks of any vaccines getting approved the anti-vaxxers would all say "well its not fda approved yet so it is not safe" Then as soon as there were signs of Pfizer being approved the same people started saying "FDA is a government association we can trust themthe FDA dont care about safety" Sadly this will only change the minds of a few people,PortaHooty,16295494870,1
h9sp4h2,p8e6s6,"We dont trust government!" FDA approves vaccine "I am now comfortable getting the shot",Toadsted,16295589240,1
h9sqg25,p8e6s6,This will likely give ammo to business (such as hospitals) and schools to require vaccines for continued employment/enrollment Unfortunately the people who are real antivaxxers are the same ones who distrust government in general including the FDA so this wont do much for them except eliminate that "experimental vaccine" from their talking points,bobthereddituser,16295595350,1
gwxpsxs,n4uoij,1 dose is stated in the article I guess the US government will start at 1 dose then hopefully try to get people to take the second dose,ax23m,16201554660,6
gx0z9ah,n4uoij,What is the government doing to achieve that goal? A 4th stimulus check tied to being vaccinated might help The cost will pay for itself with a faster return to normalcy and less/no restrictions Or at the very least officially FDA approve the vaccines Actions speak louder than words,crowd79,16202232220,2
gwywd3a,n4uoij,Too bad he didnt follow through on his promise to make sure the vaccine wasnt intellectual property So even if we get everyone vaccinated itll still affect poor countries mutate and come back forever Likely this is to benefit the pharma companies who are living large on government money now and will happily charge us for our yearly vaccinations as COVID becomes a normal part of life thanks to their cooperation with the US government to ensure that,Meta_Digital,16201745640,1
gwztzc3,n4uoij,its better to have deadlines and goals set by the government for vaccines Im from india and the Indian government failed to do so A lot of innocent people are dead and are still dying Please support your leaders and make this vaccination drive a successful one cause I know a lot of people wouldve survived in my country if this drive was conducted by my government Dont think things for granted,warpig1997,16201927770,1
gx0j55z,n4uoij,I think its time for the government to give some real incentive I believe there are a lot of people who arent getting it because lack of initiative or they continue to hold the "Im not the problem everyone else is" mentality Ive already been fully vaccinated but I work with a lot of people who arent really anti vax but they claim that theyre wanting to wait it out because they are unsure But when I ask them if they would get a shot for another round of direct payments they all said yesso clearly money is a good movtivator for those on the fence Hopefully Biden something up his sleeve to get people to take it in order to get to 70% (and hopefully much higher),Das_Geek_Meister,16202142970,1
gx0jj4z,n4uoij,Please get it done! We here in Canada could really use some extra supply The government decided to get everyone their first shot before giving out the second so my appointments are currently 4 months apart,Bashful2,16202145660,1
gwzg9hr,n4uoij,How is Biden accomplishing this? Tell me exactly what he does Does he walk into a room and sign a piece of paper saying the government will buy and offer x amount of vaccine then assume the percentage of vaccinated adults based on projections he didnt create from data he didnt analyze?,SouthernShao,16201843290,-3
hcdmumb,pll1mo,Frankly at this point every country in the world should have this rule in place for all nationalities Of course a clearly defined exception process should be defined for refugees from countries too fucked up for them to have reasonably received the vaccine by now Outside of that rare situation the fact that most countries dont have this rule for all travelers is indicative of the gap between the current situation and the politics of all world governments,Nocoffeesnob,16313194200,1
hdqgznr,prsbj3,A 16 yo boy had a heart attack after his shot in Singapore It was Acknowledged to be from the Pfizer vaccine shot He sued the Government and won,BananaPuddingx10,16322417380,1
gxg48n1,n7zztl,*offers free beer* *gets more vaccinations than all Erie County* Government: "How can we make sure everyone gets vaccinated?" The evidence is right fucking there Give people incentive lol,cracksilog,16205217210,18
gxg3p4m,n7zztl,Its so sad that some Americans paranoia about their government leads them to make decisions that are harmful to their health and the health of those in their communities Its also depressing that their principles are so skewed that a free beer is all it takes to undermine that paranoia,warongiygas,16205214270,4
gxiee8g,n7zztl,Remember the fried chicken sandwich hype from a few years ago? If the government teamed up with fried chicken sandwich places and offered a free sandwich we would be out of this mess!,YounomsayinMawfk,16205774340,1
gud6mkp,mpzwzj,Honestly I cant tell if this is a good thing or not It shows that the government isnt hiding anything under the rug with regards to these vaccines However I fear that this will just enable the vaccine deniers and give credit to their position,domerock_doc,16183188420,172
gud4io1,mpzwzj,So you have a 1 in 1 million shot of getting a blood clot Huge deal You add fuel to the fire for anti-vaxxers and as a result of that and millions of canceled appointments thousands more will get the virus and hundreds will die Sounds like something the US government would do Way to go,crowd79,16183176310,7
gudlcep,mpzwzj,Well this is a blow to our vaccination plans I wonder if the government will seriously think about going to one shot of Pfizer or Moderna with a long pause like Canada so more people can at least get that protection?,walkinman19,16183259950,1
gudqw2f,mpzwzj,I mean this is really annoying considering my dumbass coworkers already think the vaccine is some wackjob government conspiracy to kill us all,DrGutz,16183284590,1
gudruyx,mpzwzj,From the article: "Dr Schuchat the CDC official said that the risk of dangerous blood clots was "very low" for people who received Johnson & Johnsons vaccine more than a month ago "For people who recently got the vaccine within the last couple of weeks they should be aware to look for any symptoms If you receive the vaccine and develop severe headaches abdominal pain leg pain or shortness of breath you should contact your health care provider and seek medical treatment" she said" In the United States alone 300000 to 600000 people a year develop blood clots according to CDC data But the particular blood clotting disorder that the vaccine recipients developed known as cerebral venous sinus thrombosis is extremely rare Dr Schuchat described the condition as "a severe strokelike illness linked to low platelet counts" All of the women developed the illness within about one to three weeks of vaccination with a median time of nine days Government experts are concerned that an immune system response triggered by the vaccine was the cause ",WestFast,16183288870,1
gudsml5,mpzwzj,Remember that time the government killed thousands of people in order to save 40 from Deep Vein Thrombosis?,SIGINT_SANTA,16183292220,1
guevlq7,mpzwzj,The media loves fear 100% driven by the media and the government fell for it "6 people with clots out oferr 6 million OMG!",crowd79,16183465830,-1
gz93hbu,nj6me5,This is all so strange to me I grew up in Quebec where the medical age of consent is 14 There are some special considerations for teenagers 14-18 undergoing major procedures or being hospitalized But for basic healthcare you even get full privacy protections from your parents At 14 I could have gone to the doctor and gotten any necessary vaccinations without my parents knowledge If I had a disease I didnt want my parents to know about I could see a doctor and get a prescription without any reference to my parents My parents were very pro modern medicine and I didnt have anything embarassing going on so it didnt come up much But I did enjoy the freedom and flexibility of not having to bother with permission slips and being able to go to the doctor alone Obviously this is a lot easier in a place with universal healthcare I just presented my medicare card (or number and expiry date) and the government paid the clinic My parents job or ability to pay was totally irrelevant But it always surprises me when laws seem to treat 17yo the same as babies An older teenager may lack some of the life experience maturity and judgment to make all their own decisions but they have some significant abilities and agency and the law should respect that If youre old enough to be criminally charged you should be old enough to choose to get a vaccine or antibiotics for a UTI or whatever,MathAndBake,16218445350,2
h0j03bg,nj6me5,The government are stake holders in the patents for the vaccine This has not been trialed long enough to know long term effects The vaccine is experimental,goosegrl21412,16227793860,1
hd8584i,pq0mfs,Forcing citizens to act as police is not fair and it very clearly places them in danger because of lunatics like this If the government wants to these rules to be enforced they should provide the police to do it,sealovespdxME,16318969900,-15
hd8gy39,pq0mfs,These are the same people who will scream to allow business owners to discriminate against folks because "you cant let the government tell you how to run your business",LadyBogangles14,16319019000,1
hd9qfj5,pq0mfs,Government passing the buck to business to enforce Make vaccine a requirement to renew your car tag and to use public transport you cowards,WorkingCell8089,16319220670,1
hd9zzdl,pq0mfs,This is what happens when the Government hands responsibilities off to business owners,Clock-Full,16319268080,1
h9c6dze,p6caw4,From his EO in July: >"The new Executive Order emphasizes that the path forward relies on personal responsibility rather than government mandates Texans have mastered the safe practices that help to prevent and avoid the spread of COVID-19" So much for "personal responsibility" and "mastering safe practices" What a clusterfuck!,pnsnkr,16292361570,144
hs7x419,s11bxi,Is so sad but I lost all confidence on the US government We need changes now,berto3127,16419164320,7
hs7u4lo,s11bxi,Wtf is the federal government doing in response? Biden where you at man?,Black_n_Neon,16419152960,2
hs8emj0,s11bxi,Considering how shit we are at controlling the government its probably way worse,sciencefictjon,16419228450,1
hs8107r,s11bxi,China has not been trurhful about anything Coronavirus related from the start Indias cases are widely agreed to be massively undercounted (google it) The next most populous country is the US with modern healthcare massive testing and a democratic and transparent government (please spare any political comments on this point yes we have our problems but really compared to other countries we are doing just fine and you can roughly trust the COVID numbers you see on the news) So really what this means is the the 3rd most populous country has the 3rd most cases Shocker,AlanMppn,16419178680,0
hme4bzd,r42hz6,I know a lot of people who are not exactly big fans of the Israeli government Im probably one of them too However I have to take my hat off and acknowledge that they do seem to have their shit together and are certainly world leaders in helping beat this virus This is probably the first article Ive seen on the subject that id probably believe has some basis in fact,RegularlyPointless,16381007420,135
hmiz70s,r42hz6,It seems like when ever the science in the US says something should be worried about some distance government rushes to say no its fine I cant help but thanks some billionaire is behind the scenes so whatever stock they own doesnt plummet I dont trust anything anymore I have no idea what organization isnt corrupted by The US 1% Im fully vaccinated and so is my 8 year old Ive just read so much shit about our country and the corruption over the past several years They would rather people die than take a profit loss,xithbaby,16381911340,0
h1qm10z,nzm2oo,Folks - this is how science works Even if the results seem trivial and logical scientists just do not assume the conclusions without evidence Based on clinical trials 1/2/3 the scientists ascertained safety efficacy at certain scale Now we are learning that the vaccines are effective in real life situations Thats why the public health guidance from the government may be delayed a bit compared to some of the common sense guidance that some experts recommend - the government is in the business to balance both science and common sense to provide the guidance that can protect the public,xilcilus,16236839630,116
h1rc0v7,nzm2oo,Im sure the anti-vaxxers will insist the numbers are fake or that people like them are being killed off by the government,SnowflowerSixtyFour,16236955570,1
