hc8pmr7,pl59ch,Im vaccinated and personally chose to be But if people think this mandate will do much doesnt know how our government works Checks and balances will not allow this state government will have the true say just like with gum laws and Marijuana Edit- you can downvote all you want Im not saying Im for or against biden doing this Im just stating how our government works,rocco1986,16312285140,18
hc8u521,pl59ch,What happened to civil liberties Funny the government can mandate this but cant mandate police reform voting rights or universal single payer healthcare,4reddityo,16312305680,7
hc94fil,pl59ch,I agree people should get vaccinated if they are at risk and getting vaccinated in general is a good ideabut doesnt this feel authoritarian? If the government can make you get a shot imagine what else they can make you do Before you go calling me an anti-vaxxer I am vaccinated and I encourage others to but I am also very skeptical about giving the government power In my opinion Covid has been the biggest power grab by the Federal government since the Patriot Act and I dont see them relinquishing any of this power anytime soon My argument is simply this: at what cost? Just something to chew on mob who will likely downvote this into oblivion,Rudimentary_Waffle-O,16312352600,5
hc99ltl,pl59ch,so when everyone is vaccinated and the vaccinated outnumber the unvaccinated by a landslide and things dont seem to get any better what will be the new thing we all have to do? its been 2 weeks to flatten the curve 6 weeks to quarantine masks can come off for the vaccinated covid spiking so masks go back on nothing seems to be getting better despite these steps the government has been implementing the job market is worse than its ever been bidens approval rating is in the trash hospitals are losing funding and staffing and are BURNT out so how can we have faith this is going to work without the very obvious ramifications? i get its a pandemic and this is science and its a virus but the hem and hawing of the government isnt getting us anywhere near to a place of semi-normalcy,herefortheoolong,16312375590,5
hc9910a,pl59ch,The amount of disgusting opinions that people have How are you happy that the government is forcing something like this This is overreach and out of their power Wait till they force something you dont find necessary and mandate it,Zerogws,16312373040,6
hc8ypns,pl59ch,I am vaccinated and very upset with anti vaxers however i do find the precedent of what they are able to do concerning i would prefer goverbment incentives grants tax breaks etc but a mandated by government drug requirement seems like a bad precedent,pandaIsMyJam,16312326730,5
hc93i5r,pl59ch,Massive fucking government overreach I was vaccinated the second they were available to everyone but this wont hold up in court,Reddit-is-a-disgrace,16312348430,5
hc8nehz,pl59ch,I want to know if this will override Greg Abbotts ban on vaccine mandates for government funded facilities in the state of Texas? For example UT Health is a government entity and as of now cant enforce a vaccine mandate for employees because of Abbotts mandate Im guessing Bidens mandate will override that? Nothing would make me happier,bubbles2pop,16312274980,1
hc8w8xi,pl59ch,I dont know about the US but if its anything like canada this will never actually happen no matter how hard the government tries,MisguidedColt88,16312315390,1
hca6b6z,pl59ch,Sheesh This is going to be a disaster Companies with 120 people are about to fire 21 Companies with 99 wont be hiring anytime soon Unemployment is about to get real fucking heavy and hard to pay for Higher taxes More inflation Gonna see a spike in homelessness Etc I mean I think everyone should be a responsible adult and get the damn shot but I dont know where Biden thinks he has the authority to force something like this on people I fully support businesses requiring it as their own policy in fact I specifically go to businesses that do require them because I think more should and I want to show my support for the decision But the government mandating that most of the workforce is off limits to specific people is lunacy As annoyed as I get at all the "this is a slippery slope Whats next? Shooting babies???" bs this is a slippery slope Next youll have government mandated trackers that prevent crime in the name of "the good of the public" And youll have the same people pushing for it that said "vaccine mandates Yeah The good of the public Safety Of course" Where is the line in the name of safety? You really want the government to take so much control that you lose all personal freedoms and autonomy in the name of safety? Of course not How do you prevent that? You fight against things like this And if not this then where do you draw the line? Getting rid of encryption? Taking away guns?Allowing your web traffic to be monitored? Giving up your location? Imbedded trackers? Sterilizing specific groups? IQ tests to vote? Where is the line before its an authoritarian domination of the citizens? Smh this is some crazy shit to see in America,Stolen_Oyster,16312552850,-5
hc930rf,pl59ch,What about the people who receive governments welfare (Medicaid FAFSA Student loans food stamps SSI etc) If they want to penetrate the populations most against vaccination those areas are good places to fill in the gaps,iHaveAFIlmDegree,16312346310,1
hc93gzz,pl59ch,He should make it mandatory for everyone on some form of government assistance like unemployment or rent relief or social security?,BodybuilderOnly1591,16312348290,1
hc99rpx,pl59ch,Man if the government only used this much power to stamp out smoking too,KomputerIdiat,16312376300,1
hc9veby,pl59ch,People can be convinced to give up freedoms when emotions are high or a threat is near The government never really gave up the power of the Patriot Act and theyll never give up any power we give them now either,WisherWisp,16312479740,1
hca29zg,pl59ch,Just wondering if Roe v Wade stands on 14th amendment rights such that the government cannot violate your privacy by forcing something on your body how is a government vaccine mandate not unconstitutional? I want to support both but I am having trouble finding consistency here Of course the morality of it is plain as day but how can we make our laws reflect that?,Paradoxa77,16312523890,1
hcasdo6,pl59ch,Seems like a fine order to me I know many will hate it but governments and businesses have long mandated vaccines You want a green card or citizenship you need to prove you are vaccinated against several diseases If you you cant well you get a handful of shots at the same time Businesses mandate certain vaccines before allowing people to travel to certain areas of the world I think in the end the people that are going to complain about government overreach are going to find out what the laws actually say about this The federal government has played nice Theyve decided to stop to try to save some lives Of course knowing full well that the complaints will be coming from people that already dont vote for them,tantalum2000,16312733900,1
hcauyem,pl59ch,Another horrible overreach by government It happens more and more People just accept it,Zealousideal-Fan-409,16312749610,-3
hc9bxk3,pl59ch,Its amazing that you people cant see how this is overreaching You shouldnt want this much government involvement in your life decisions People that have already had and recovered from COVID are still being pushed the "vaccine" People that likely will be fine even if they caught COVID are still pushed to take the "vaccine" If youre at risk take it If youre worried take it Leave it at that,all-that-is-given,16312385630,-5
hcavkfn,pl59ch,I dont support this The federal government shouldnt have the authority to mandate vaccines for ordinary workers That goes against federalism and preserving our system of government is far more important than any one policy,floof_overdrive,16312753210,-5
hc9iwww,pl59ch,Now extend it to government disability payments since the vast majority of people on disability are pablum-puking republicans,zonk3,16312417040,-1
hc8ig6a,pl59ch,Why was nothing said about boosters if the government will know around Sept 15th what the plan is?,throwawaynomad123,16312252800,1
hcb7ase,pl59ch,Im vaccinated Felt pressured to do so and kinda regret doing it Been having constant headaches ever since I took my second dose months ago These vaccines are so new and untested that it makes me extremely nervous that the government is going to force people to take a shot they know little about Scary,spoobs01,16312813490,1
hcb88t8,pl59ch,"Biden is also signing an executive order to require vaccination for employees of the executive branch and contractors who do business with the federal government" The morning after his last speech about federal contractors federal contractors got a memo saying theyre not getting any time off to get the vaccine or for any effects So I guess youll get written up if you follow the EO nice,Clownski,16312817720,1
hef8dq1,pl59ch,You people have no care that the federal government was never intended to have this much power But then again you probably havent witnessed vaccine-induced strokes Which the FDA has admitted to,TheGnosticCouncil,16327073660,1
hf42u3z,pl59ch,Ive been vaccinated but I see danger in allowing the government more control over our bodies than they already have Im curious how many people would be in favor of other hypothetical Government Mandates if the mandates didnt fit their politics or choices 1 The new Republican President mandates all adults must own and carry a hand gun to lower crime 2 The new progressive Progressive President mandates that an entire generation must be sterilized to prevent global warming 3 The new Republican president mandates no abortions to support nationalism 4 The new Progressive President mandates all citizens must be DNA tested and those with more than 50% Caucasian DNA must pay reparations to those with less than 50% Caucasian DNA,peterlunstrum,16331916530,1
hc9d96e,pl59ch,Funny how all of these empathetic people of certain political leanings are jumping in joy at people losing their jobs and being unable to collect unemployment Its always been a game I wonder how it would go down in the government mandated BMI tests weekly and made people lose their jobs if they bought Cheetos inb4"obesity isnt contagious" vaccines and masks protect you bud covid is about as contagious as obesity if you play it right [https://jamanetworkcom/journals/jamapediatrics/fullarticle/2668504](https://jamanetworkcom/journals/jamapediatrics/fullarticle/2668504),KKV,16312391470,-5
hc9gbh3,pl59ch,This is unbelievable Government overreach and will put a lot of employers in a very tough position especially with unions Regardless of how you feel about the vaccine Im unsure how anyone can approve of these types of mandates This is similar to the horrible laws just passed in Texas,Clock-Full,16312405120,-10
hc9a95o,pl59ch,Apparently anything done by the government now comes by "executive order" so its a 4 year dictatorship then all of them are reversed Yes I know thats a stretch but it is weird,burtron3000,16312378430,-2
hcaza2r,pl59ch,Wait I thought this was going to just be the federal government This is basically EVERY employer now? Or am I reading this wrong?,LHTMMB,16312773920,-1
hcb59wm,pl59ch,General question but how is it legal for the federal government to issue a mandate since that power is not included in the Constitution? Public welfare and health fall under the states so they could possibly issue mandates,jshamm,16312804130,-1
gv31d96,mtzjkn,Live updates in India are reporting about the government opening up vaccination to all adults from 1st of May,saywhathellnaw,16188420800,59
gv4f7zw,mtzjkn,As a Canadian I am sorry for anything sarcastic or damaging comments made about the states Our government up here couldnt organize their sock drawer,Canadianclassy,16188633920,6
gv2y2ug,mtzjkn,This is fantastic however we are starting to "hit the wall" as they say The country will "cap out" at somewhere between 50-60% of all adults vaccinated - not nearly enough for herd immunity especially since kids arent vaccinated Since the government has said they wont mandate vaccination industry and businesses are what will save us Employers are starting to mandate vaccination if you return to the office A few stadiums are mandating if you want to attend games Cruise lines are mandating as well Once kids can be vaccinated you can bet school districts will make it mandatory I think once the FDA grants full authorization of the vaccines instead of just emergency authorization youll see most companies mandate it because of business liability insurance Airlines will do it and certainly if you want to travel overseas youll have no choice but to get vaccinated In other words right now people have a choice They wont forever unless they want to never fly or work (in most jobs) or go to school,TinyGoldCharm,16188405480,13
gv3sguz,mtzjkn,I hope that the reason why we are moving at such a quick pace is that a significant amount of people are not going to get vaccinated by a still in trials vaccine So the government now has millions of vaccines but not enough people willing to take then so they keep on lowering the threshold Unless I missed something it was supposed to take months as the vaccine producers already had everything set up for different countries and their supply chain was at a limit,trolololoz,16188536060,-12
gw80t1q,n0j4gg,I honestly think the biggest thing here is that we really need a school system that teaches critical thinking and problem solving I used to listen to that podcast quite a bit but was tapering off a lot before it went over to spotify (which killed it to for me entirely) I felt like there was a fair amount of honest discussion and points were brought up that I wouldnt think of myself There was also plenty of stuff I completely disagree with Theres also a ton of banter and half cocked joke ideas I dont listen anymore so really dont know or care how this particular podcast went The real problem is that people are so devoid of the ability to think critically that they cant evaluate a statement its context and whether its coming from a place primarily of opinion vs research etc If it is given as actual advice does it actually make sense? Who are the guests? Are they experts what credentials do they have who do they work for are they bro-ing it up by bullshitting/bantering on a podcast or are they seriously describing their field of study? Are they trying to make themselves look good? Etc etc If Joe Rogan (or anyone else expert or otherwise) looks you in the eyes and seriously tells you something like "Cigarettes arent bad for you its all government propaganda" I would hope you have enough going on in your head to think to yourself "hey that probably isnt right" Maybe dont live your life by that advice just yet This is true of people who both love and hate this podcast There were plenty of instances where something was said that people heavily criticized that were clearly off the cuff remarks or jokes Theres also things that were said with authority and under the guise of expertise that were flat out incorrect or misinformed Taking a celebrity as the end all of where you get advice from is a terrible idea Even statements coming from experts are usually worth internalizing and thinking about but also checking up on and doing a bit of research for what the general consensus is and how it applies to your unique circumstance,cheapseats91,16196457420,58
hetfvn3,pxv04x,The westerns believe they live in a free society that does not have government propaganda The hard truth is the western governments have more advanced way of brainwashing which is done unnoticeably by private organizations and social medias,mrdorian,16329793060,2
hereb5g,pxv04x,"Im okay with big corporations controlling information as long as its not the government!" - Reddit,CatKatOrangeCat,16329439900,3
heq43i2,pxv04x,Appreciate the effort but I doubt it will make a huge difference Based on what Ive seen from the anti-vaccination crowd this will just make them double down and scream louder Plus theyll play the whole "unfair censorship" angle to try and make themselves look like innocent victims "trying to spread truth against evil government/pharma/whatever" I am so tired of these people,weekend_here_yet,16329251020,3
her9yt0,pxv04x,I remember when I was a kid in the 80s and they passed a law banning food companies from putting colourful crazy pictures on food boxes so as to draw in children If we saw ninja turtles on a box of diabetes bombs wed beg our parents until we got it Then the government banned that for the health of children I think same rule should apply for adults because a lot of them are still very impressionable Just like when they were children And the government should protect them from predatory marketing practices,MeisterJTF2,16329422140,1
heqpw7h,pxv04x,What an empty statement This would have been much more effective as a collaborative effort from TikTok YouTube Twitter and Facebook about 18 months ago Doing this now is going to accomplish nothing What was needed was a complete removal of all misinformation from all of the major social media giants but they were ***ALL*** too greedy and raking in that sweet sweet money As a reminder to Americans [this is your first amendment](https://wwwlawcornelledu/constitution/first_amendment#:~:text=Amendment%20Ifor%20a%20redress%20of%20grievances) Nowhere in there does it state that a non-government owned corporation which is literally all of the ones I mentioned above has any obligation to host your unwanted unnecessary and extremely incorrect bullshit And for any "Yeah but" folks thinking of commenting Just dont There is zero reason why any of these massive corporations couldnt have allocated even a small amount of resources to establish a covid-19 specific taskforce that looks for content related to the virus and verifies the authenticity,MenstruatingMuffin,16329340010,-1
her3mj3,pxv04x,YouTube CEO Says Google Sees Free Speech as Core Value in Russia [https://wwwbloombergcom/news/articles/2021-09-26/youtube-ceo-says-google-sees-free-speech-as-core-value-in-russia](https://wwwbloombergcom/news/articles/2021-09-26/youtube-ceo-says-google-sees-free-speech-as-core-value-in-russia) *Asked about the removals Wojcicki said YouTube considers free speech a "core value" of its platform "But when we work with governments there are many things that we have to take in consideration whether its local laws or whats happening on the ground" Wojcicki told Bloombert Television "So theres always going to be multiple considerations"* aka "We believe in it just not enough to overcome the money offered to follow the rules implemented by countries that use our platform",TheArkIsReady,16329395880,1
heruqgs,pxv04x,Get used to all your content being catered by the government Just because the US government did all those horrible things decades ago doesnt mean theyll use a pandemic to do it again right?,wagonage,16329506560,1
gxm5d9c,n913zt,Imagine how good their masking must be to keep the death rate in check considering how old the population is yet only 1% vax rate Their fear isnt wrong one wildfire variant and their population is going to look like Brazil or India But sure is strange their government cant coax people to get vaccinated as a culture in general they are amazingly disciplined I mean they take their garbage home with them from the street and even clean up in stadiums after themselves/others can you imagine that ever happening in the USA? We have people in my parking lot here 10 feet from a dumpster who will empty all the trash out of their car onto the ground while looking at the open dumpster,thaw4188,16206589550,-1
gxm01n7,n913zt,I think there were news reports of one of the vaccine companies (Pfizer?) offering vaccine for all participants Perhaps as an alternative to cancelling the Olympics they should close their borders only to the un-vaccinated There will no doubt be problems with this approach but show me an alternative that doesnt involve problems The Japanese government will still have to address spread from their own population,Wambo74,16206566050,1
gxmonua,n913zt,Its May Vaccines have been available almost half a year in most places to at least some of the public All the excuses and reasons I see here aside it looks to me like the government does not want to vaccinate the public And yet they want to host an Olympics,TiesThrei,16206671360,1
gxmvcgc,n913zt,I have no clue about Japanese government because I didnt deal with them except at immigration in Fussa My wife and I had to sit for a while one time because some gadget or machine was not working to check us in It was done manually Obviously we were a guest of the country so waiting was OK We went to Japan many times via Space A to Fussa (Im retired military) and their luggage search was inconsistent Sometimes thoroughly and sometimes not at all We got a more thorough search at an Australian grocery store! My point is the officers exercised out search iron their own discretion not with procedure Off topic but in California a lawyer (in law) and his family refuse to get vaccinated or wear a mask My wife was a masker but hesitant to get the vaccine but she finally did Her mother is suspicious of her now My point is if educated (lawyer and my wifes brother (98% sat score)) are anti ) I have no clue about human behavior Japanese immigration and other countries exercise broad flexibility in my experience Highly educated US individuals and high IQ individuals are anti vaccine This is my personal experience with these people It could just be isolated incidents,DavidNipondeCarlos,16206699590,1
gxn82w3,n913zt,Japan confuses me What is their form of government? Is it capitalist or something else?,Red-White-Green,16206753120,1
gxm2z19,n913zt,So maybe this is a dumb question but people are scared of the virus but also dont want to get vaccinated? Based on reading some of the comments I guess Japanese are wary of vaccinations based on the past So how do they expect to get past covid if no one is willing to get vaccinated? Or is it more something with the government not properly distributing the vaccines that they currently have along with citizens wary of vaccinations?,TheSideJoe,16206579090,0
gzs4w8u,nmyxt1,There will be lawsuits on this Not regarding the private entities as there is no claim for that but against the governmental entities taking taxes and surcharges under a disparate impact theory If they are collecting higher taxes for tickets to the same venue then there is state action on this that can be actionable,Triumph-TBird,16222225670,2
hplo8jh,rm4ymn,Weird you wouldnt know by the way the Canadian government is reacting rn,DSpot45,16402060370,1
hpnfovl,rm4ymn,Tomorrow a study is going to say that Omicron has 50% higher chance The media is exacerbating this pandemic They are spreading baseless fear (we dont know anything for certain) as clickbait to make money and its making everyone lose faith in vaccines and the governments ability to make the right choices,Shapen360,16402380000,1
hpkno9h,rm4ymn,This is in line with what other studies are pointing out The next important question is whether or not Omicron is greater than 4x more contagious than Delta which I dont think there are reliable studies for yet If the R0 for Delta was 1 and the R0 for Omicron is 4 does that mean its 4x more contagious? Because that could mean that hospitalizations will still rise in Omicron dominant areas Locally our Omicron is increasing fast as well as our daily positive cases but so far hospitalizations are fine The New Year will be the big indicator I think Were getting tons of free home test kits from the Canadian government for Christmas gatherings at least which will keep some asymptomatic omicron cases home and away from vulnerable parents/grandparents,Mike-Hawks,16401912610,1
hppvz9a,rm4ymn,i think i have it now my symptoms arent on the government website to make me eligible for a test my ribs hurt and my neck and back of my lungs feel like I been ran over has any one else had these symptoms ?,adHD-Gamer,16402881400,1
hplvjg8,rm4ymn,Its the 20% difference and its potential of overwhelming health care systems which has governments worried,dhunter66,16402090370,0
hpo0n1x,rm4ymn,Yet the government will pretend its more deadly than it ever was Im lucky enough to know noone hospitalized for covid I know one hospitalized by the vaccine though Omnicron looks like a slightly worse cold so lets hope for it to take over for delta and allows us to get some privileges back Even the common cold can put some in the hospital You typically know if it will Make sure those vulnerable have their vaccine and hope enough around them help them out and get it i have been seeing some right leaning youtubers trying to debunk the dumb vaccine misinformation and maybe trump will say it so the grandmas can make it,darkmage1001,16402536290,0
gy0z3gu,nbi105,All the people rushing here to brag how theyre still gonna wear masks Ok? Lol Good for you? No one cares its a personal choice? Just dont harass people that take them off or youll become one of those anti science people that this sub loves making fun of  Sorry had to get that out anyways this kind of messaging is loooong overdue and I hope local governments implement this policy ASAP Will I still wear masks for places that request them of course And for the comfort of others but I do plan on stopping soon as this gets implemented,misteranthropocene,16209407680,3
gy03hfu,nbi105,Thanks we knew this months ago The government needs to do a better job relating actual info and real standards Otherwise theyll continue to see additional pushback,TuskenRaider2,16209276600,3
