gv4prbr,mtzjkn,If you need help finding an appointment try [VaxBot](vaxbotme) Were a free anonymous Chatbot that works with XMPP chat apps You download a chat app (or already have a compatible one) and just click the link on our site We send notifications when appointments are available within 25 miles of you Were an anonymous free service and do not accept donations This is being done as a public service Weve sent over 7M appointment notifications and have over 30k vaccination sites in our database,manymorevices,16188679870,2
gv5lrym,mtzjkn,Republicans: "i aint done no vaccine Giving govermunt my gps coordinates",psgr2tumblr,16188838560,1
gv5zsa0,mtzjkn,Im 38 and got my first dose about 4 weeks ago and got my second dose Wednesday The first was a process cause it had just opened full on in Ohio the second I was there for 20 minutes Montgomery county health has a pretty great system at the Dayton Convention Center I will say the second dose of pfizer nearly put me down (felt like a real real bad hangover) my 16 yr old SD was down with a headache I was at the grocery pharmacy picking up prescriptions and a nurse walked by offering up extra shots and no one took her up on it Some even openly protested and/or trolled the nurse in public,Pinkfoodstamp,16188917670,1
gw84osn,n0j4gg,Rogan and candice Owens both need to just go live their weird little lives out of the public eye Take Tomi with them,bemery3,16196474900,5
gw781rh,n0j4gg,The fact that this needs to be said at all or addressed publicly is an absolute disgrace Not so much "young people should get vaccinated"; but rather "please do not pay Joe Rogan any attention on the topic of vaccinations" Just a sad point for us as a human race that a leading virologist needs to address a random podcasting personalitys ramblings about a subject he knows virtually nothing about So that young people can get vaccinated During a pandemic Edit - kinda shocked Im getting downvoted but I guess Rogan has more fans on Reddit than wed be comfortable to admit To then I say sincerely: get vaccinated,FabriFibra87,16196335850,8
gw7yg68,n0j4gg,The damage is done I really wish these people would think about their responsibility to the public when they have thousands and millions in their audience Its one thing to spout off an uninformed opinion to your group chat another when its a worldwide podcast This isnt just about you and your thoughts and feelings anymore The most frustrating part of this is that the rebuttal is so simple - okay maybe young healthy people dont need to worry about severe cases of Covid We have known that from the start But young and healthy people can still get Covid and pass it on to others who may not be so young or healthy Public health - its in the name!! Its about other people more than yourself sometimes! Also all the emotional panic about "jabbing your kids" okay dude so dont get your kids vaccinated But kids cant even GET the vaccine right now! So lets all talk reality,canering,16196446960,3
gw7liv7,n0j4gg,Time to cancel Spotify Premium Im not paying them to pay Joe Rogan to spread bad public health information during a pandemic,tryingtolearn_1234,16196392720,-3
heqltgh,pxv04x,>I think we have to ask if this wont have a chilling effect on open discussion by moderate voices Im subscribed to the channel of an MD on YouTube who discusses COVID-19 vaccines etc He is very careful to (repeatedly) point out that he is vaccinated he has personally vaccinated hundreds of patients he encourages everyone to speak to their doctor and follow their recommendations believing that the vaccine is beneficial for the overwhelming majority of people But for all that he has had videos taken down and worries that it will happen again > >Months ago he was insisting that the people who had contracted COVID-19 and who had antibodies in their system may not need the vaccine Now we have a number of studies coming out to support that But months ago that was "anti-vax" (employing the slanderous use of the term) > >People are going to cheer that "wackos" will no longer have a platform Its not the wackos we should be worrying about Its the stifling of legitimate public debate the stifling of legitimate voices who find themselves in the minority [https://newsycombinatorcom/item?id=28693060](https://newsycombinatorcom/item?id=28693060),Tymon123,16329323980,4
heqi4tp,pxv04x,Banning this content does nothing but strengthen these weirdos arguments and beliefs What these tech companies need to do is stop their algorithms from recommending this nonsense to people but that would affect profits and we cant have that Tech companies have known what they need to do far longer than its been an issue dividing public discourse but the real solution means cutting profits and thats something theyll never do unless forced to Banning this content gives the impression of doing something solving absolutely nothing and making the problem potentially worse but they get to keep making billions off of our outrage Fuck these tech companies,PissNBiscuits,16329309140,2
heqk5uk,pxv04x,Better late than never Republican whack jobs are being squeezed from all sides They are losing this battle particularly in the morgue,grandmadollar,16329317310,-2
her2wqp,pxv04x,I understand a lot of people have concerns about censorship and "big tech" but this is clearly a good thing And ill be the first to admit that in regards to "big tech" that some discussions absolutely need to be had but were far past the point of discussing "are vaccines good for you?" The answer is yes The scientific community has spoken and weve had a general consensus about the validity and effectiveness of vaccines for decades Yes with anything medically related there are always risks involved but anti-maskers and anti-vaxxers are being completely disingenuous about those risks Millions and millions of people for decades have taken all sorts of vaccinations and lived side-effect free Vaccines have been mandatory for things like public schools for **decades** Censoring this type of bullshit content isnt an indicator that were living in this liberal dystopian future that a good amount of these anti-vaxxers seem to think were living in Its basically tantamount to removing those videos where idiots were dying from eating those detergent pods Weve 100% reached a point were we know that anti-vaccine beliefs are wrong Enabling people to continue to put out factually misleading content about vaccines is basically like promoting that drinking bleach is good for you This type of censorship whether you believe it or not is 100% for the greater good Anti-vaxxers are wrong If you believe that vaccines are some sort of liberal conspiracy perpetrated by the deep state lizard people you should be in a mental institution I ultimately feel bad for everyone who has fallen pray to bullshit conspiracy theories and are the victims of a poor public education system but now the health and wellbeing of my family and myself are at risk and its time to put an end to these dangerous beliefs Take away their ability to communicate with the masses and allow them to find some niche piece of the internet where they can be in their echo chamber in peace without risking spreading their misinformation to the rest of us,chadstark89,16329392940,-1
her6823,pxv04x,Which ironically further cements their ideas and puts them underground where their ideas will grow and fester outside of the public eye So in other words good job for making the problem worse Google but hey "out of site out of mind" right?,Slow_Mangos,16329406620,1
heswtnn,pxv04x,Its better than nothing but this feels like it will do more damage than good because its way too late This just screams coverup to whoever thinks its all a conspiracy I think if anything it would be smarter to sponsor a big celebrity to be publicly anti-vax and then "do research" on a "non corrupt fully researched vaccine company" that is literally a recycled brand "Guys all the others are corrupt but I personally have verified that *these* guys are legit They said a *real* vaccine hasnt existed yet and only now are real ones going to be available! Stay tuned for a month!" This is just my opinion You cannot tell idiots to stop being idiots but you can speak their language,SethGekco,16329684420,1
gxmonua,n913zt,Its May Vaccines have been available almost half a year in most places to at least some of the public All the excuses and reasons I see here aside it looks to me like the government does not want to vaccinate the public And yet they want to host an Olympics,TiesThrei,16206671360,1
gxn8dul,n913zt,Japan seemed to do well controlling the virus but failing on vaccinating the public The latter is not much different in other countries,HIVnotAdeathSentence,16206754410,1
gzv4m6h,nmyxt1,Wow so happy we are making a two tiered society Now we can laugh at the impoverished unvaccinated underlings I cant wait to make them suffer their whole lives for choosing not to get the shot Honestly maybe they will all just die from Covid HAHAHA It wont make any difference to the good tier of society who got vaccinated cuz we cant get sick!!! wait if none of us can get sick since we got vaccinated why are we doing this again? OH YA THEY ARE REPUBLICANS TOO In that case I say unvaccinated get gassed Whos with me?,TyRyOnLieLine,16222904570,1
gzs6z7r,nmyxt1,Republicans glad to pay $1000 Hail covid,ravinglunatic,16222234750,1
gzt7jz7,nmyxt1,Republican tax,NewSouthWhales-,16222407150,1
hpjxe0s,rm4ymn,**Omicron Has 80% Lower Risk of Hospitalization New Study Shows** * Once admitted risk of severe disease is the same: NICD data * Compared to delta odds of severe omicron disease is 70% lower South Africans contracting Covid-19 in the current fourth wave of infections are 80% less likely to be hospitalized if they catch the omicron variant compared with other strains according to a study released by the National Institute for Communicable Diseases Once admitted to the hospital the risk of severe disease doesnt differ from other variants the authors led by scientists Nicole Walter and Cheryl Cohen said Compared to delta infections in South Africa between April and November omicron infections are associated with a 70% lower risk of severe disease they said The omicron data was collected for the two months through November Since being identified by South African scientists on Nov 25 the omicron variant has fueled record case numbers across the country Africas most developed economy has fully inoculated about 44% of its adult population over a seven-month period &#x200B; In the data that are being submitted to a preprint medical publication -- MedRxiv -- the authors adjusted for various confounding factors that could influence the results including age gender and whether the cases were known reinfections For severity of disease after admission they also adjusted for the presence of other illnesses and prior immunization The study also showed that those with omicron may have higher viral loads The study is "important" though its use of so-called historic controls when comparing to the delta infections between April and November means its outcome may be biased by time issues said Paul Hunter a professor of medicine at the UKs University of East Anglia "So even though cases of omicron were less likely to end up in hospital than cases of delta it is not possible to say whether this is due to inherent differences in virulence or whether this is due to higher population immunity in November compared to earlier in the year" Hunter said The authors flagged the same limitations,b3atballs,16401793260,233
hpm9a9b,rm4ymn,I keep hearing this but I also hear its really just as dangerous as delta Guess we just need more data,Public_Ear_8461,16402149320,1
hpkl5db,rm4ymn,Please dont tell republicans this,supaflyneedcape,16401902410,1
gy1kg99,nbi105,No I realized how much I like hiding my face in public There are 42 muscles on the human face I never know what to do with any of them,zetsubou_sensei,16209515770,7
gy19i2p,nbi105,Im over masks I did my part Now Im vaccinated Ill still wear one if required by a business or public transit but screw anyone that judges me for not wearing one outside,drwchampagne,16209459580,2
gy09erz,nbi105,Yeah fuck that Im masking up in public for life People are nasty I like masks,Draemalic,16209300640,4
gy145xw,nbi105,Great Now can you get my work and the other public places I frequent to not make me wear one? While youre at it how about the train I take to work?,IDrinkMyOwnSemen,16209433040,2
gy05t13,nbi105,Why would I want to look like a republican? Im gonna Imma keep wearing mine for a few more months for the most part,zhentarim_agent,16209285960,1
gy03rk0,nbi105,I am really struggling with this We were supposed to be wearing masks when outside before this? When I am out for a walk I never wore a mask When I was ice skating I never wore a mask When I walked from my car to a building I put my mask on in preparation for entering When inside a public place I wore a mask except when eating or drinking I am struggling to understand what has changed now that I am vaccinated When I am inside I still should wear a mask right?,NecessaryRhubarb,16209277750,1
gy058mk,nbi105,Yeah but no thanks Im fully vaccinated and no one will take away my right to wear a mask wherever I please An attack on **my freedom** if you force me to not wear a mask See how crazy that sounds? Wear a mask if you want to Dont wear a mask if youre fully vaccinated and not in a close proximity situation *or* if youre a fucking idiot I will be wearing a mask in every public environment if Im interacting with people outside of my circle The last year of being invisible in grocery stores has been a gift Plus I didnt get sick at all last year Masks work people,Flyinx,16209283750,1
gy0wg2o,nbi105,It is not "incivility" to say Faucci lied to Americans when the pandemic was new and told us not to wear masks when he KNEW this thing was airborne - heres the video [https://wwwyoutubecom/watch?v=\_2MmX2U2V3c](https://wwwyoutubecom/watch?v=_2MmX2U2V3c) and here [https://wwwyoutubecom/watch?v=QIfVIKyzYws](https://wwwyoutubecom/watch?v=QIfVIKyzYws) Faucci lied to Americans and hundreds of thousands died because of him Faucci has created mistrust that is well earned The PPE he allegedly was reserving for front line workers was locked up by administrators of for-profit hospitals and denied to front line health care workers - that has also been documented It is not "incivility" to tell the truth Nobody should believe a word he says Telling everyone they dont have to wear masks if they are vaccinated has been directly contradicted by many epidemologist including this one Dr Eric Feigl-Ding u/DrEricDing Epidemiologist & Health Economist Senior Fellow FAS and alum of Harvard Johns Hopkins and Harvard EPI He says: "15) Ive talked to many doctors and public health scientists about this (emphasize on public health experts not lab Test tube experts) and many are saying its "bananas" [https://twittercom/DrEricDing/status/1392924503139885058](https://twittercom/DrEricDing/status/1392924503139885058),ktho64152,16209395940,1
gxzu98l,nbi105,That was a very stupid statement to be honest I will keep wearing my masks for the next 2-3 years maybe forever in public or when I buy food no matter what No reason to stop wearing masks,mkdr,16209237860,-10
gy028c0,nbi105,No I dont think I will Personally Im going to keep wearing my mask whenever im in the public even when the pandemic is over Havent been sick since wearing a mask and its amazing,Masterhungblow,16209271420,1
gy0ch99,nbi105,I dont think this is a good sound bite Note the "go outside" How much you want a bet that this will be taken as you dont need a mask anymore Or even pandemic over! So not only will the completely vaccinated be inside public spaces w/o masks but those anti-vax anti-mask will be out in the same enclosed spaces without any push back because "theyre fully vaccinated",Doomdoomkittydoom,16209313460,1
gy0fw5t,nbi105,I can see it now fauci flip flops on mask mandate is now saying no need to wear a mask in public only if you have a vaccination id,wildmonster91,16209327390,1
gy0kdir,nbi105,Now watch as Republicans suddenly decide they want to wear masks just out of reflexive opposition,Wasteland_Mystic,16209345640,1
gy0lsee,nbi105,I wear my mask outside the house at all times for two reasons 1 I dont want to be mistaken for a Republican 2 I bike to most places that are near me instead of driving so I wear a mask to flex on the morons that claim they cant breathe,RTSUbiytsa,16209351380,1
gy0pii7,nbi105,Fauci: mask sure to wear the your mask whenever youre in public People: oh okay for sure! Fauci the next day: okay except if youre outside People: oh alright yeah thats what Ive been thinking too! Oh i love the irony,CrossBonez117,16209366560,1
gy0zfnj,nbi105,Oh wait no dont do that! Wait maybe do that! Okay back to two masks but only on public transportation Oh wait nevermind back to one mask!,GiraffeCabbage,16209409440,1
gy11kzt,nbi105,How does this work if were out in public though? Whenever an employee somewhere says to wear your mask you just flash your vaccination card and youre good to go? Are they going to verify each individual person if half the people in there arent wearing masks? Dont get me wrong Im super excited that weve reached this point but I just have no idea how this is going to be implemented,thesenate92,16209420490,1
gy1cr9q,nbi105,I feel like a good system to make sure people who are not vaccinated to keep wearing a mask and not lie about being vaccinated is those who have been vaccinated get a code via email text or whatever and then there will be a website or app with like [insert code here] and [insert picture here] (more on that later) and when u enter the code u get a new green screen but in the background of the green screen (it would be faded) it will have a picture of you that you just inputted into the system that way it will be a lot harder for them to get away with it Also on the bottom right it can like have your code or something or a bar code they can scan to make sure its legit By "they" I mean like whenever you walk into a public building It sounds like a lot of steps but I think this will discourage people from cheating the system When like 75-80% of US adults are fully vaccinated then we can finally say fuck it and we dont need the green screen anymore,Chungulungus,16209475990,1
gy1hvic,nbi105,Im still going to wear my mask in public places and outside Its to respect those that died and didnt get to make it to this point,Lhumierre,16209502400,1
gy1i25n,nbi105,As a Brit who wangled his first jab in January and has been politely going along with the social norms since then Im happy to keep doing so for as long as seems reasonable Ive been out and about meeting friends getting public transport popping on the mask as and when its expected As have my mates as seems the kids that go to the school across the road Weve got our fair share of contrarians here but the silent majority seem quite happy without making a fuss of it all Im sure Fauci would prefer keeping up on the basics but youve got to play the audience (and expected compliance) Im a cautiously optimistic Brit myself and Im betting on us being on the home straight too but the risks of a variant throwing a spanner in the works are real,aslate,16209503360,1
gy0auof,nbi105,Im keeping my mask when outside in public man People straight up used to spread so much bacteria around that honestly I feel safer with the mask I cannot imagine how much PTSD all of us are going to have when some semblance of normalcy returns,RembrandtEpsilon,16209306660,-2
gy0q0q7,nbi105,Him and the cdc should not be saying this in my opinion They should be guiding the public as a whole No were just going to have people lying about their vaccine status when they try to go to a store without a mask,_Sasquat_,16209368670,-2
gy1tg8l,nbi105,I would ideally err on the side of caution and disagree with the statement by Dr Fauci because of following (I know I might get downvoted but as someone who belongs to a family of doctors including medical researchers I would like to put in my 2 cents): 1) Masks are not only supposed to prevent you from getting infected but also prevent your mucus/ nose droplets from going out when you sneeze It has been a proven fact that it is more critical for an infected person to wear a mask than a healthy person who needs protection Moreover it has been proven that fully vaccinated people can still be asymptomatic carriers of the disease So there is a chance if vaccinated people do not wear mask in public places they might end up spreading droplets and infecting people given they are asymptomatic 2) There is a potential that this will encourage a lot of non vaccinated people to stop wearing masks in public by falsely claiming they are vaccinated I am not saying that everyone will do it but even a minor section does it it might break havoc especially as some of the new variants are highly infectious 3) Look at countries who have really done well in controlling numbers eg Singapore Apart from very effecting tracing and isolation measures mandatory masks at all public places except while doing intensive exercises (ie running in a park/ or road gyms get closed the moment cases shoot up) is one of the key factors which has limited transmission in workplaces malls beaches etc Again I do not mean to undermine his statement as he is a very learner doctor but just highlight some of the possible downsides Peace,TowardsFitness,16209563140,-2
gy13wgp,nbi105,"and outside" If I owned a business I would print that in bold letters and put it on every window door table flag pole everywhere I feel bad for those in retail the service industry or those who work with the public in general If it was bad before having to argue with anti-maskers its going to be far worse now,hammnbubbly,16209431710,-1
gy0nx6v,nbi105,Im fully vaccinated but Im not going to be taking my mask off in public anytime soon Id hate for people to think Im a republican or even worse Id hate if Republicans came up to me spouting their nonsense thinking Im one of them,valvin88,16209360080,0
gy0p1w0,nbi105,But I dont want people thinking Im a republican!,derangedlunatech,16209364630,0
gy0xc70,nbi105,The problem is that its impossible to tell whos vaccinated and who isnt and theres been so much ill-will and disregard for science and common decency during the pandemic that a basic level of trust just isnt there for me I worry that being less cautious will get a lot of people sick before they can get vaccinated I made my partner begin his vaccinations the day the general public was able to and he wont be immune for another week or so now that hes had the second shot,Squeak-Beans,16209399900,0
gy1qud3,nbi105,As a person on Twitter posted: >I wear a mask more so not be confused as a republican,rustyseapants,16209549370,0
gy22wia,nbi105,Not a chance I am never going into public without a mask again,jmaximus,16209614210,0
gy2c3mz,nbi105,Am I fine to disagree with this? I still want to protect others whom havent gotten their vaccine Me going outside if I have received my 2nd vaccine without a mask would be disrespectful I live in the UK and would rather wait another year if possible so that almost everyone has received it before I take it off in public,Nemesiii,16209670420,0
hekoi2a,pwnzza,His son is a neurosurgeon Happy to see he takes public health seriously,ScarlettPlumeria,16328192690,2
hejxrit,pwnzza,The public is back to listening to athletes and celebrities again? Is it only because its something people support?,HIVnotAdeathSentence,16327996460,0
gzvwvrs,nniy3y,Lol the Republican tears in this thread sustain me Bunch of crybabies,bobswowaccount,16223068300,2
gzxqtll,nniy3y,As they should but I still wear a mask in public Because I care about those who have not received a vacation yet Also I dont want anyone thinking Im a GOP supporter,kee-mosabe,16223427390,2
gzv3p3f,nniy3y,Companies that refuse to assist in public health emergencies should be boycotted,PineConeGreen,16222897480,0
gzvru5e,nniy3y,Ooh this will be a fantastic way to infuriate weak republican losers,t00lecaster,16223042400,1
gzvzjr1,nniy3y,Republicans hate businesses when? Its almost as if spending decades allowing companies to walk all over their employees has allowed a situation where employers can walk all over their employees While I fundamentally disagree with letting companies exert this control over their employees I must admit I am excited to watch these people experience the consequences of their own decisions,mofukkinbreadcrumbz,16223081890,1
