h7bc76q,ovpxdj,That isnt quite it we are tired of shameless lies and propaganda coming from 99 percent of republicans that is bordering on terrorism,Happyfuntimeyay,16278267970,62
h7cu150,ovpxdj,Im fucking sick of people complaining about mask policies being reenacted at work There lack of empathy to those around them is not even shocking to me anymore I went off on a coworker complaining to everyone who would listen If everyone wore a mask the first time around than id probably still have a father A man who tried to stay away from the public even though it made him terribly depressed so he could remain safe Just because they cant see the dominos they knock over they act like life is normal ill always consider these people murderers,InfidelRBP,16278523230,15
h7bmre0,ovpxdj,After reading comments Im very fortunate of my situation I got my 2nd dose of the vaccine yesterday and where I live we have 0 positive cases except for 2 that were on board two different ships that came in although they never did leave the ship for safety of the public Were now looking at removing the mask mandate on the 9th of August assuming all these numbers stay the way they are I will probably still wear my mask just in case for another while,Xayzu,16278319330,2
h7brc7u,ovpxdj,I hate that I feel this way but I am torn about masking up again in public and at work - not because I dont like wearing a mask I actually dont mind it and often forgot I had it on What I am dreading is the confrontations the anti-maskers and anti-vaxxers who will sneer and mock and the conversations with clients and coworkers who think its all a hoax The thing is the mask worn by me is for them its to protect them and their families who cant/wont get the damn shots Im torn because I dont want to unknowingly pass anything along that might sicken hospitalize and maybe kill someone who cannot get the shots but Im also very close to the point where I dont give a rats ass if someone who refuses to protect themselves gets sick and dies,bookofbob,16278340250,2
h7cfzbd,ovpxdj,You have no idea how irrational unvaccinated people are getting Because vaccines reduce symptoms of the new strain(thank the spaghetti monster) but it is still transmissible theyve started talking about doing mandatory vaccine passports so that if you are vaccinated you wouldnt be allowed in public spaces,Naughtius_K_Maximus,16278456140,2
h7cqrjb,ovpxdj,Thats me but Ive come to a realization A sizeable portion of the public are brainwashed Theyre not stupid theyre not suddenly assholes they have been brainwashed From the moment they wake up and pick up their phone and load Facebook they are bombarded with anti-vax propaganda Then when they turn on Fox News its almost as bad At lunch with they load YouTube for some light relief the algorithm pounds them with anti-vax 5G conspiracy-theory bullshit Same thing day after day theyre exhausted Then when they have a conversation with anyone they say the same thing and suddenly its ok to believe it After 9/11 we all learned about otherwise normal people being radicalized and wondered how it could happen Its happening right now Radicalized= brainwashed,limitless__,16278507560,2
h7awyj0,ovpxdj,Damn a lot of vaccinated people on this sub are now sounding like the unvaccinated when mask mandates and social distancing were first issued Empathy has gone out the window and selfish thinking has jumped right in The hypocrisy makes me sad Im 29 healthy vaccinated and still wear my mask in public Its not about me Its about protecting others even if I disagree with their choices not to get the vaccine,TeachinAnon,16278171140,129
h7bczhh,ovpxdj,Why are we giving up our rights to protect dipshits? At this point Republicans are right to oppose mask mandates for vaccinated individuals If you want to not die from COVID get your shots,The_Starfighter,16278272150,6
h7di4jj,ovpxdj,Once everyone has had the option to have the vaccine I am no longer responsible for what happens to you if you get sick in the general public I am not doing lockdown or mask wearing anymore ( I was a huge advocate the entire time prior to the vaccine) we need to get back to normal,mnhockeydude,16278646840,3
h7brcn1,ovpxdj,Im not anxious to "open the economy!" Im anxious for everyone to do the right thing for a sustained period of time so we can earn that - theres a big difference Articles like this are fully motivated around the "we need to get you purchasing gasoline seeing movies in theaters and drinking Starbucks everyday again!!!" angle Shit writers like this carry water for capitalism and think theyre helping Separately though All of these anti-vaxx cowards should be forced to watch the early inoculation scene in HBOs "John Adams" mini series One of the most brutally clear examples of what past generations had to go through during the early days of the concept compared to modern society These selfish ignorant children need to see how they were desperate enough to welcome the opportunity to even the Friday and most unpredictable forms of this science We keep these anti-vaxx cowards in too much of a safety bubble They cant see the harsh reality because we insulate them from the worst impacts of COVID Unfortunately they have little to no developed sense of empathy for anything that hasnt touched their lives specifically (aka being a modern registered republican voter - now show that nancy regan meme) There should be a 24 hour news feed in every town showing your local hospitals ICU There should be a sound of infection hospitalization and death in the screen and after a few days every person should know the "death gurgle" sounds of someone chocking to death inside their own lungs Instead of commercials there should be small breaks to list local vaccine availability and list suspected long term COVID impacts Might be hard to sell advertising for coke products around that programming though huh? Hard for us to continue this "open the economy! Back to normal!" charade at the expense of human beings that dont have to be dead?,TheBigPhilbowski,16278340300,1
h7bwip5,ovpxdj,Yeah this doesnt come as a surprise All of the older people Ive talked to during public transportation are like "UGH REALLY?! I have to wear a stupid mask despite being vaccinated?!" - and that was months ago and our country Denmark has only recently gotten over the 50% vaccinated mark I suspect its much the same situation regarding privilege: You dont even realize how much of a hurdle something is unless youre facing it yourself,RedSnt,16278364500,1
h7byhmb,ovpxdj,I live in Houston where some hospitals are converting regular hospital beds into ICU beds AGAIN and I only see a handful of masked people out in public I feel surrounded by malicious idiots,willworkforchange,16278373760,1
h7c0x8d,ovpxdj,Im just annoyed I live in a country where stupidity constantly gets handled with velvet gloves Make them pay for their choices swiftly and harshly No vaccine no normal public life for you Easy as that Except for the few cases who cant for medical reasons and so on obviously,eri-,16278385100,1
h7caj49,ovpxdj,Unvaxxed immunocompromised children are not my burden anymore I suffered emotionally physically and financially from a hard lockdown in chicago I work in the restaurant industry so I pretty much didnt work for a year I stayed home I wore my mask I still wear a mask in public transportation stores but not at work I just cant be responsible for everone anymore The vaccine wasnt ever going to end covid It was to keep you from being in the ICU intubated Or dead Ill take my chances getting covid now (Im vaxxed) In chicago all you have to do is make a phone call and they will come to your home and vaxx you AND give you a $25 gift card Im on antidepressants/anxiety meds now because of the lock down The antivaxxed can go F themselves,mwestadt,16278430090,1
h7cgost,ovpxdj,Easy fix that will be impossible to enact Mandate it Anyone that wants a state issued ID will need to prove they have been vaccinated for diseases that doctors want vaccines for Anyone who wants to attend a publicly funded school will need to be vaccinated This would include any school that gets any money from taxpayers through federal state or local taxes Im sure the Republicans that claim to be libertarians will have something to say against this while mandating that women cant get abortions,thailandblack,16278459530,1
h7cho06,ovpxdj,According to the research being done especially in places like Israel that has a population over 60 at 80% vaccinated by February data is showing the vaccine effectiveness is fading quick and dramatically Had you been vaccinated in January such as myself youll find youre at best walking around with an effectiveness of nearly 20% compared to someone vaccinated in June who is around 80% If unvaccinated people are the only ones getting sick the concern we are seeing wouldnt be there You would be protected with your vaccination and would have little to worry about The truth is we will see more variants and until we have boosters available and ones that can be made quickly before the new variants take hold we will continue to see spikes regardless of previous vaccinations Instead we are seeing vaccinated people spreading the virus and some knowingly I know first hand someone who is currently infected after being vaccinated in april and she continues to work at her job since the symptoms arent bad according to her and she is vaccinated The anti vaxxers are a problem but theyre a distraction from the real issue that your vaccine will only provide so much protection and its not a ticket to do whatever you want If the vaccine worked effectively for the current delta variant they would only be their own problem Kind of like driving a car with a seatbelt The direct impact is only to the individual I have and still continue to wear two masks including an n95 as well as limit my public interactions It isnt hard to wear a mask its not hard to use common sense even if youre vaccinated Weve had a hospital in my metropolitan area that had 20% of the admitted covid patients fully vaccinated It all depends on when your state started doing vaccines and how long ago it had been since you got yours And we will see a lot more of these so called "breakthrough" cases regardless of vaccination rates And government officials have been warned already of this and the CDC has discussed this internally and a lot of people are concerned about the effectiveness of the vaccines The mask mandate should have never been removed and local governments have also failed their constituents,mrnight8,16278464230,1
h7clmli,ovpxdj,This is exactly where Im at Other than little kids anyone who wants the vaccine could get it by now even the poor (Im speaking of America I realize this is an international community) The fact that were doing the right thing and were still going to get punished by the dumbasses is unreasonable Never mind the fact that the entire point behind masking/shutdowns/etc is the stress on our public health system I live in a state that has currently ZERO strain on our system yet some CDC scientists are here to tell me that my 5 cases per 100k people is considered "high" and we should be masking indoors everywhere Our vaccinated kids? Masked 100% in school this fall - no option Its bullshit If you are a family that has a little one then wear your masks If I had a child under 12 my entire family would be masked right now anywhere indoors today - despite currently miniscule numbers However we dont so I dont feel its necessary to do so I wont raise a stink about masking rules that businesses want to put in place but unlike last year when I supported every single one of these mandatesthis year is different,islander1,16278483180,1
h7cp3h5,ovpxdj,We have to start wearing masks where I work again starting very soon I work with a lot of very republican/unvaccinated people that will be the most annoyed by this ironically,-SoulOfSin-,16278499640,1
h7d2sme,ovpxdj,My country has decided not to do the vaccine passport but still offers some papers which serve as proof I think a company could step to the table and create a scannable hard to counterfeit vaccine passport with integrity behind it I normally would prefer government to do these (essential) things over companies but if they wont why not let a 3rd party do it? I get this isnt great for personal liberties (though we use to require people to show immunization records to get into school or enter the country) and we should keep an eye on the government so that things dont stick past the pandemic (like with the NSA and their anti-terrorism measures) but like most people I take this pandemic seriously and just want it to be over I dont believe in forcing people to take the shot with force (unless the virus was more deadly and Martial Law was declared) but restricting them from public places is good encouragement and helps keep immuno-compromised people and others who cant get vaccinated for medical reasons safe,Beeker93,16278566340,1
h7d000g,ovpxdj,I have been reading many of comment sections like this in the last week and Im a little surprised that everyone is acting like the only unvaccinated people are "evil white Republicans" African American vaccination rates are in the 30% range and Hispanics are in the 40% range Whites are up in the 60% range Do people not know this? I know there is some hesitancy by some Republicans but not nearly what some of you think I know many Republicans and almost all of them are vaccinated I live in a black neighborhood and my "threat" from covid is from black people not whites,ginter76,16278552550,-2
ha1p6fv,pa00vu,To those who wont get vaccinated and insist that the vaccine may have terrible side effects I invite them to look at the package insert of virtually any medication they currently take and look at the reported side effects of that drug Every single drug on the planet has some rare reported terrible side effects Yet you take the NSAIDS the insulin the tylenol the novel chemotherapy Vaccines are no different Are there rare reported terrible side effects? Yes Do they outweigh the harm of the disease (no!) and further are important for public health yes!,Previous-Forever-981,16297349160,42
ha16y8s,pa00vu,Hold on to your butts the mandates Are coming and the public freak outs to follow!!!,muldervinscully,16297270670,13
ha2l9i4,pa00vu,So now that the FDA approved the vaccine does that mean that people will be forced to get one in order to go into public places? Or is it just work places that will mandate it do you think? Because I have chronic health problems that get WAY worse from vaccines (I had every one until 18 and found out why I got so sick a lot) so I absolutely cant get vaccinated or else my immune system will shut down for months and Ill be too sick to do anything especially work,LadySith2020,16297480650,-1
ha1fpb6,pa00vu,Immediate response from anti-vaxxers Ive seen? How the FDA skipped the public meeting of expert advisors to vet the vaccine and make recommendations to the regulator Didnt the FDA themselves say this would be done with each vaccine before approval? Im not sure how to respond to this when its thrown at me Help? https://wwwnbcnewscom/health/health-news/livestreamed-fda-meeting-u-s-regulators-experts-take-covid-vaccine-n1244296 Here is where its mentioned ^^ https://wwwnprorg/sections/coronavirus-live-updates/2021/08/23/1030251410/pfizer-covid-vaccine-fda-approval That talks about them skipping it ^^,TartofDarkness,16297309360,1
ha1hia7,pa00vu,SpikeVax! Brought to you by NASCAR Budweiser the Republican Party the Klu Klux Clan and freedom loving Americans! Get yours today!!! If they market this right we might end this pandemic faster,Murkypickles,16297317090,1
ha4w58o,pa00vu,What difference does this make to the general public?,Chinkreddit,16297899780,1
gxyuokh,nb0qrm,Jezzz how bad is it when you have to bribe people to get vaccinated but on the other hand a Republican who is effectively swimming against the party current Fair fucks,mcwilg,16209069560,2
gxxd601,nb0qrm,And all you have to do is surrender your private health information to the public domain Example: If we are required to show our Covid vaccine passport to get on an airplane or go into Costco what will they require next? Flu vaccine passport?,cruciamac,16208685600,2
gxxj7st,nb0qrm,Ridiculous Give the money to public health workers and hospitals + people in need,mrbig974,16208715000,1
gxxpk0u,nb0qrm,And hes a tit-sucking Republican,Natural_Board,16208748330,1
gxxrbl6,nb0qrm,This is for sure going to me more effectively than any public service announcement Itll generate more news more buzz and than anything else $5 million is cheap compared to how much it would have cost yon outreach and advertising to get people to take the vaccine,funguy07,16208758280,1
gxxtgrc,nb0qrm,I know there are legitimate historical reasons for some to be skeptical about vaccine safety But generally it is so sad to me that we have to incentivize public health in the face of a pandemic Maybe people are essentially self-interested and/or Im being nave,__JDQ__,16208770650,1
gxxxfca,nb0qrm,Damn put that in Oklahoma Even Republicans would be lining up for their shots and wearing masks lol,Eightfold876,16208794950,1
gxy450s,nb0qrm,Check Republicans,Jor_in_the_North,16208842740,1
gxycjva,nb0qrm,I can hear Republicans screaming that this is somehow Socialism and the downfall of humanity and so unfair because it excluded them,hyperhedonie,16208914410,1
gxyt1rs,nb0qrm,Is Dewine not a republican? Thought he was? Also Im now sad that I am so surprised by good things done by members of the GOP,rettribution,16209058830,1
gxyz5ff,nb0qrm,This is such a good idea Want people to get vaccinated for the common good despite their beliefs? Offer incentive,PublicAdmin_1,16209096440,1
gxz9bx5,nb0qrm,Should have given a tax deduction for getting vaccinated Republicans wouldnt be able to say no!,commentHero,16209147390,1
gxzp0sx,nb0qrm,I keep saying the prize should be dinner with Trump Then the Republicans have to weigh a 1 in 5 million chance to need Trump with a 1 in 5 million chance of maybe getting blood clots,MuckduckersRow,16209215640,1
gxzvltc,nb0qrm,I am not sure if this is a right use of coronavirus relief fund Dont get me wrong This is purely based on public policy perspective,SYSSMouse,16209243500,1
gy1zwu2,nb0qrm,Does this include people who previously got vaccinated? From how I first heard it if you got vaccinated before this was announced you had no chance of getting anything Also glad to see Dewine being a sane Republican,The_Starfighter,16209597510,1
gybc19e,ndkvik,So in the facility I work in (6000+ people) we are allowing for fully vaccinated people to go without masks My company arranged for people to be vaccinated on site and before that arranged for people to get vaccinated offsite We know who the people are that did not or will not get vaccinated mainly because they wont shut up about how much of a hoax it all is This policy change came out after work on Friday Monday is going to be a shit show &#x200B; \*\*\*UPDATE\*\*\*\* TLDR: There was no shit show So Facility management sent out emails reminding people that only those that were fully vaccinated were allowed to have their masks off They also reminded people that they dont want any integrity issues by lying about being vaccinated My field requires a security clearance so a integrity issue could compromise that Walked into work today and the people who were still required to wear a mask wore one I heard minimal griping about the change in policy from the people who were unvaccinated I dont know if any minds were changed about getting the vaccine but Im appreciative that my coworkers are sticking to the mask policy,johnqpublic81,16211648840,2647
gyd6qgd,ndkvik,Its too early for masks off in public indoors We should wait until 1 There has been enough time for everyone who wants the vaccine to be FULLY vaccinated including in blue areas where appointments have been less available Many age groups have only been recently eligible in some states Also dont forget people without car access need more time 2 At least 50% of the total population is FULLY vaccinated (that means a full 6 weeks after first dose) 3 Ideally until cases are down but if idiots stop us from achieving that this summer we can at least keep masks on until the only people left 12 or older and not FULLY vaccinated are TRULY just the anti-vaxxers 4 The most ideal of all would be for most people to keep wearing masks indoors in public until fall so the 2-11 age group could be included This would also crush the case numbers even more Obviously its fine for fully vaccinated people to have private unmasked indoor parties but in public a lot of lying unmasked people just means that people still waiting for their appointments and partially vaccinated people are now forced to stay at home even more than before or may be in an unsafe environment at work Because other peoples masks protect you more than your own mask And there are definitely going to be some people who stop wearing a mask just because no one else is wearing masks or because someone is harassing them for still wearing a mask,kittey257,16211982160,2
gydhftd,ndkvik,Im an American who received the Phizer Vaccination I will continue to wear my mask most likely for years if not always from this point on The change in my routine since this has begun has benefitted me in so many ways I havent been sick all year People are more prone to giving you personal space I enjoy the anonymity in public Im an asthmatic and immunocompromised Theres no benefit for me to stop wearing a mask even after being vaccinated,Vengeful_Doge,16212031400,2
gybknof,ndkvik,*Republicans,darus214,16211708160,-9
gybqrln,ndkvik,One the upside the Republican anti mask/vaxxers are mostly just killing themselves and some weak children now So yeah,shadowskill11,16211742720,1
gyc5jov,ndkvik,Republicans will lie Its what they do,THEPROBLEMISFOXNEWS,16211815220,1
gyc8g0s,ndkvik,Ill just keep wearing a mask even though Ive been vaccinated I dont want to me mistaken for a republican,protosser,16211828610,1
gybskub,ndkvik,Trust no Republicanever about anything at all Theyre not only incapable of telling the truth theyre incapable of grasping it,VanessaChaland,16211752250,1
gybxpfd,ndkvik,You all are too cynical People will proudly share their antivaccine opinions in public by wearing a mask,bpg2001bpg,16211777830,1
gybzu3w,ndkvik,When it says people does it mean republicans?,Happyfuntimeyay,16211788150,1
gyc6qi7,ndkvik,Walmart and Amazon would like to personally thank the government for their care and attention to public health,redsaeok,16211820740,1
gyc8uxb,ndkvik,I dont care what the rule is or that I am fully vaxed (second show on April 15) Im still wearing a mask when out in public Among my friends (who are also fully vaxed) no mask but I dont trust strangers,Uyulala88,16211830470,1
gycbtnz,ndkvik,Lying is part of human behaviour as much as science hatred is part of being a republican/conservatives,America_is_funny,16211843800,1
gychgsd,ndkvik,It doesnt take an expert in observation to know without a doubt that weak republican losers will lie about being vaccinated Its just what theyve been trained to do by their rich controllers,t00lecaster,16211868300,1
gyciknx,ndkvik,If needed cant public health records be checked to verify if someone is indeed vaccinated? Seems like something that should be possible,NevermindMeFuckStick,16211873290,1
gyckzaw,ndkvik,Lying is what people do best so of course they will lie Its fine Im going to keep wearing the mask and keep social distancing I work with the disgusting public every day Half of you people dont wash your hands after taking a shit Why would I trust you to tell the truth about your status as a spreader? The experts are RIGHT Oh well at least my vaccination is giving me a bonus paycheck from work,unrefinedburmecian,16211884070,1
gyclmhl,ndkvik,Im pregnant and vaccinated so Ill probably still wear a mask in public places bc of these people lying Also they think it has been all a "hoax" and that there is no science behind the CDC saying people can go without masks if theyre fully vaccinated But People are vaccinated so I dont see why it doesnt make sense lol,Bfloteacher,16211886900,1
gycm0qp,ndkvik,Republicans will definitely They have lost the ability to even be honest with themselves,3peasuit,16211888650,1
gycngsm,ndkvik,Some people will for sure but in most areas vaccines are widely available enough to the point where if you care about unvaccinated people out in public then just get the vaccine yourself And before yall take my head off because of some not everyone can get the vaccine bullshit me walking around unvaccinated with a mask is still more risky than me walking around vaccinated without a mask Ive done my part People who chose to vaccinate themselves deserve to get back to their lives,tp1996,16211895060,1
gycpju6,ndkvik,The people who will still continue to wear their masks are those who have actually been vaccinated because functioning brains My only fear of still wearing my mask now is being confused as a republican anti vaxxer,ohmygoddude82,16211904390,1
gyd1ww7,ndkvik,My guess is they held this news longer than they needed to with full anticipation that people would lie about being vaccinated while not wearing a mask in public,MhrisCac,16211960520,1
gyd4ow9,ndkvik,I am vaxed If I werent and was comfortable going out in public because everyone was maskedwell now thats over I feel bad for those who cannot get the vax due to medical reasons The people who can get it but havent? No sympathy when they get sick I just wish it didnt affect the rest of society adversely,AnneFrankenstein,16211973050,1
