hqsjw2n,rt54vc,America please stop acting surprised at the results of your own lack of care Almost half of yall arent vaccinated Those who are take tests to go places and avoid wearing masks Thats not "being cautious" its calculated risk but a risk nonetheless Cautious means you dont do office parties you dont go on vacation and you dont pull your mask down in public for photos Cautious means you dont go to restaurants except to pick up food masked because do you honestly believe COVID is gonna sit tight while you finish your burger? How are you gonna put your faith in other people when half your population either refuses to get vaccinated or buys fake vaccination certificates? How do you trust anyone? I definitely wouldnt not after the last few years Being cautious is me going absolutely fucking nowhere and meeting fucking no one so my wife who just finished chemo doesnt die from COVID Only time we go out is to the hospital and we both double mask If you choose to live life go ahead No one can stop you But for the love of fucking Jesus stop saying youve been cautious when you havent,indiblue825,16410322160,-8
hqsgqu5,rt54vc,Because even now when I see people talking in public theyre basically spitting in each others face,SlowSecurity9673,16410294140,1
hqsr3ds,rt54vc,Surely part of it is that the public are caring the least they have been since the pandemic began with regards to wearing masks/ isolating/ social distancing?,SeiriusPolaris,16410386880,1
hqsuy4g,rt54vc,I dont get it had Covid last New Years got all the fixins for being vaxxed and I have Covid again Feel like public confidence in the vaccine is gone,yeetsqua69,16410418270,1
hqtb71h,rt54vc,What do you mean why?? Go to any major n city and visit just one bar Go to literally any public space and youll know why Find where young people gather and you will know for sure why,Recent-Needleworker8,16410513620,1
hqtdig6,rt54vc,Its that quarantine burnout bro People stop wearing masks isolating for so long is tiring public gatherings etc,JoeltheUndine,16410524740,1
hqtgf8t,rt54vc,Prolly cuz hardly anyone wears masks in public anymore Also distancing is gone so many people happy and hugging,CanoeShoes,16410538220,1
hqumrjq,rt54vc,Uhm because people are selfish and dont use all available ppe when in public,darkside767,16410713690,1
ha8jhii,pamuzn,Simple fact if the matter is that coronavirus is not going away Its never going away Were going to need to figure out how to live with it Every person (barring medically unable) aged 12+ in the US has had the ability to get a vaccine which are incredibly effective at preventing serious illness and/or death Delta variant is super super transmissible Get the vaccine or get Covid (or sometimes both - if you are vaccinated incredibly rare to get seriously ill though) Your choice Lets go about our business accordingly Also since the onset of the pandemic there have been less than 400 children (anyone under the age of 18) who died of Covid in the US which is less than half of the number that have died of pneumonia There are more than 70 million children in the US The chance of Covid killing a child are exceedingly rare Lets all put on our big boy big girl or big whatever gender you identify as pants calculate the risk and make the most of life We cannot continue to live afraid We cannot continue to stay home and shelter in place We cannot continue to hold our kids home from school indefinitely Lets use our individual liberties and freedom and do what is best for ourselves and for our families This is no longer a public health crisis - ERs that are filling can be easily remedied with more vaccines in more peoples arms Its time to unite time to respect the decisions of others and the consequences of those decisions time to live life,JP_In_The_513,16298542010,8
ha5ouzi,pamuzn,Jeez remember last October reading about the vaccine being made and the promise of a normal summer Of festivals and the beach and bbqs? And just before Easter vaccines being available to the public and thinking "we did it we made it out!" Only to realize how screwed we are I empathize with vaccine hesitant folks because theyve been gaslit by the govt for almost 20 months However now with FDA approval and mandatory vaccines in many places the time to do research and get over your fears is now,OkBid1535,16298108000,46
ha84otb,pamuzn,He is probably right I worked for the agency he heads for 9 years and his reputation among people who know him is near spotless He is the real deal as a scientist and a doctor and as a public health official Im surprised how well he survived the Trump era We are in for a rough flu season because covid-19 virus is a lot like other viruses that cause respiratory and other problems but much worse Those viruses lifespan is longer in cooler temperatures and with less UV radiation to kill them My state of Maryland where Dr Fauci works and maybe lives was doing great until the Delta variant got here Now we are back to masks and other restrictions Vaccinated or not If we keep up with getting more people vaccinated and getting booster shots for the already vaccinated (coming soon) we can go to a level that we can call the pandemic under control once the flu season is over Covid-like viruses are not going away for good no medical scientist will promise you that All we can do is to try to keep them to a minimum and that will require a continuous effort for the foreseeable future Because we as humans are too dumb to nip it at the bud while there are only a few strains of it by getting vaccinated,aykontakt,16298474320,2
ha7qn7j,pamuzn,If less Republicans existed,onyxap1982,16298412410,0
ha915hf,pamuzn,Or just let people die mostly republicans so win-win?,ImehPosts,16298627550,1
ha6us9m,pamuzn,Im really really sorry But whenever I read a headline that says "Fauci says" I cant help but think of these public information films from the 70s https://wwwyoutubecom/watch?v=KzWKK86rMTQ,Torandarell,16298284490,-1
htlrlvz,s9bgvj,I live in Alabama and my entire family is vaccinated and boosted we still mask and stay to ourselves The lab my wife works in employs 8 people and her as well as 1 other are the only ones who have not caught it yet Some of them have had it twice In public no one masksor very few do We go Grocery shopping at 6am on Sunday mornings once a week to avoid crowds Our 2 teens just went back to school and they mask and take precautions and luckily our county has a mask policy for all schools but in 3 classes the teachers are out sick so they herd the kids to sit in the gym during thoseProbably should of kept them virtual but they were ready to go back and we did wait until they were both boostedThis state treats it like a joke and we have 6% of ICU beds left with everything climbing smdh,hurrythisup,16427769010,429
htmlqtk,s9bgvj,Currently in Alabama and rarely do I see people wearing masks Guy at the hardware store smirked at me when I asked for help (wearing a mask) Mobile county public schools arent requiring masks so it wont stop for a while People are killing themselves willingly,milkawhat,16427881900,17
htn0i2g,s9bgvj,Well it could be the same in NSW Australia but we dont know because our premier (governor) just removed the amount of tests taken from the public data He is know as dOmicon,dcolvin,16427936630,2
hozqima,riu275,The purpose of a CEO is to make shareholders money They will tell whatever lies it takes to ensure that happens Dont listen to them for public health advice your health is not their primary interest,walker1555,16397887120,792
hp22nh3,riu275,Why was a CEO of an airline asked about masks? Like Im sure his parents would have been very proud of him his expertise is not in public health and epidemiology Why does everyones opinion on a complex situation matter?,Suspicious_Mirror_65,16398421110,1
h66ciwo,opi0xh,Tell republicans that its like giving you a gun that has a 88% chance of stopping a home invasion vs being unarmed,jdlyga,16269896960,63
h66df0h,opi0xh,I am blind or there is no link to the study? I am all for good news but I do not want to just trust a publication without sources,KeineSystem,16269901040,4
h68h3fw,opi0xh,Is the Delta Variant called Delta because the public understands that tying it to a country is a really asshole thing to do or is Delta just US COVID and the same racist people dont want to consider the variant cause in US?,nevernate,16270378870,-3
hbe7fnk,pgpu4o,This is why Life University (Largest chiropractic school) needs to shut down and loans forgiven Their president spreads conspiracy theories and is a danger to both the students and the public Average chiropractic student has $200000 in student loan debt Mean while the president and his friends at the top of the pyramid are scamming everyone and playing games with the publics health,NCusingsc,16306341300,1
hbebcp9,pgpu4o,All chiropractors should be issued a notice immediately: stop peddling your bullshit close your doors and walk away or be arrested for medical malpractice and fraud The idea that a chiropractor has any business weighing in on virology or epidemiology or public health should make anyone laugh and then ask why the fuck that was ever a thing,shggybyp,16306359830,1
heatbxn,pv629v,Some publicist had to have cooked up that horseshit because he cant sell a stadium LOL A dive bar? Really? An enclosed space with singing drunks sitting on your stage monitors? Stadiums are outdoors and youre at least 10 feet from the first row of punters and about six feet above them,gustoreddit51,16326249200,2
hebq8gc,pv629v,I thought he was a big republican guy Surely anti vaxx is right up his alley,dano1066,16326460380,0
hjjmbui,qnhmc4,No sympathy for him from me I lost my father to covid earlier this year a month before the vaccine was readily available to the public I caught covid after he caught covid from another family member due to an emergency and he tried his best to hide the fact that this virus was slowly but surely beating him As my family was preparing for the funeral we cleaned some of his stuff and among one of his notes was locations and dates and age limits for the vaccine He was waiting for the vaccine avoided covid as much as he could and it breaks my heart that hes not here with us now,sora92120,16362031020,2
hjhud2h,qnhmc4,Oh great another moron in the public eye,xReddit_Sucks,16361618170,1
hjhv73x,qnhmc4,This is ridiculous He is a public figure and andshouldact accordingly in the best in the best interest of the public He is dumb,greatniss,16361622050,1
hji7m2j,qnhmc4,Consider this a PSA: my 80 year old parents attempt to use the word woke in conversations because they hear Tucker Carlson say it on Fox news and they think it makes them cool Republicans They say weird things like "Nancy Pelosi is being woke again She should be ashamed of herself" I have no idea what theyre trying to say If that doesnt kill the use of woke I dont know what it will take,goplantagarden,16361681470,1
hjjumzo,qnhmc4,Aaron finna join the Log Cabin Republicans,Bowieisbae77,16362071740,1
hjk5ab2,qnhmc4,Honestly he should be fired from the team If you dont trust the science then you shouldnt be in the public spotlight,MajorasMask3D,16362119170,1
h829qt2,ozr842,To be clear in the US you can mandate a vaccine *as a condition of using public (or private) services* The government CANNOT go door to door with needles mandating everyone get the jab What they CAN do is mandate proof of vaccination as a condition of attending public school That generally covers about 96-97% of the population,Etherius,16283489660,1389
h83bz24,ozr842,How is this even controversial? All public schools and almost all private schools mandate that students be vaccinated against all manner of things before starting,FuguSandwich,16283669850,25
h824zfq,ozr842,Goddam Its too early for for me to be reading this thread I guess I cant blame people for being stupidor can I? Food for thought for you ant vaxers out there literally any public figure you respect whether left right up or down has recieved the vaccine This is not the hill you want to die on Youll have more fun with a flat earth Good luck do the right thing,sitswithbeer,16283466080,38
h82clyb,ozr842,In other words common sense! LOL! There are so many laws and rules that actually tread on the antivaxxers freedoms and not a peep from them! The republicans brag on less government and Texas has government controlled thermostats in their homes! You just wish there was common sense politicians but they have nothing to gain financially so they choose pandering to the money! history will not be kind to the US Governments handling of this pandemic and the 100s of thousands of senseless American deaths no one will be held responsible for!,Gcblaze,16283503420,13
h831733,ozr842,Biden is making it so easy for Republicans in 2022 and 2024 elections,geerhardusvos,16283617900,8
h82tg39,ozr842,So I have to pay taxes for a public school my kids cant attend because I wont make them take medicine for a virus they are statistically not affected by?,BigRockford05,16283581950,9
h81wf0c,ozr842,Its how we beat polio no vaccine Means now school no work no public services,monchota,16283419590,-3
h83q2ob,ozr842,Not that the Republicans will believe any of that,Kflynn1337,16283739690,1
hmrq413,r5ueps,I dont see an English option (on mobile page) so I ran the article through Google translate: Preliminary data: The vaccine protects highly effectively against the new variant Marciano Foundation The information received in Israel about the Omicron - the good and bad news: After Bennetts declaration of "state of emergency" in Israel tonight received preliminary data - both from South Africa and Europe - on the new variant that is causing concern around the world The data revealed tonight (Tuesday) in the "main edition" shortly after being received in Israel are preliminary - but indicate that the vaccine is still effective against the newly discovered mutations The data were collected in both South Africa and European countries where verifications were found in the new variant It should be emphasized that these are preliminary data that the whole world is waiting for and at this point they become the working assumption According to these data the effectiveness of the vaccine (for those who received three doses ie also the booster) decreases only slightly: 90% protection compared to 95% protection against the Delta strain These are impressive and somewhat reassuring figures The effectiveness of the vaccine in preventing serious illness for those who have been vaccinated three times is the same as the effectiveness against the Delta strain - the strain that has been the most dominant in Israel so far The alarming data But not everything is rosy: the problems start with the risk of recovering from being infected The data show that the risk of recovering from infection is twice as high as in Delta and the rate of infection is 13 times higher than in Delta This rate of infection is very high: in South Africa there is talk that in 15 days the number of patients has increased 15 times Although the numbers are low the rate is problematic and worrying: in Israel there are many Israelis who are not vaccinated Another worrying statistic has been revealed regarding the unvaccinated: their risk of becoming seriously ill is 24 times that of the original strain of the corona the one that arrived in Israel nearly two years ago In "unvaccinated" the reference is also to those vaccinated in two doses who are entitled to a booster and have not yet been vaccinated and therefore their protection is insufficient Despite this news the data is a reassuring siren when it comes to protecting vaccinated people from both serious illness and infection for further reading: South Africa to Israel: "Vaccine effective against Omicron variant" The Omicron variant captured the continent of Europe unprepared A new variant has been identified in Africa Will Ben Gurion Airport close because of the new variant? The Corona Cabinet approved: Insulation for returnees from abroad African variant Omicron (Photo: Reuters) South Africa has transferred new information to Israel - and this is the data | Photo: Reuters The contradictory messages of vaccine manufacturers The test of the effectiveness of existing vaccines against the new variant was in its infancy but Modern CEO Stefan Bensel managed to arouse global concern today when he said in an interview with the Financial Times that he expects a significant decrease in vaccine efficacy But Bensel spoke of a decline in benefit from a disease with symptoms rather than a serious illness - a difference that is known to be dramatic in corona contexts as Pfizer CEO Albert Burla was apt to describe: Defense compared to Delta but that would be the limit In both cases the booster vaccines are expected to reduce the gap dramatically " Burla who promised to know more about the benefits of the vaccine against the variant in about a week and a half said Pfizer had already begun developing a specific vaccine against the variant a few days ago "We know the genetic linkage of the virus we have it - thats how it starts" he explained "We started at risk to produce a vaccine We actually started on Friday to produce a vaccine based on the flooring the DNA template that would allow us to make RNA that would eventually women within that vaccine" Israel meanwhile is waiting for a more categorical statement from the two CEOs and meanwhile relies on data coming from South Africa - where the variant was first discovered - and from which it appears that the omicron is more contagious but is no more violent "Data on the benefits of the vaccine - there may be some partial data from South Africa" Dr Sharon Elrai-Price head of public health services said today during a debate in the Knesset I know they are doing the lab tests as I described to see how useful the vaccine against this variant is " Bennett worried: "There is a lot of uncertainty" Albert Burla and Naftali Bennett (Adapted by Reuters) Burla optimistic Bennett explains why he activated the GSS | Arrangement: Reuters At the same time the government is today approving a memorandum of law that will allow it to extend the decision to allow the GSS to verify the cellular devices of those infected with Omicron or the suspects who were infected with it with high probability - in order to interrupt the transmission chains as quickly as possible But just before the move reaches the Knesset the coalition itself is sharply critical of the law Prime Minister Bennett - who saw for himself how in the ministers WhatsApp groups Ministers Saar Shasha-Bitton Barbibai and Avidar voted against - told today why Israel decided to include the GSS in the campaign despite and perhaps because it is a low number of infected "There is a lot of uncertainty and that is why we are taking these extreme measures" he said in a video call with Austrian Chancellor Alexander Schlenberg "But our advantage as leaders is that once we know more when there is more information - we can let go of those measures gradually" As for the restrictions at Ben Gurion Airport the prime minister has already decided that these will last about two weeks from the date of the decision - and only if the final proof does come that the variant does not endanger the populations immunity or the omicron is already spread in the community - these restrictions will be removed Yaron Avraham participated in the preparation of the article,Serenity101,16383425550,2
hmq4mg2,r5ueps,I read the title as "twice as dangerous for Republicans",oOoChromeoOo,16383141190,-17
hmrcgeh,r5ueps,More republicans are going to die,johnwayne1,16383342280,-1
hmrqxel,r5ueps,Wakeup call for anti vaccers and the entire Republican cult Not losing any sleep though if they dont heed the warning,santz007,16383431550,0
haf4ia9,pbycr7,>However Gov Bill Lee has thus far resisted such suggestions Instead he recently signed an executive order letting parents opt their children out of coronavirus-related mask mandates in K-12 schools just as a few school districts issued mask requirements for students and others > >When pressed Wednesday if the Republican was considering giving schools more flexibility to hold virtual learning Lee said no > >"We dont have any plans to do that yet" he said Remember Amity *means* friendship,mnbvcxz123,16299832860,1717
hagslog,pbycr7,I always knew Republicans hated their children,TreePretty,16300078110,8
hafn28c,pbycr7,Republicans want to kill off as many of their voters as possible,abelenkpe,16299913190,-7
hagpm4e,pbycr7,Republican politicians fucking **love** using children to justify draconian laws then absolutely destroying those childrens future,secondtrex,16300066130,0
hagluse,pbycr7,*Republicans* "We dont caaaaaarrrreeeee! You cant prove children are getting sick due to our irresponsibility! Its impossible to tell! -probably,Stay_Curious85,16300051020,1
hah2ibv,pbycr7,Isnt that a republicant state?,onyxap1982,16300118240,1
hainxgp,pbycr7,Republican governors are just fucking slime,Puzzleheaded-Be,16300389110,1
hahw6ld,pbycr7,Too bad Tennessee Republicans didnt care,Coolioissomething,16300251850,-1
hzpw2we,t8m3fz,Ok this is so shitty on the part of Lithuania Politics should never get in the way of public health To doom a bunch of brown people to suffer from COVID just bc some of their government officials didnt vote the way you wanted them to This is just as egregious as Russias war crimes,Blackcoat_Traitor,16466702200,6
h17djlb,nw1v95,Good Unlike some politicians ensuring your neighbors are doing well is good public policy,Snoo74401,16232740450,1
h17x4co,nw1v95,Come the F on"Pfizer is selling the doses to the United States at a "not-for-profit" price according to the people familiar with the deal who spoke on the condition of anonymity to share details that were not yet public" Im sorry but the state of the country as it is a scandal I think Pfizer sells the US its doses at $1950 and that was the original price that they have since raised So what you gonna cut the US a "deal" for $5 Billion???,DeadLightsOut,16232831550,1
hcw5mng,pobcay,Uh how bout by like today That would be much better Well not as good as it already having been the case As it should be But ya know Republicans,Gandalfthefabulous,16316671450,1
hndihiw,r9otza,>CORTE MADERA Calif -- It was a Thanksgiving break unlike any other for dozens of families at a school in Northern California this year >Around 75 students at Neil Cummins Elementary School had to quarantine after parents of one student at the school knowingly sent their child to class after they had tested positive for COVID-19 >Dr Brett Geithman is the districts superintendent >He says school officials only found out about the positive case after getting a call from Marin Public Health asking why the students infection hadnt been uploaded to the school database >"We learned that that student was never reported to us and that that student had been attending school for the last seven days" Geithman said >Following the discovery Geithman says the school took immediate action >"Parents received a text message the night of the 18th to then bring their child to the gym so that we could conduct testing before anyone entered the classroom" he said >Overall eight students tested positive with all cases being reported by the following night >Geithman says the school district has been very clear about COVID procedures since the start of the pandemic >"In terms of an explanation of why they chose to continue to send their children to school their initial explanation was that they were uncertain of the COVID protocols" Geithman said >Despite the outbreak the superintendent says the system in place works and that the situation is now under control >Several parents told us that the incident has been shocking but that they believe it is more of a one-off occurrence >Many like Jill Martay say theyre happy with how the superintendent handled it >"I just have such great respect for the role and the job that hes done with our community here" she said,why-you-online,16387394180,309
