hb3395t,pf4633,My whole family ended up with just the Moderna option and we all thought it to be second best to Pfizer Then Delta came along and were hearing all these people who are fully vaxxed and still getting sick - sometimes very sick - with covid The thing almost all of them have in common is that they were vaxxed with Pfizer I personally have not heard of anyone sick with covid who is fully vaxxed with Moderna not to say that it doesnt happen We live in MS the state that has been called the #1 covid hotspot in the world due to our low population and prevalence of near unmitigated spread of the virus I havent seen eye-to-eye with some of my family members who are fully Moderna vaxxed as far as lack of precautions they take in public Im still really careful wearing n95 masks anytime Im indoors with the public so I feel fairly protected in most circumstances and dont feel worried about spreading an asymptomatic case but I worry about them sometimes and have been surprised our house hasnt gotten sick yet Well now I guess I know why,12stepCornelius,16304329150,5
hb2ahni,pf4633,Definitely a case of "it must be working better because it hurts more",AngryRepublican,16304213280,1
h95w7rv,p5gzct,Good luck to all of the public facing workers today hopefully you dont experience too much bullshit from the public,jrobin04,16291256280,2395
h97i32r,p5gzct,Ive been vaccinated (willingly) for months but this is absolutely illegal and will not make it through the supreme court Its disappointing that so many people applaud the loss of rights weve been fighting for The caveat "you dont have to go into public buildings" or "the government isnt holding you down and vaccinating you" isnt gonna fly in court Blatant violation of HIPAA by essentially forcing people to disclose their medical history Essentially stripping sovereignty of ones own body and letting the government mandate a medical treatment in order to participate in society Civil rights groups will argue that this unfairly targets minorities like black people who are far less likely to be vaccinated than white people Business owners are going to suffer Theyll lose business by turning away customers if the follow this unjust law and theyll be fined if they dont,H8rade,16291484380,28
h97t0y8,p5gzct,So many Republicans are complaining that their "rights" are violated by this lol They literally dont understand that its a privilege to be able to go to a private business and that businesses have health and safety rules mandated by the government that they are required to enforce Thats how its been for over a century and its somehow completely surprised modern Republicans,Carvj94,16291530230,-3
h987mza,p5gzct,This is going to have a positive side effect of keeping a lot of assholes out of public places,jaird30,16291596430,1
h98dklh,p5gzct,Even vexed people should still wear a mask in indoor public areas The CDC now recommends this,howaboutthattoast,16291623880,1
h96ljgi,p5gzct,Public freakout is about to have a lot of content,Snorlax_Route12,16291355590,0
h97xn8v,p5gzct,I dont think how this mandate is going to work like how do we even enforce it We cant even limit public gathering and enforce mask mandate when were at the peak of the pandamic You still see ppl not wearing a mask I am vaccinated myself and I dined at a restaurant yesterday in manhattan and they didnt ask for your vaccination status Its really up to businesses I feel like,comfortfood168,16291550500,1
h98pvss,p5gzct,Damn publicfreakouts and actualpublicfreakouts is going to be popping,__Bax9,16291681580,1
h98smqu,p5gzct,Looks like a lot of private businesses wont see business until hospitals realize many adults are not responsible/indebted/thrive/or want to support the public healthcare industry Additionally the heavily opinionated business of *my healthcare needs are solely provided by my employer* is not welcome where the old idea of utilizing health services when a feeling of dwindled health or a necessary procedure surfaces remains a solid ground of agreeable working guideline of professionals practicing healthcare optionsin this case *calling out indefinitely* from the public sector has a nice ring to it Curiously I once contacted a private medical clinic for participation of paid research for unapproved medication on allergy relief At the time the study offered to pay me 361724 / 424762 / $5000 / $631250 CAD; and included four visits to a clinic in a one-year duration where every appointment paid a check totaling 25% of the sum In the meantime heard somewhere that in NYC the government wants to pay $100 for a corona virus shot*haha! No thanks!* The five grand could easily realize an UBER hustle to the likes of guaranteeing Valentines Day trips instead of a blind date chance to ruin my heart or lungs Pesos; $485125 ARG / $19211000 CO / $9966950 MX / $253005 PH Asia; $6844 AU / $32397 CH / $3892760 HK / $54647250 JP / $53275000 UZ,jeskoummk,16291695370,1
h997rng,p5gzct,Late to the partywheres the muh freedom stans at? Cant wait to see the public freak outs,defcon2017,16291782450,1
h96b8on,p5gzct,I am not seeing this going well The app is only available to NY residence/those that got vaccinated in NY CT& NJ cant use it and public from those states often come in to NYC Also lets not forget that CDC cards security well nonexistent its an index card Being photo of the card is acceptable proof its even easier to make fake card In order for proof of vaccination to be successful both id and proof of vaccination is needed otherwise its completely pointless I can see it being enforced in Manhattan but in Bronx it will be completely ignored for the most part,looker009,16291315910,0
hmsubtg,r6ejmd,If this is accurate the response that weve seen (travel bans New York state of emergency etc headlines claiming because of the number of mutations it will be vaccine evasive) is the reason people dont trust public health authorities,Educational_Grab_714,16383700950,16
h319q0d,o7uhad,Whether they suggest we wear masks or not is irrelevant; people will not resume wearing them Theyre over it The vaccinated are safe and most of the unvaccinated dont care or arent worried Its unfortunate but those with health issues precluding them from being vaccinated will be caught in the crossfire herethose in this category will need to continue staying out of public indoor spaces and/or wearing masks,jeebuzpwnz,16246527090,617
h31ohhm,o7uhad,As a biologist there is zero evidence right now in the published work that shows this is necessary of people who have received their 2nd dose of the vaccine This is why the public loses trust Fearmongering over these variants is not scientifically backed right now,GeneticsGuy,16246600470,213
h31fn7a,o7uhad,Honestly why do people want to stop wearing masks in crowded places? I havent been sick at all this last year and its because Ive been protecting myself from all your germy asses Ill probably just continue to wear masks in public from now on,Susanthebea,16246555670,-29
h324da0,o7uhad,I always knew CDC messed up Everybody in the public health community knew Folks downvoted me when i said this before but here we are,derangedmutantkiller,16246688660,-11
h31yubz,o7uhad,Gonna have a hard time getting me to *not* wear a mask I thoroughly enjoy not having to smile constantly in public,Things_I_Dig,16246657150,-1
h31yg5y,o7uhad,I do it just to piss-off Republicans,Hot-Koala8957,16246654930,-16
h31fpqo,o7uhad,I think its ridiculous that people stopped tbh the virus is still nowhere close to manageable If anything it should be mandatory to have a mask on when entering any public facility,frantic-no-more,16246556020,-42
h31vk9w,o7uhad,The answer was and continues to be vaccine passports Forcing people who did the responsible thing and got vaccinated back into extraordinary measures to protect against community transmission to the irresponsible is back-assward Stop letting the unvaccinated assholes into non-essential indoor public spaces and then those of us who did the right thing can live our lives,bfwolf1,16246638680,-5
h31ot9k,o7uhad,It seems like theyre saying this publicly for countries that have low vaccination rates even though it is said in general terms Because it does make sense to keep wearing masks if you are in a country with only 15-20% of the population vaccinated even if you are vaccinated,Antman-is-in-thanos,16246602140,0
hrdbdym,rwn229,Hospitals arent full of covid patients Theyre full of people who didnt get any preventative care for their other problems over the last two years because of bad public health policy From the article >More than 2300 people in the state were hospitalized with COVID-19 as of Monday Thats still significantly fewer than the nearly 4000 people who were hospitalized at one point during the first COVID-19 surge in spring 2020 But back then Biddinger said hospitals in the state dramatically scaled back operations to focus on the pandemic canceling everything but the most essential admissions and procedures >"What we have seen is actually the consequences of a lot of that canceled care where people come back sicker because they missed a procedure missed an intervention" he said "And really ever since the first wave those chickens have been coming home to roost in terms of overall patient demand" >That left hospitals packed before the current wave of COVID-19 patients,Shnur_Shnurov,16413995240,106
h6txz2o,ot7vtq,Im 100% pro vaccine and I got it as soon as I could I recommend it to all my family members The entire idea of getting "back to normal" was a big lie to begin with because it was absolutely never going to happen The politicians that sold us on the lie basically shot us in the foot because now its going to be grandstanded upon by all the anti-vaxxers Even if we had 100% compliance with the vaccine it would not have prevented the Delta variant from spreading or some other future variant Eventually the effectiveness of the vaccine will fade and well need regular booster shots The idea that we could ever put the genie back in the bottle was just a horrible idea to sell the public on The message should have been that it will prevent you from getting sick Even if the the vaccine wont end Covid that doesnt mean its any less valuable I feel like this is the beginning of the end The "end" is acceptance that Covid is endemic We need to start planning on how were going to live with Covid not how were going to stop it It sucks but its reality,irr1449,16274810920,186
h6tpw3h,ot7vtq,Ive been wearing my mask at work and other places where the public congregates unless Im outside since the pandemic started (even though Im vaxxed) Im not sure why theyre just letting the public know this now If they knew why would they wait? It just makes everyone lose faith in our health officials,tscc85,16274770950,98
h6ugq0b,ot7vtq,So what vaccinated people are expected to take care of unvaccinated people for whatforever people who have not gotten the vaccine are the ones who have the burden of protecting themselves I dont have to worry about them The vaccine is available to all It took me 20 minutes to get each shot My city even reimburses you if you take public transit to get it People are making the wrong choice But let them They are putting themselves at risk If you got either of the MRNA vaccines you are good At worst you get covid and its a mild cold I dont understand the obsession with restrictions With the vaccine we will never get to a point where our Healthcare system will be overwhelmed and furthermore all the dems shouting about restrictions are the same ones making sure Healthcare is not a right in this country How about improving our health system to handle a higher caseload and making sure everyone has Healthcare instead if creating social restrictions Its all nonsense and so hypocritical We have had over a year to work on our health care system and guess what the people in power are not just not doing anything they are not not even having the discussion With the current system we have EVERYONE is at risk of going bankrupt over a small ailment There are a million risks every American everyday encounters that could put them right into our inadequate Healthcare system Mask restrictions arent going to make Healthcare more accessible and that is what we actually need,crankycrassus,16274890970,77
h6u18nl,ot7vtq,So im sure ill get some heat for this but just because I dont fully trust a vaccine yet does not mean im a Anti-vaxxer and im sure a lot of people feel the same Now just because im not vaccinated doesnt mean im out here in the public not wearing masks and acting like everything is sunshine and rainbows actually the opposite I stay home hardly go anywhere at all when I do its to get groceries and wearing a mask And i have done this since the pandemic started &#x200B; My point is Some unvaccinated people are refusing to get vaccinated for all different reasons a lot of us dont care for the political aspect here some of us actually dont trust a vaccine because who is to say they are not lying about what they do or the numbers I mean we have been lied too about everything else and now im supposed to just trust them? The US government totally fucked us all here and now we the people are being even further divided with the spin of "the unvaccinated is the reason for the current wave" &#x200B; This pandemic should of had us unite as people and help our neighbor and unite as one to overcome this instead the exact opposite its depressing I wish we had actual leaders lead instead of what we have &#x200B; Any who rant over enjoy yall day!,willg7607,16274825560,8
h6uv30q,ot7vtq,the craziest part about this was the entirety of /r/news stopping just short of calling for death of unvaccinated people for being the sole members of the community responsible for getting other people sick This whole thing is insane Seeing (usually widely available information) come out with a lag time that trails public reaction is really exposing the true character and intelligence of people What made people think that if they were infected with a variant of a virus that they werent vaccinated against that they wouldnt be able to spread it? We get flu shots every year for this exact reason Maybe tomorrow there will be a headline about how my car actually DOESNT run without any fuel(or charge) SHOCKER,AnnaBohlic,16274949700,2
h6ufgb9,ot7vtq,Is this the same CDC that told us masks dont work last year? Have they done anything to mend public relations after that?,dyingofdysentery,16274885710,1
h6uhvog,ot7vtq,This is frustrating I havent been wearing my mask in public for the past month or so but maybe I should start again I unfortunately agree with some of the "no one cares" comments All this back-and-forth is going to render the advice useless for these people who in the end are going to do whatever they want The US lifted restrictions too soon I also wonder if Ill need a booster shot every year,xx-rapunzel-xx,16274895670,1
h6uiwfd,ot7vtq,Honestly we have to start making the American people get it Not sign anything into law that mandates it but make it very difficult/stupid to not have it (unless doctors note provided) Traveling - you have to provide proof to fly/cruise Public schools and colleges (when the age group is approved) - require it Individual tax breaks for the vaccinated - even if it is a 100 dollars better than nothing Corporation tax breaks - set a threshold for number of vaccinated - if they meet it free money This will create pressure via employers but they will still have to follow the laws while persuading their employees Sure this is a lot easier in theory and I hate the idea of adding more layers of complexity but people really are just that stubborn The excuses that literally make no sense will never go away Now is the time to take a page out of the NFLs book and just nitpick it to death until it is just easier to be vaxxed,shibbyman342,16274899850,1
h6twf5m,ot7vtq,This is all about the slight inconvenience of wearing masks in public What are the acceptable numbers of deaths that justify not inconveniencing people?,LearnsfromDinosaurs,16274803710,-10
hcyc36n,poqczw,We need a new compact a new social contract between patients and hospitals that prioritises serving patients that followed public health guidelines and mandates a minimum reserved capacity for non covid patients and the vaccinated,Zirie,16317158400,49
hczpko8,poqczw,But in Canada you have to wait to be seen by the doctor because of socialist healthcare /s Well now you have to wait to be seen by a doctor AND not have socialist healthcare God republicans are stupid,the_breekiest,16317361100,2
hczzg8c,poqczw,FEMA should come in and make the camps Republicans have been scared about for years Hospital camp is set up in tents The unvaxinated should be the last to get any help in the ER,LuckyCharms2000,16317400710,1
hczrubg,poqczw,You cant stop stupid from being stupid But you might be able to encourage the public at large to self censor the non-mask wearing / and maybe getting the unvaccinated in line for the jab Because otherwise lots of innocent bystanders are going to die because some fool does not believe in vaccinating nor covering his or her germ spreading orifice the mouth I mean,merrickal,16317370190,1
hczutub,poqczw,Sounds more like s logistical and government failure I definitely know some hospitals are no longer receiving aid and resources to treat covid patients and non-covid patients A lot of this does fall on the irresponsibility of the general population for not getting vaccinated but also a large portion on elected officials who no longer feel public pressure to continue covid aid,Bigballerbooks,16317381980,1
hd194qc,poqczw,And Republicans and Conservatives said socialized medicine would create longer wait times Turns out its unvaccinated Republicans and Conservatives who are driving up the wait times,LiberallyClassic,16317612810,1
hd2e16p,poqczw,Just like the Republicans told us would happen if we had universal healthcare lol Poor kid though,Fuzzy_darkman,16317917530,1
h8nk4iu,p2wk4m,Mississippian here to help put this in context: Our governor who is a die hard Trump follower has pulled back from making any mask mandates He wants people to make their own "individual choices" About two weeks ago the leading university Mississippi State University reissued a mask mandate for all classrooms and buildings Then every university followed (Ole Miss Southern etc) Usually the public schools will follow the universities but this point many public schools had already started classes Boom we started seeing outbreaks and the schools couldnt hide it COVID testing is very easy to obtain so parents with sick children started getting tested and contacting the schools Now schools have to alert all of their parents that "Weve had cases" On top of that the MHSAA (state public school athletic commission) decided to step in and announced yesterday that if "Any school goes virtual they can not play fall sports" So this will force many schools to stay face to face just to play football Meanwhile the hospitals are slammed out the ass We have ZERO ICU beds How bad is it? Tupelo Hospital (the largest rural hospital in the state) is using their Emergency Room to house patients Thats right there are people on beds in the Emergency Room waiting for a room on the floors to open up Meanwhile UMMC the states only level 1 trauma hospital (in Jackson) has started putting ER patients in a parking garage that is beside the hospital We are all waiting for a major university to just say "We are going back online for the fall" But it is rumored that wont be done until after the last day to withdraw from a college course passes (so they can make money) Translation: Its a shit show down here folks,mississippiwildman,16287760520,904
h8o3f08,p2wk4m,As a Mississippian our hospitals are about to collapse the numbers are record breaking and still we have no mask mandates no restrictions on activity or group size no proof of vaccination to enter public places We are fucked as we are negligent,nelliescupofstars2,16287842690,9
h8nj8o6,p2wk4m,Further proof that once youre born Republicans dont give a fuck about being pro-life,-xstatic-,16287756460,71
h8ol5jh,p2wk4m,Im from MS At my old school 10 years ago theyd take a classroom the size of a small bedroom and force 36 kids and a teacher in there (were very slow to change so Im willing to believe this is still a practice) In public you still have stupid rednecks that think the virus is a hoax or think the vaccine is dangerous or worse religious fruitcakes that think that "God will cure it" instead of doing something for themselves Nobody enforces masks around here even in places that normally would in other states Most people here actively oppose social distancing masks and other precautions let alone washing hands after using the bathroom (that was an issue before Covid) Moms complain on fb that theyre ready to get kids in school and "out of their hair" all the time Worst yet we have a lot of Republicans who get their info from Newsmax who according to some people I know have been telling people that vaccines and masks no longer work because Fauci was wrong a couple of times and one doctor out of millions said so They dont care as long as things go back to "normal" They could have taken so many alternatives to prevent ONE THOUSAND *children* from contracting the virus and theres definitely thousands more that are being ignored or havent tested yet The government doesnt care as long as things go back to normal the schools dont care as long as things go back to normal the parents dont care as long as things go back to normal its sickening And since kids are walking petri dishes those 1k kids are going to spread it more People will die from this and nobody cares All because of an apathetic state Fuck Mississippi,DoubledDenDen,16287913650,5
h8prwmo,p2wk4m,This is me My family My kids Our school district Had I not followed the data here my high risk kids could have been the ones on ventilators in the ICU Our governor Tate Reeves is yet again out of town touring Republican events while were here dying Im glad we decided to homeschool our kids again Were on full LOCKDOWN [Mayo Clinic Mississippi Covid + Forecast ](https://wwwmayoclinicorg/coronavirus-covid-19/map/mississippi),__A___J__,16288095130,4
h8ogx9f,p2wk4m,Mississippian here Half of the 7th grade class in my brothers school has been quarantined and in my other brothers grade most of them have been sent home too I think the numbers are way higher in MS than reported Nobody here believes in it though so theyre not getting tested Or if they do get tested they dont take it seriously and will go out in public maskless Im genuinely surprised that vaccination rates are even as high as they are here,Huruhi,16287896890,2
h8oxx41,p2wk4m,Republicans testing that theory of how many kids can die before someone gives a fuck Going off school shootings were going to need a lot more dead kids before Republicans start caring and even then theres no guarantee that kids dying will change the ignorant ways of a cult,Modurrrrrrator,16287970180,2
h8nm7wa,p2wk4m,Another republican state hell bent on killing its constituents At some point theyll pivot and say all these unnecessary deaths happened under the Biden administration,SteamyMcSteamy,16287770060,2
h8nndz5,p2wk4m,I can believe how ignorant huge % of population is that they are willing to risk their kids lives to make a political statement We have almost become a banana republic at this point :-),shawman123,16287775280,1
h8ntu9l,p2wk4m,Quick! Someone call a republican for advice! How can this be happening?,Gcblaze,16287802980,1
h8o5xmg,p2wk4m,Why do republicans say the virus was engineered and released by China but also let it spread like wildfire?,Lazy_rat95,16287852970,1
h8odmj8,p2wk4m,Remember this in 2024 Republicans are fine letting your kids and grand parents die,Spurdungus,16287883750,1
h8qgkvo,p2wk4m,im not anti vax im just waiting for covaxin the media has divided the "vaccinated" and "unvaccinated " against eachother concerns with mrnas are valid and you can try to shame me but i assure you i have zero shame why isnt the government talking about covaxin? the only vaccine that uses inactivated virus to train the body to fight covid including the variants and is safe for children same vaccine platform that has been used since the polio vaccine and has proven itself over the test of time why is nobody talking about this? people are talking about making the unvaccinated suffer because they "deserve" it this is disgusting i wear my mask everywhere i go in public and keep my distance but im the asshole NOW that being said anyone who has underlying health issues should definitely consider taking the mrna if they havent already but its really none of my concern the amount of risk people want to expose themselves to,huskydannnn,16288209860,1
h8qgm05,p2wk4m,Biden just needs to make an executive order requiring masks at all public schools,BashStriker,16288210010,1
gwk5bma,n2hns4,Republicans- iTs jUsT ThE FlU!!!,MadamGingerFarts,16198880480,-1
gwjxcst,n2hns4,For me I think its a combo of people under 40 being apprehensive while also the vaccine being jabbed into more arms of older people from the start Also fun fact people under 40 work with the public much more and as these states open and more contact occurs its bound to happen Im waiting for the quite vaping equivalent of a phizer commercial but well wait and see I got my shots worse thing was drowsyness and aches for a day but youd be surprised how many dont want it after hearing the word side effect,Lyskypls,16198847160,1
gwklbvp,n2hns4,But the Republicans told us it was only going to kill the old and the infirm who dont matter!,faithle55,16198947780,1
