gwbltfj,n13x8h,I think hes dead but Id bet a large amount of money that he didnt kill himself No camera footage and the guards were either a sleep or away from their posts when he did the dead even though he was such a high risk inmate? ya ok buddy,jwg529,16197180000,1
gwctmmt,n13x8h,You dont die with that much money and connects Sorry you just dont,theonewhostaresback,16197360790,1
gwdbh5v,n13x8h,Because money started talking so he would stop talking,codyjoe,16197446370,1
gwg35ur,n13x8h,hmmm - follow the money - - - but you cant or have a real hard time trying since no one is talking -,cjgager,16198026490,1
gwbtgqz,n13x8h,Surprised nobody big and powerful is saying "wheres the cell footage" someone not into kids with money and influence needs to stand up and with other powerful people so they dont get whacked in the process,nelsonn17,16197211150,0
h2wz2bh,o707u9,Honest question What is this guys claim to all of his supposed knowledge? It seems like maybe he had a voice because he had the money to be loud Am I wrong?,I_am_Torok,16245605480,3
h2ws1f9,o707u9,He was a Qanon rockstar ie: said a bunch of crazy bullshit for fame and money,HaightnAshbury,16245574120,1
h9a3aa2,p5wmdj,Its not the fault of any one person As a country over 70% of us wanted to invade Afghanistan after 9/11 I was one of those people Until 2009 over 70% of us thought we should stay There are legitimate criticisms that can be leveled at Trump Biden Obama and Bush but it should not stop there We sent 2 trillion dollars of our money over there thousands of lives and altered life for countless American families But it all collapsed in 10 days No matter how bad the president is he isnt bad enough to be responsible for ineptitude on such a massive scale We knew there was a massive problem when we first began to train their soldiers International Security Assistance Force or better known as ISAF is where the major problem lies For one our military personnel quickly gave ISAF a new moniker "I suck at fighting" The majority of the recruits that joined the Afghan military were extremely poor recruits Take a look at this video of our troops training Afghans to do jumping jacks https://youtube/QdggP7rw0mg To be fair there were exceptions to this rule and some Afghans turned out to be great fighters The problem however is that they were few and far between The next issue is that all of this was thought up by a group of bureaucrats who played it like they would in any Western country To give ISAF "credibility" they sought out local "authorities" to sign on Those authorities were the mujiahdeen warlords These are the same warlords that started the Afghan civil war in the 90s So these warlords used ISAF as a piggy bank for the next 20 years Providing token compliance but nothing more This is all to say that our plans should have changed years ago We tried one strategy and it sucked but we couldnt admit we were wrong so we just kept pumping resources into it Im short Afghanistan is the sunk cost fallacy on a monumental scale Anyone responsible for propping this plan up are the real ones we need to blame Yes our presidents are in that group but they are far from the only ones,rhm54,16292019550,2
h9chn8x,p5wmdj,The way I see it is you cant pussyfoot war No half measures For the last 20 years Ive kept seeing "we dont negotiate with terrorists" but yet the US wouldnt do jack shit when they have weapens of mass destruction bigger than pretty much every country 20% of the US stored missiles and a couple weeks could have ended the entire war with essentially no casualties to American lives but it would cost a significant amount of innocent lives in the middle east Instead of losing so many American Canadian and any other countrys lives that was at any time part of this war we could have cut our losses and really went to war the old fashioned way No rules no hand tying just do what needed to be done and get over it War sucks but thats what it is If what was needed to get rid of the terrorists that used children as suicide bombers the rapists murderers etc was to level several countries so be it Just dont wait 20 years let hundreds of thousands of veterans die along with a ton of innocent civilians anyway and tie your own hands saying we can kill these people but not these people The enemy is not thinking that way at all and thats why were pulling out If youre not going to do anything why bother with war anyway? The government has essentially just admitted this whole thing was just a money laundering scheme for the elite,Massive-Risk,16292414060,3
h9apwq3,p5wmdj,Same guy that lied to us all about sadam having weapons of mass destruction which ended up in entire europes pressence in Iraq 2 wars that has costed us so much tax payers money for absolutely nothing And nobody has to face the consequentes,MoffieHanson,16292124820,1
h9biof5,p5wmdj,The US or more importantly the US elites won The amount of money Haliburton and the like pocketed from the insanely lucrative rebuilding and supply contracts have lined the pockets of politicans and corps like nothing else Bush and more importantly Cheney knew this going in All perfectly according to plan,nightbringr,16292262180,1
h9cq4ca,p5wmdj,Dick Cheney made money off the Iraq War,TheFillDude,16292456580,1
h0gipu6,nrgumf,Theyve been pilfering our piggy bank for decades But now its an all out money grab,Time4puff,16227387100,259
h0gmwzr,nrgumf,Corporations should almost never receive federal money in the form of handouts If a corporation dies it dies,breakevencloud,16227404560,191
h0hbili,nrgumf,I love how people literally dont understand this stuff I still deal with the "youre just jealous of the CEOs because they worked hard for their money" crowd People dont understand how much free money that the private sector just sucks from the public sector Its insane The neoliberal apologists dont understand that the corporations arent our friends Theyre not even "our" corporations with their global influence and off-shore tax havens,ThisGuyHasABigChode,16227507310,4
h0gcabb,nrgumf,Ss The rich are stealing from you and then telling you that its greedy to want YOUR money to pay for your education Ye,OwopIningsa,16227360220,9
h0haa57,nrgumf,Counter argument Companies have to compete with foreign companies and win if they lose then according to WTO rules the most competitive gets all the money and in a equally fair game You might lose america cannot And people dont have to compete internationally their jobs within borders of america are protected artificially through imaginary concept of "citizenship" therefore they ought to pay for that privilage That they did nothing to earn Additionally american citizens are financially expendable even if they leave for Lets say canada american government can bring is 100 million more immigrants whenever required at a moments notice,sunnydiv,16227502090,0
h0h7o73,nrgumf,So stop voting for republicans This is so fucking stupid Trump cut more taxes for the rich than any of you have ever seen in your lifetime but because he hates black people too you want to vote for him Meanwhile youll turn your back on someone like Biden who was forced to pass a stimulus bill without a single vote from a republican house member or senator That bill put money directly into the pockets of American people and allowed them to save tons of money on taxes without acting as a handout for the very corporations that you guys hate so much,LibrarianFew,16227491100,-6
h0gkh7i,nrgumf,I can understand wanting to pay less taxes and waning corporations to pay more but why do you want our tax money going to a bunch of useless education? Without some kind of reformation of modern schooling paying for a bunch of education isnt gonna help anything just create more white hating Antifa Communists,Silo420,16227394480,-6
h0hamiz,nrgumf,Remind me where do the individuals obtain their money from? Oh corporations? I see,sanctii,16227503530,-4
h0hjbe3,nrgumf,When the gov blows the money it does Its hard to believe theyd give much to education even if the modern politician campaigned for it The only way to solve this problem is to turn off the tap Like a child with a Credit Card they think they have infinite money and they sure as hell waste it like they do The federal government has no accountability to you as an average citizen Theyd charge you more for better x [healthcare infrastructure education etc etc] then spend it something else the same thing they do every-time We need a change not something that gives the thing failing us even more responsibilities Id much rather that education departments be given back to the states with education tax money being paid there and only there instead with parents deciding were their kids go and the money following them Most things we want the federal government to would be possible at the state level and likely better suited to the people who need it rather than a 1-size fits no one at-all abomination,CorruptedArc,16227540880,1
h0hqos3,nrgumf,Thats in addition to the $35 trillion that the Fed also printed for itself which is no different from taking the money by way of taxation Theyre literally getting it both ways,FlyNap,16227571550,1
h0hv1mi,nrgumf,telling you that its greedy to want YOUR money to pay for your education Im pretty sure few to no people in college have paid 30-50K in income taxes Ill agree though free in-state tuition for everyone who has paid 50K in income taxes Lets make that law now,EvilWhiteChristian,16227591190,1
h0hxz5t,nrgumf,No Its time to end modern slavery through obligatory taxes! Let me save my own money for times of crisis Lets make taxes completely voluntary Want to receive more taxes from the public? Do a great job and be more efficient CONVINCE ME to voluntarily pay more taxes this year because it will be better spent on infrastructure instead of endless oil wars!,SocialismAlwaysSucks,16227605050,1
h0icybx,nrgumf,This is the real conspiracy shit Now how about we find out whos voting in favor of corporate bailouts and investigate where theyre receiving their money from,mrducci,16227678610,1
h0ilhk4,nrgumf,I guess we shouldnt tell her that businesses dont always hoard cash and that money gets spent and circulated through the economy,lametown_poopypants,16227720740,1
h0ipe74,nrgumf,Lets not forget The stimulus money was printed not collected,RickySlayer9,16227739040,1
h0iq9ek,nrgumf,People forget where they work though she probably works for a corporation and doesnt know it If they dont have money theyll stop employing you and thats less tax again for the government,jamieluke97,16227742960,1
h0lv8du,nrgumf,Congress gave you a small time payment which comes with long term problems such as inflation and ever losing value of the dollar meanwhile they also gave billions of your money to billionaires who are gonna use that to set up shop when the US ultimately collapses,Ghostifier2k0,16228369570,1
h0hlzjz,nrgumf,but "education" just goes to teachers unions and then it goes to democrat politicians the money should go on science and American values,Non-equilibrium,16227551660,0
hzrr50x,t8rsni,I honestly dont see how our politicians are expected to use those Uyghurs to launder money,erconn,16466963910,3
hwt9pz4,srhaii,Im unvaxxed as are my kids and my wife We got OmiCold 2 weeks ago I had a headache and an unbelievably runny nose Was this the disease that we destroyed society and surrendered human rights for?,MoneyEqual,16447797890,2
hwtcky3,srhaii,Unvaxxed and fine here I hadnt even encountered anyone who claimed to have had covid until recently and they said the vaccine was worse for them than the disease Personally Im of the opinion covid was probably real but now they are just claiming every new flu is a new strain and trying to keep it going through any fear they can Im not sure why exactly but its like most things probably just money,balancethescales,16447809230,2
hwsiajc,srhaii,I was sick for a week I think it was food poisoning because I tested negative and I didnt have any respiratory problems (although I was coughing a lot because of a dry throat) If it was covid in spite of the negative test then I want to personally thank the hundreds of millions of Americans who have endured months of lockdowns and mask wearing and vaccinations to postpone my illness for a year and a half It would have been nice if all those exertions had protected me from getting sick at all but I still appreciate the effort Your personal sacrifice on my behalf will always be remembered But next time how about sending me money instead? Skip the lockdowns and jabs and just send me a buck and if I get sick again Ill just sleep it off like I did this time,sjryan,16447689140,1
hws1973,srhaii,Made it Want my money back,athena7979,16447613210,1
hwt4694,srhaii,Less than 05% death rate for majority of people on Reddit Its a pandemic of elderly Merely an annoyance for younger population If the clot shot vaccines prevented transmission then there is room for debate Anyone under the age of 60 (or with relevant Illnesses) to receive these shots is was and will continue to be a complete waste of tax payers money resource health and in some cases death,Recaldental,16447776110,1
hv2cc1m,sh2zq9,If you havent already figured it out the school system is designed to groom children into consumers They want kids to only know certain things so govt deigns the curriculum Learn how to do certain jobs Get a job working for some company Make that company as much money as you can Rewarded with corner office and pissy bonus Spend time away from your family so youre unable be around wife to be a husband to and kids to raise and teach It then goes on n on n on from there then your kids are taught by YouTube and screens and social media Wife is lonely from all the OT youve been putting in on hopes for a raise so you can take your family to Disney for a week so she cheats You have suspicions but cant prove it so you turn to the bottle Get first DUI (prison system enters the chat) Missed to much work fired You start Drinking more Get another job but doesnt pay as well Wife divorces you takes kids You get second DUI now doing lengthy time Prison gains more profit You get the gist Its all connected and right in front of our faces Most importantly this could all be avoided with LOTS N LOTS OF MONIESSSS A,koasuniverse,16436735590,2
hv1whk8,sh2zq9,the idea that not teaching children through a CRT lens using taxpayer money is tantamount to banning a book from society is preposterous,nitzua,16436670610,1
hv2dylz,sh2zq9,A lot of this isnt banning books its determining what people want and dont want public money spent on A school district deciding not to buy certain books is not the same as banning a book You can still get these books easily with your own private money,kayjewlers,16436742710,1
hv0uf1q,sh2zq9,to me banning books in schools is not a bad idea Just because a book is being wirtten doesnt mean its good Some of this stuff is just about the money My local library had somethg like 12 copies of obamas book and 10 of george bushes Meanwhile they have 1 copy of a book pertaining to something scientific that was I was on a wait list for which I needed for something important pertaining to school Many schools require students to purchase a book (unless you just say you cant afford it then the tax payer buys it for you) and in some cases those very books once requried to purchase ($$$$$$$$$$$$$$$$$$$$$$$$$$$$$$$) are now on the banned list I do not think banning books with sexual content to jr high kids (who mostly dont read the assigned (see purchased = $$$$$) is the end of the world To me this is a feigned controversy depending on the book of coruse,readingyourpost,16436527630,-1
hv0rtkv,sh2zq9,Answer? private school Youre trusting the government to educate your children? And before anyone says not everyone has the money for it the private schools know this and award financial aid Look into it,Ok_Assistance_2235,16436518050,0
h116d3l,nuw9cw,Or maybe theyre just racist From the dawn of mankind we are always divided because of our ideology races They do not do this so it is easier to conquer them but because they really think the other as a lesser group or an oppressor/bad guy Some people hate the wealthy because the money they have palestinian hate israelis because they are being oppressed some people really think women are weak because they are women Politicians gain power from the weakness of the people that is sooo emotional cant think rationally believe everything without questioning it because it make their ideology seem valid Politicians gain power by manipulating the peoples believe You can post a fake story about Biden doing bad thing on pro trump page and most will believe it at the first glance because it is their ideology A celeberity can say something about politician being bad and most people will agree even tough they are probably not qualified A social scientist can say that women are not in the techs career because they dont want to and not because of sexism based on data the scientist collect and there will be a group that will argue the scientist is false But someone with no data or evidence can say something that appeal to a groups ideology and they will be automatically praise and the the word will be seen as a fact and not as an opinion For us to be stop being manipulated by anyone or a group we must look for evidences about thing they said and not based it from our beliefs we must search for the truth and false in a topic or ideology so that we can be sure that its not a con or completely wrong We must test our ideology by talking with those that oppose us so that they can show us the weakness of our ideology that is hiding behind our ego,Antomy08,16231626240,2
h1104ia,nuw9cw,I mean its literally not a conspiracy anymore Its so obvious that nobody even bothers talking about it because it would be like saying "the sky is blue water is wet fire is hot" The rich buy politicians they pass laws to benefit the rich and screw the peasants and they drive hatred between those poorer people in order to maintain the status quo Almost nobody involved in American politics actually wants to make life better for all Americans they just want to give more power and money to the wealthy and grow the class divide Its crazy to say this but [Alex Jones was right](https://wwwyoutubecom/watch?v=y5HLn3eYLSo) and that was 20 years ago before he got MKULTRAd and his brain melted,raging_asshole,16231598860,1
h12e29f,nuw9cw,Is this a conspiracy? People with power destabilize people without to keep them too preoccupied to grab more You look at the antebellum south leading up to the civil war In what world is it beneficial to a poor worker who has never had money for a slave for slavery to be legal? People today are mad because the mexicans are "taking their jobs" or the corporations are outsourcing to sweatshops Who would believe they would have a job if the corporation/1 percent could liberally breed workers?,stoicalpassion,16231810660,1
h548he1,ojrh7c,"gOvErNmEnTs aReNt pRivAtE CoMpaNieS BuIlD yOuR oWn": - Social Network (Banned By Hosting Infrastructure) - Video Streaming Services (Banned by Youtube) - Hosting infrastructure (Built banned by payment processors) - Payment Processor \ Banking System <- We are here although they are making a run at Bitcoin pretty hard trying to get that shit banned / regulated and put back under woke control I am kind of glad its happening Let Nike enjoy its base of twitteratis harrassing it for BLM and rainbow imbued shoes which they will then subsequently loot as reparations see if I give a shit I will be able to give my money to people who share my values,TheThoughtPoPo,16262348360,0
h563jlp,ojrh7c,this doesnt happen in america though,bigmoneynuts,16262795030,0
hyuksdo,t3gua0,In California people still have to wear masks if they are on public transit or in jail It will become a status thing those with money and/or political power wont have to wear them but the poor and less desirable elements of society will have to wear masks forever no matter how many injections theyre given,1_p_freely,16460941360,1
hqk0t6n,rs1onc,>obviously part of an intelligence ring blackmailing powerful people Yeah that seems highly likely >It seems like an obvious psychological operation to me they want people to think "yay we busted a child trafficker" and move on I dont think people move on like you think It builds up a weight of evidence People are getting away with this shit less and less The next scandal will hit harder because more people are in agreement that this is horrible >It takes a lot of money to buy a trafficked kid Its not your average pedo on the street doing it Its bankers politicians CEOs etc Ok this isnt true Its actually proven to be exceptionally cheap and easy to buy slaves / children >I want EVERYTHING to be brought to light and I am not satisfied I agree with this especially I dont think itll happen in our time though People are still fighting politcal ideologies instead of settling the fact that its a distraction from stuff like this This entire time Trump / Clinton have been running for president being president Epstein was friends with both of them meeting and flying around on the regular Keep that in mind with your ideology that this was an psy-intelop,stonedlemming,16408784760,14
hqk4a72,rs1onc,I doubt that a clear and accurate picture will ever emerge Lets say that bill clinton and donald trump were in a flight log The mainstream media will run a story about trump being "prominent" in the flight logs and claim clinton was only along for one ride from 1 US city to another as a means of saving the taxpayers some money in his travel budget The "alt right" media will highlight clintons multiple trips to the island and hide or gloss over trumps innocent hitching a ride between 2 US cities Do we really care about rich people sharing rides on a private jet? a full and clear accounting of who paid to have sex with underage girls with actual evidence video semen samples illegitimate children with DNA evidence It is not fair to any party simply using circumstantial evidence to make a political point,calentureca,16408799110,9
hqjkj9e,rs1onc,>It takes a lot of money to buy a trafficked kid Not really for the elites flying kids around sure For your run of the mill sex trafficker you can buy a kid for like 3 grand in america A few hundred bucks in other countries,SchutzstaffelKneeGro,16408707200,9
hqktbtb,rs1onc,>It takes a lot of money to buy a trafficked kid Actually no It doesnt *have* to take any money at all Traffickers prey on powerful people as well as innocent children If you can get a person in power to spend time with a trafficked child you as the trafficker now have absolute power over this powerful person Kids can be traded for information or favors in addition to or without money involved The planet is run in shadow by traffickers who blackmail or serve powerful public figures Source: me a previously trafficked child,RainbowIyana,16408895210,3
hqljjwc,rs1onc,Preach!!!!!!!the swamp wasnt drained the blood suckers are still in control and spreading there influence to new leaders we elect to anyone they cant infect with Rhetoric money fame threat or blackmail While the rest of us are fighting over race class gender ethnicity and nationality we have to put all this petty bullshit aside and unite to win ijs fuck the crown damn the queen and may the Stars and Stripes fly forever free,SavagePatchKid1990,16408997360,1
hqmgbcs,rs1onc,Same here People should not back down until all the pimps and clients of the network are in jail for life Regardless of money status or anything,SubstantialAct3274,16409131770,1
hmf22nu,r45a5n,Great work OP I can tell you care about this and damn it do I respect it I do have one small gripe though You suggest that she was working for Epstein Are we 100% sure she wasnt the one that was actually pulling the strings given her familys history and the intelligence connections/family business? I think thats a pretty decent probability in my opinion but Im just throwing it out there as food for thought Not a counter point per se but I think were doing ourselves a disservice if we dont consider some different possibilities with this situation And given the possible manufactured nature of Epsteins persona (nobody knows where he got his money seems to just show up in power circles is handled by law enforcement as an intelligence asset and is disappeared/murdered when captured to name a few) Ive caught myself wondering if Epstein himself was not a propped up ready to go expendable patsy I could even see a scenario where he may have thought he was setting up pedophiles like working for law enforcement Just to be clear Im NOT saying I believe that Im just saying there seems to be a lot more nuance to this situation than a lot of people want to acknowledge That is all I believe in casting a wide net and working from that Nothing more nothing less I think it helps That certainly would not make him a good guy (just to be clear again lol) but when you think of this case that way it opens up some interesting possibilities To believe that Epstein was the pinnacle here (in any way) is to take our eyes off the ball This guy was working for some entity My point in saying this is Epstein most definitely could be just a prop and always a cut out to take the fall that is a well known practice for these types I think there is just as much to indicate that Maxwell was the one in charge as there ever was that Epstein was the head of this Or it could go much deeper than that (very likely IMO) Thanks again for posting OP And take all of what Ive typed here with a spirit of being helpful because that is how it is meant,Flop_McKochen,16381184880,95
