heqh0nr,pxsxc6,This graphic I dont think is entirely true If you read the Wikipedia entry under the Iran-Contra Affair he diverted the money from the sale of weapons to help aid the Contras in Nicaragua The sale didnt appear to be illegal it was diverting money that was to be used to fund the Contras which was illegal https://enmwikipediaorg/wiki/Oliver_North,developerEnabled,16329304770,-3
her75m0,pxsxc6,Ollie North just follows wherever the money takes him These people that end up on Fox News dont actually have beliefs they stick to like talking about Covid vaccine doubts on their shows while being one of the first to have been vaccinated,_pls_respond,16329410520,0
gv9t4o0,mv1oik,Ok then where are those companies getting all their money from? Less consumption companies make less product the companies making the raw material shut down eventually they have to slow down A lot of people are very happy to be able to do something about the problem I cannot stop an evil company in any way more powerful than Facebook posting and voting Even organizing a protest can only be dome with the utmost care or it may backfire and be used to make your movement look bad When we choose less destructive alternatives we take money away from polluters and give it to the people making more modern and healthier alternatives If one persons money doesnt matter when they have a million customers than your vote must also not matter and your reddit comments matter even less The corporations seem to be destroying the world but the way it is phrased seems perfectly constructed to depress people and convince them to do nothing Never surrender! Rage against the dying of the light! Even if all you did was buy one less hamburger if the Nestle Drones come to harvest you for parts you can at least die knowing you did something besides nothing at all,EternityForest,16189666900,25
gv9u69l,mv1oik,Reminder that 100% of the customers of said corporations are ppl who decide to keep giving them money,Geofherb,16189672260,12
gva3qgg,mv1oik,Hold them accountable for selling you things by refusing not to give them money as CNN suggests,Conscious-Youth5676,16189722540,2
gv9vv7l,mv1oik,These industries exist because people give them money The real conspiracy is the attempt to keep people mindlessly consuming to feed the beast with this dumb propagnda Take personal responsibility ps go vegan the animals dont want to die and your body doesnt need corpses Edit: This isnt to say that climate change wont be exploited by the elite to take away freedoms Thats why its even more important to do things on our own,TIMOTHY_TRISMEGISTUS,16189681010,8
gva6uen,mv1oik,A lot of those corporations do make a lot of money via the meat industry or automotive/aviation industries,redvillafranco,16189739670,1
gvaa3ig,mv1oik,Do you buy from these corporations? If so you are responsible,Money_Walks,16189758670,1
gvaeetd,mv1oik,Yes and those corporations provide energy Much of that energy is used for the production of meat transportation and climate control So go ahead and wag your finger at the corporations while handing them your money See where that gets you,arstin,16189785480,1
gvanm4t,mv1oik,Do those corporations not make their money off of ordinary citizens? We can change how incentivized they are to pollute by buying their goods and using their services less no?,swizznastic,16189853900,1
gvbyjiv,mv1oik,Use a smart thermostat yes because all of us own our homes and have the time and money to install a new thermostat right,monkeybra1ns,16190182170,1
h2koxek,o543q5,Banks should be overhauled and completely separated from the federal reserve The only reason they even want people to save is so that they can use more of your money for loans on risky investments because theyll get bailed out again if something happens anyways Keep your money out of these scummy businesses and invest in what you believe in,deadlyspawn187,16243059500,601
h2lfq20,o543q5,If your account dont have the money then the card should be declined a god damn fee for being broke is bullshit,coolsometimes,16243190820,28
h2krnv9,o543q5,Well theyre right Poor people dont get bailouts when they do irresponsible criminally negligent things with the money that other people have entrusted them with so they really should be more responsible,NarfMann,16243072040,20
h2ljjmt,o543q5,I mean they not wrong either so many people are not budgeting their money complain about how they broke but every morning buy an 8$ chai latte and avocado toast while complaining on their macbook they got in debt to bought,letienphat1,16243211550,5
h2mxexn,o543q5,At best it will cost millions of lives at worst it will take the planet back to fungus and bacterial life but I think that soon humanity will realise We cannot eat money,elasmonut,16243571690,2
h2nnhbi,o543q5,Coming from them it means shit but theyre not wrong Sometimes its not societys fault you dont have any money Victim culture,Odd-Pomegranate-4062,16243731910,2
h2ld9no,o543q5,This why governments and banks afraid of crypto Crypto is money for the people by the people Decentralized,greenmachiner,16243177510,3
h2lge6j,o543q5,Ya but two wrongs dont make a right You gotta give the devil his due Ppl spending their money frivolously is a major contributing factor in money mismanagement issues I personally deal with this myself The women may be but the Beers not cheap at the pub Lol,pghsteeler,16243194430,3
h2ldadm,o543q5,To be fair they *should* stop being so irresponsible with their money Everyone should,WolfeBane84,16243177620,2
h2kuj7p,o543q5,well Im not gonna lie there is an entire generation from top to bottom elite to poor that are just straight up errisponsible with money People complaining one second about struggling to lay the rent but bragging about standing in line to cop the newest Jordans or fucking iPhone 13 x And Bankston even get me started Bailouts for billionares and foreclosing on people that are a few months behind Its all insane And the worst part is the sane people who notice this are mocked and labeled outcasts,weakmoves,16243085140,4
h2l6y1x,o543q5,The banks didnt crash the economy Progressive politics did Banks were effectively forced to give out loans to people with bad credit in the name of racial equity in housing Lending restrictions were relaxed with the tacit understanding that the federal government would back them up if shit hit the fan Then shit hit the fan and the government bailed them out (with our money) because it was the government that forced them to take those risks in the first place Wall Street and "the banks" get all the blame for it but they just played the game according to the rules that the racist meddling asshats in DC forced them to play by,RattlinChattelMonkey,16243144500,2
h2lhngn,o543q5,Well yes You dont get rich by blowing money on useless shit,RockfordSwitch,16243201220,2
h2m53dc,o543q5,I hate this mentality: "I perceive banks to be irresponsible with their money so why should I have to be responsible with my money?" The precursor to: "its not my problem Its societys problem so therefore I shouldnt bother changing my behavior until the problem is fixed",HappyNihilist,16243332740,2
h2l3svs,o543q5,People are poor because they dont make enough money Not because they spend $8 at starbucks or $10 on a cab,BluePill_me,16243128700,2
h2lm6do,o543q5,Everything is absolutes now No nuance In my experience hardly anything is absolute and is somewhere in the middle People are far too often irresponsible with their money That doesnt change the fact that the Bank and its owers/operators are crooks,BaldHank,16243225620,1
h2lqpsm,o543q5,Both can be true Poor people tend to be bad with what money they have Banks shouldnt be to big to fail we should have never bailed them out,-Zo_0,16243250340,1
h2lp6rm,o543q5,You can laugh but I didnt start feeling wealthy until I learned to stop spending more money than I earned I doubled my salary twice and still felt poor Then I stopped spending money and learned to build wealth @Chase knows what they are talking about That second half about taking a bailout Thats on our politicians for not allowing the weak banks to die,stmfreak,16243241920,-1
h2lfasb,o543q5,Money dont buy An Another Rye,koolrobg233,16243188510,1
h2lki6z,o543q5,Be responsible with your money - Not a millionaire,BurtMaclin11,16243216780,1
h2lnxwf,o543q5,I mean they are not wrong tho! It would save us all a lot of money and cost the big franchise business lots of money if we all did that The real power is to vote with our dollars Also Chase suck a big one,SpaceMonky9,16243235150,1
h2m2p92,o543q5,With the banks money,8_inch_throw_away,16243318260,1
h2m4vbe,o543q5,Sure but Chases point is still true I know tons of people earning in the top 2% who run out of money ask for help and generally just suck at managing their money,TuxAndMe,16243331350,1
h2m9quw,o543q5,People think that giving your money to a bank is simply a way of storing money Its not Banks wouldnt make any profit then Know what is happening to your money folks,realMartianJesus,16243363440,1
h2mb11e,o543q5,Anything else to make at home to save money?,dubreddit78,16243372330,1
h2mcrot,o543q5,People are broke because they buy $8 coffees they spend hundreds more each month eating fast food and name brand meals they have 10 different monthly subscriptions for online services they barely use They pay the minimum on their credit cards always paying interest and never save up any money for the future,Beezu999,16243384830,1
h2mczym,o543q5,What do you want them to do give you that money? Dont spend it if you dont have it simple as,tekcor-,16243386510,1
h2mf0zf,o543q5,Other than "banks bad" how is this a conspiracy in any sense of the word? The Chase Bank isnt a person it didnt write this Tweet some guy in PR did In fact Im willing to bet this came to be because whoever wrote this was told to make a /#relatable post and their thought process went something along the lines of: "I need to make something relatable hmm well we are a bank banks deal with money why not a meme* about finances? That could work" The implied advice is actually good advice if you are looking to save money it just comes across as patronizing and hypocritical for a bank to be saying it due to the fact that they make their money off of loans And yet despite this being nothing more than a hypocritical joke somehow people managed to become convinced that it highlights a secret motive of banks(despite that secret motive being a well known one) I swear this sub is the Redgrin Grumble of knowing whats going on *I dont think the joke formula used counts as a meme but I have no clue what else to describe it as beyond "joke formula" and that sounds too formal for my mock scenario so meme it is,TheLastBallad,16243402010,1
h2mk10p,o543q5,Circumstantial ad hominem https://enmwikipediaorg/wiki/Ad_hominem#Circumstantial Be smart with your money,baileyarzate,16243443560,1
h2mr6id,o543q5,Why is JP Morgan always brought up in these stupid memes JP Morgan didnt need to be bailed out the government forced them to take money or it would make the other banks looks bad Secondly the US government and American people made a profit on the JP Morgan bailout and JP Morgan paid it back the first day they were allowed to,LeonBlacksruckus,16243511150,1
h2mm2w7,o543q5,i stopped banking with Chase over their politics I keep my money in local CU now,sharkezzy,16243462020,0
h0b6gt7,nqiwya,"I support you being gay as long as I can make money from it",Nox1201,16226399350,483
h0b77xt,nqiwya,People in here acting surprised by capitalism like WTF actually? If it makes you more money why not?,Future_of_Amerika,16226403170,20
h0ca2c5,nqiwya,They pander 365 days a year But this month theyre after gay money Gay people are now truly equals And get exploited as the rest of us,multivers389,16226568020,2
h0bx8d9,nqiwya,This isnt even a conspiracy Its marketing If the numbers told them posting bigoted homophobia would net them more money theyd be posting hate speech,kingcal,16226517210,2
h0bad91,nqiwya,So the conspiracy is that businesses want to make money and not alienate potential customers Got it,pixel8d,16226418710,2
h0ax6mb,nqiwya,as gamers we all know that bethesda is one of the worst publishers right up there with EA Activision and co but what i find super creepy: For the last 6 months (since i made a habit out of checking the MSM via the google news app) there is constantly litterally only one gaming related "news" and its always skyrim/ elder scrolls related bullcrap like how much money is bethesda able to pay for advertising their shit?,NotEvenA_Name,16226344120,-4
h0d0fnh,nqiwya,How is this a conspiracy? Companies like to pander to anyone and anything if it makes them money Do you people not now how business works? Lmao,MrkJulio,16226678140,0
h0cmmw1,nqiwya,They could give two shits about us they do it for money,LingoJam69,16226620660,1
h0bq1yd,nqiwya,Microsoft owns Bethesda They could face legal repercussion in many territories for changing their logo They do change it where they can And they donate annually to global LGBT programs From programs that focus on bullying and suicide of LGBT in countries like America that are more progressive to international groups that influence acceptance and change in the countries that they cant legally display a pride logo As a gay man I see that they are using their publicity for the community their money for the community and not to mention that their games have examples of same sex relationships I ask myself who is doing more here? The corporation that has donated millions and increased visibility (or pandering to the gays as you put it) or the guy on Reddit whos belittling pride because of course you cant just come out and say it there needs to be some virtue signaling to cover up your true intentions Right? Right Fuck off,Wilsonahrens,16226488490,-2
h0atc1e,nqiwya,The sea of blood the sea of lust the sea of decay the sea of death I was at least twenty feet high A second letter approached I began to smile for it was from my father A letter in the shape of blood The first letter was signed in a pale and sickly script It asked for blood water blood It was filled with a voice far colder than mine but my mother said I shouldnt be afraid The letter was full of information It was sent to the first and only place it knew of It asked for a letter A third letter approached My mother said I would meet me back The third letter was filled with what appeared to be poison It asked me if I wished for blood again I felt weak The four letters entered my mind I had not heard from my father for twenty-five years The silence was like a fog in the air I sat in front of my computer in silence When I woke I was standing in the middle of the street I had the only pair of shoes I had on me and one of them was broken There were two other pairs in the car I was driving in My feet were so sore that the soles of the socks felt like jelly The two people who found me immediately stopped the car They gave me some money and told me th,0N0W,16226316170,-17
h0d96ty,nqiwya,Well they have money to buy games Id pander the shit out of them,Dorangos,16226717220,0
h0koedm,ns4d7l,This post definitely glorifies him If you know the whole story he was a real asshole whos own greed screwed him over He was holding out for more money as the concrete plant was to be built on his land They chose to buy the land next to it from the city at a reduced rate (the city did not want to lose major tax income from this plant setting up in another town) Marvins sewage line was illegally run across the new lot and he was supposed to pay for the new connection and refused He was not liked by many in the community and he blamed many of his bad decisions on the people around him But at least he only wanted to hurt them financially and emotionally as he thought was done unfairly to him,Heeey_Hermano,16228186170,221
h0kpdvr,ns4d7l,Fuck this guy He painted himself as the victim because he tried to rip off a bunch of people and it failed He isnt a folk hero hes a moneyhungry shitdick who got cranky when he didnt get his way,Valor816,16228190570,41
h0l0ykm,ns4d7l,This is absolute peak r/conspiracy Completely fabricated story to make this fucking lunatic dipshit look like a hero Zero mention of the actual issue which was a sewage line No mention that he personally sold the land to the concrete factory knowing it was going to be a concrete factory Nothing about how most of the fighting with city council was over Heemeyers renegging on the deal and trying to get more money for the land City was fucked for expecting him to pay $80000 to connect to the sewage to be sure but if you think his reaction was appropriate then please continue to hold your breathe forever OP should be ashamed to post such absolute fucking nonsense,GnomeChonsky,16228240710,6
h0mn06i,ns4d7l,Yall do realize that the city offered him enough money to buy a much nicer property and still have money left over not to mention that he was a religious-fanatic who thought that god wanted him to do what he did To praise this man is completely ludicrous and every time I see this post it just goes to show how much people regurgitate the things they see on the internet without looking into it themselves,eyeswideopen1235,16228501310,2
h0lda3h,ns4d7l,He wasnt a reasonable man Almost all of that is misleading or false His access road was never blocked He was trying to extort money from the concrete plant through use of the town council When they managed to avoid his bullying and just expanded in a different direction is when he started planning his rampage This keeps getting reposted because some people are more interested in a fun story than anything approaching fact,CosmicLovepats,16228293530,4
h0km475,ns4d7l,Wow See this is how the system FUCKS the ordinary man when theres a pile of money involved I guarantee the local government was getting kick backs and or was owned by someone in the government Otherwise why would they be so unreasonable as he said Pretty fucked up story,RepublicKev,16228176620,-1
h0nkqp4,ns4d7l,I like this only because he stuck it to the man Push me too hard ill go killdozer on your ass too I love that he took 3 years and never lost sight of his mission to make a point Beyond that though he seems like a bad person He definitely planned on killing people he just couldnt No ones land they own should ever be messed with against their will though I dont care that people are saying he could have walked away with more money to buy more landHe liked the land and it was his THEN they fucked it,Fuckerofmothers64,16228693320,1
h0lhqw4,ns4d7l,Are we seriously celebrating a millionaire who decided a rampage was a better use of his money than going through the legal system? Who preplanned this and did it because he felt god told him to? And here I thought this sub regarded property damage as the worst possible crime but I guess its different if its a rich white man protesting having to pay to update his sewage system,TheLastBallad,16228311520,-4
h0kofl1,ns4d7l,Concrete factory probably had insurance and plenty of money so did the city Dude was probably like a couple of bee stings and youre allergic to bees but you have an epinephrine shot handy Also bees die when they sting you Edit: I read up on this this is a bit romanticized version from what I read but still a pretty epic story,Wilsonahrens,16228186310,-2
gwghk2i,n1sfuh,Brother its just not US My country (India) has enough money to spend on defence parliament building foreign trips of politician but when it comes to giving oxygen to patients they start asking for donations,bishwaskumar99,16198089390,7
gwfgbr4,n1sfuh,War makes money and keeps the people divided War are $$$$$ printing machines Always have been Thats why theres always war They are also very good at keeping people divided And the first step of controlling anyone Is divide and conquer The more you can come together the more power the people have They are terrified of the peasants gaining any power and control,CrayonEater3521,16197928780,2
gwg4zk8,n1sfuh,Thats because war gives jobs and booms economies with weapons manufacturing and military expansion Not that this is a good thing And shelling out money doesnt This system is backwards,consciouscell,16198034290,2
gwg580b,n1sfuh,Got money for bombs,aBeaSTWiTHiNMe,16198035290,2
gwgg4vm,n1sfuh,The government doesnt fund the economy The economy funds the government If people dont work there isnt any money to give away,footfoe,16198082950,2
gxec2ph,n1sfuh,money is infinite if you borrow it from the future,Consistent_Draft_564,16204891020,2
gwfkakw,n1sfuh,Why are we complaining about not receiving money rather than the taking away of our freedoms?,GeekyNerd_FTW,16197946110,3
gwf867x,n1sfuh,Theres always enough money for getting rid of people and accumulating resources among the plutocrats,Bleepblooping,16197890570,2
gwfdjmw,n1sfuh,This is stupid as hell! I dont know anybody who was negatively effected by the lockdowns and I know a lot of people who live paycheck to paycheck Most people are making more money on unemployment increases and all that junk than they made working Very very very few people in the USA are suffering because they didnt get enough free money Im not saying the government was right Im saying that people are whining little bitches who just want free shit THERE ARE JOBS LITERALLY EVERYWHERE!!!!,Banned_Over_Nothing,16197916340,1
gwgln3r,n1sfuh,"They got money for wars but cant feed the poor" - Tupac (Keep your head up),ihatemycat92,16198108250,1
gwfgm1x,n1sfuh,Thats a crass oversimplification and frankly wrong Those in the government (and elsewhere) who opposed the stimulus packages were largely in disagreement with the OTHER ridiculous spending in the proposed bills not the payments to individuals Besides war/military presence is a typical government endeavor that gets budgeted for; handing out bunches of money should not be the purview of government and it should not be included in a normal countrys budget,only_the_office,16197930040,1
gwfgp5q,n1sfuh,Again Military industrial complex Its real its not a conspiracy despite the nay-sayers The global elites and big banks love war because it makes them alot of money We the people are just expendable pawns in this game to them,nwrcj90,16197930430,1
gwfh5jl,n1sfuh,What is infinite money From where are these economic advices and infos coming from lol?,Zauxst,16197932450,1
gwfhd6k,n1sfuh,Nah they dont want to do that theyd rather send that money to other countries,Oxiraven,16197933360,1
gwfnhb9,n1sfuh,I am all for helping your own citizens but the estimated cost od the war is around 800 billion dollars Wouldnt giving all americans a meaningful amount of money for a year or so would far exceed that no?,HappyLemon745,16197960000,1
gwfopui,n1sfuh,Well their is a military budget but still its a joke that they keep getting more and more money for themselves and less and less goes to us over special interest,surfzz318,16197965340,1
gwfpdls,n1sfuh,Public spending in defense is in fact a type of governmental subsidy - only its a lot more advantageous for people in power: it allows them to distribute contracts to whom they like and where they like to influence geopolitics to develop the technologies that benefits them most for global competitiveness (wireless for example) and Im sure Im skipping a few other good ones On the PR front its a bonanza: they get to play tough in the press conferences they rally the nationalists put flags everywhere and and and: they get to keep pretending that they are promoting capitalist values! Its American companies right? there is a bidding process isnt there? Whats not to like? By the time the smart missiles blow up everyone has forgotten that the money came from taxtpayers and was allocated by a bureaucrat worthy of the soviet union,scaredofshaka,16197968210,1
gwfsx0g,n1sfuh,Amen on the OP! Ive wondered for several years why we give foreign aid to countries we borrow massive amounts of money from It leads me to believe the "foreign aid" to some countries is just a way to funnel back millions to politicians,boomerinvest,16197983210,1
gwft0kr,n1sfuh,Thats literally not how money works but okay,NeoKoseii,16197983630,1
gwft257,n1sfuh,Because money spent on the people isnt money spent on what keeps them in power,joshawoo71,16197983820,1
gwfte8a,n1sfuh,There is infinite money what do you mean? Federal employees got a different stimulus,rSpinxr,16197985240,1
gwfu4nt,n1sfuh,"The sinews of war are infinite money",CreamyDingleberry,16197988370,1
gwg2uzd,n1sfuh,The GQP for ya Block all kinda help for ppl,Money_Butterscotch68,16198025200,1
gwg938a,n1sfuh,Weird government man maybe they just want the oil to sell for profit and make more money while taking more money from its citizens to fund a war for them to gain more money ? Maybe  Who knows,ThanksConfident3605,16198051840,1
gwgc7eu,n1sfuh,And as this seems like it makes sense Id have to say that I The governments eyes wagging and funding wars also makes money for all the American defense contractors who in turn employ US citizens and line politicians pockets Giving people money to stay home and not contribute to the gross domestic product doesnt make them or the country any more money thereforelet them slave away,Gwuana,16198065490,1
gwgfawd,n1sfuh,Well I mean we have to have enough money to fund things like space programs thats more important right?,420andi,16198079240,1
gwggs2t,n1sfuh,Money is a synonym for control and whoever questions it gets fucked by those who control it Thats why they got endless money for the military and none for those who "need" it,Geesle,16198085860,1
