h5b57jm,okyu6g,The Panama Papers revealed that virtually every wealthy person on the planet hides money there Unfortunately after they blew up the 1/2 no one cared,ForgivingCogivarg,16263762380,934
h5dupa9,okyu6g,if by conspiracy you mean people lawfully keeping their own money they earned instead of letting the government steal it then sure the real conspiracy that everyone can see is joe biden selling access through his sons "art",c-o-s-i-m-o,16264339130,4
h5brcff,okyu6g,The real question is: Why doesnt the US government close those obvious loopholes? Answer: Because they use them also to funnel money,waggletons,16263861170,27
h5deeix,okyu6g,Good for them Stop stealing peoples money and they wont have to find ways to hide it,2PacAn,16264200070,4
h5dqpbf,okyu6g,Many hedge funds run their money through the Caymans These same hedge funds are involved in an illegal practice called naked shorting Theyre trying to profit off the destruction of companies at the expense of innocent employees and retail investors Where are the fire-breathers like Bernie AOC and Lizzy Warren when it comes to hedge funds?,NewtonPrep,16264307690,3
h5drxsm,okyu6g,Cayman Islands is the answer? cmon guy Its been stable for 30+ years not Switzerland stable but easier to access Dont chase the money there are 100 nations happier to hide it just slightly riskier Clinton Foundation chose Haiti audit that right now lol,Alternative-Buyer-99,16264317780,3
h5e25tq,okyu6g,And politicians who never had a job outside politics have more wealth than their salary could have accrued Insider trading backroom deals quid pro quo Theyre worse than the 18000 plus companies IMO because they are doing it with taxpayers money,Elegabalus,16264387800,3
h5e4bgr,okyu6g,And theres a Federal Reserve that prints money out of thin air and then lends it to the american people,Frownywise,16264400020,2
h5be7g6,okyu6g,Who needs tax revenue when you can just print money!,DaRuz00,16263802400,3
h5b3a1h,okyu6g,How dare these people not let the government steal their money from them!!,Cali_AnCap,16263753940,-1
h5bfc9u,okyu6g,Why do we care about them paying taxes! These guys just keep printing money anyway I dont care if billionaires have all their money as long as government mismanages every cent they get and just prints more This is a red herring We all know government doesnt do anything good with the tax dollars anyway!,Ben-Bartley,16263807520,2
h5b4pl7,okyu6g,Good fuck taxes If I am making money internationally and in order to bring it back to the states I have to give up 35% why the hell would I do that when I can take that money and park it in a business friendly country then reinvest it where I see fit? Lower the goddamn rates and you will see the money flow back in - dont knee cap me at the door,madkow990,16263760160,-6
h5b7x4q,okyu6g,Its not a conspiracy people put their companies in tax free countries to save money if you try to "stop them" theyll just renounce their citizenship and move somewhere else,random_reddit_user_4,16263774590,1
h5bbsgb,okyu6g,Good for them The government would just waste the money anyway,Swish18,16263791470,3
h5b5bcm,okyu6g,Based The less money we give to the federal government the better The more money they have the more power they have edit: Stupid statists below supporting higher taxes Youre in a sub about conspiracy theories and you want the government to have more power,Peensuck555,16263762850,-13
h5bapg8,okyu6g,Fuck taxes Would rather have millionaires keep their money than fund endless wars and massive fbi and cia operations to fuck over citizens,JackHoff13,16263786730,-9
h5b247m,okyu6g,Why do I care? That money was just gonna be wasted by Bernie anyway,callmebaiken,16263748990,-20
h5bylge,okyu6g,See? Now *THIS* is real conspiracy This is not a "bug"its a "feature" of the system Anytime the government wants to they can close loopholes like thisbut they choose not to They are giving these companies a way to defraud the US governmentforcing the burden of that missing tax-revenue off onto the individual tax-payers who cant afford to take advantage of the same "loopholes" These companies are the ones stealing you tax-moneyand the government is not just looking the other way theyre holding the door for them while they make their getaway,Archangel1313,16263896030,1
h5cnck3,okyu6g,The real scam is putting businesses into a situation where they have to set up their headquarters overseas to avoid having the government steal massive amounts of their money under threat of being locked in a cage at gunpoint,NothingCleverAtAll,16264024220,1
h5bdnxn,okyu6g,the government trying to steal more money to squander on shit to make the world a worse place?,liberatecville,16263799910,-2
h5b80el,okyu6g,Maybe if the Democrats stopped raising the corporate tax rate companies wouldnt feel the need to hide money for their stockholders Stop penalizing successful companies for the twisted goal entitled Socialists have,Aggressive-Job-1909,16263774980,-7
h5b5wdt,okyu6g,Dude really wants that money,SpecialistParticular,16263765480,-1
h5bkl4q,okyu6g,Moneyland,Aneizi,16263830310,1
h5bnsxk,okyu6g,I remember hearing this on a planet money podcast episode They set up a shell company to show how easy it is to set up an anonymous company And they even visited this building here Very interesting podcast If I remember the episode Ill link it here,luvs2spwge117,16263844800,1
h5c06gp,okyu6g,I would use that building to stage election frauds coups propping up dictators money laundering tax evasion funding secret wars and on and on,FloydButterfly,16263903870,1
h5cdfeb,okyu6g,Whos the fucking law maker here? Do something about it or maybe just keep tweeting,erokmoney,16263972040,1
h5dkfcp,okyu6g,How is this a conspiracy? More like an open secret Maybe most people dont care to know and most of the people who know dont have an idea of what to do with the info but its already almost a running joke in Hollywood to get money and put it in a tax heaven,Durzo0420Blint,16264252560,1
h5gtgto,okyu6g,Why is this bad? More money for the citizen and less for the state,AJITPAI_OFFICIAL,16264845570,1
h5ovbc4,okyu6g,Ok now thats ridiculous The Caymans are a favorable place to incorporate because it can be done quickly the fees are low disclosure/reporting requirements etc If youre doing international transactions its neutral ground for all the parties involved because in the event of a dispute they have well-established case law and theres less room for bias/favoritism when they have no interest in the outcome Not all countries have tax treaties with one another (agreements to prevent double taxation)say party A and party B are from countries without a tax treaty Good chance they may be taxed on their money twice Cayman does not have any tax treaties but their zero percent tax rate allows them to act as a buffer of sorts when the other parties do not have direct tax treaties with one another Cayman government and banks share information with the IRS; two countries have an information sharing treaty to that effect So no there are tons of legitimate reasons to incorporate in the Caymans and no those benefits are not exclusive to US companies,maybejdcpa,16266507620,1
h5pfx5b,okyu6g,CITADEL securities has 8 companys in the cayman islands where they put all the money they steal from people buying amc and gme stocks its crazy 120 billion in 5 years they are a market maker and investor and trade ahead of retail traders,ObligationOk8118,16266609630,1
h5bylqw,okyu6g,Eh that money would mostly go to fucking us over anyway,TheonuclearPyrophyte,16263896070,-5
h5bujjz,okyu6g,Personally I have no problem with this I offshore my money to evade taxes as well Its the smart thing to do due to the insanely high taxes,moonbatkilla,16263876360,-3
h5bmy0k,okyu6g,Well perhaps they wont do it if clowns like Bernie Sanders stop stealing their money,Jamesr792,16263840870,-2
h5c2r0f,okyu6g,Fuck paying taxes Thats so overrated If the us had a 10% corporate tax and no income tax plus 2% sales tax then the companies wouldnt need to hide their money,castrobundles,16263916820,-2
h5bn9h5,okyu6g,not a conspiracy its nothing more than smart people using loopholes to save their hard earned money you knowassuming someone actually fact checked the screen and found evidence of Bernies claims LOOKS like projection to me Bernie uses the same loopholes and protections that his constituents threw on capital hill He doesnt talk about the millionaires anymore BC HE IS ONE! now he just talks about the billionaire I liked Bern the early Bern BUT having him and the Bernie Bros get hosed and cheated TWICE!!!! not just once but TWICE! kinda opens your eyes on who pulls the strings the people (left) vote for/wanted Bernie the DNC wanted/chose Hillary/Biden (the establishment crew) THAT is the conspiracy,mr-no-homo,16263842320,-1
h5c04qn,okyu6g,Just another political worried about the government not getting their cut but couldnt careless about how much of you money the government wastes every day,Amazing-Performance1,16263903630,-1
guoi1kv,mre4hz,Thats the issue probably whole washington took the money,jostheholywagon,16185402570,2
gult0a1,mre4hz,[**steven pasquale**@StevePasquale](https://twittercom/StevePasquale)[Apr 12](https://twittercom/StevePasquale/status/1381639790613962753)Just back from Mar-a-lago after chatting with a life long criminal con man and rapist who commits tax fraud and launders money for the Russians to continue to downplay the seriousness of this global pandemic Honorable &#x200B; Oh this guy is SUS af,TheREALRossman,16184953090,6
gum2j35,mre4hz,Aint gonna happen IMO Too much money - power involved All this fresh meat coming across the border,tittiebream,16184996350,1
gum9ssz,mre4hz,Nope thats a waste of space time resources and money the real answer is we bring them on stage in public we broadcast their executions on every tv station all over social media and we make sure they suffer enough to deter others from committing those crimes,RIP_Vladimir_Lenin,16185027680,1
gunyv86,mre4hz,Epstein used his wealth to go to big money charity events to meet celebrities He met basically every rich person in the country That doesnt make them all pedophiles,footfoe,16185302370,1
herxj4z,mre4hz,This is great and all but they have all the connections and money to control the judicial systems,SirKenneth17,16329518870,1
ho4lxp7,rdg5q3,If youve money and influence they court you and try to be friends with you and try to cater to your "needs" (if you know what I mean) Kind of like honeytrapping Now not everyone who was associated with them was into the pedo thing but those who had special "needs" were definitely catered to They were either keeping them around for the access or the blackmail,exedyne,16392354250,3
ho28k39,rdg5q3,and an iPad I dont trust that Jobs chick at all Look at the other stuff shes involved and giving money to,thepolishpen,16391847860,2
ho1fm7h,rdg5q3,If anyone thinks that child sex trafficking is fake news then you havent been paying attention to what happens every year in our country and the poorest countries around the world! These people prey on the poor just as they abuse them for work they also use them for their own devious purposes! This is as old as our history MEN have sought out the vulnerable and taken advantage of them and abused them for whatever purpose they wanted! As a survivor of this type of destructive behavior it has taken me a long time to realize that it wasnt my fault but it breaks you down piece by piece until you start self medicating and then you are deemed a delinquent though the judges and lawyers know what happens when a child is thrust into something like this they have no compassion for the children they add abuse on top of the abuse! We have tried to bury this stuff for too long and it is time for those who are elected to protect and serve have to be held accountable and forced to start doing their job! I could tell all of the heart wrenching stories but it will not help to change some of the peoples minds that are in charge! The only time that they come close to caring is when it happens to a child of status and even then they try to bury it! They have the money to pay off the officials in the right places and it just keeps happening! I spent most of my life with anger and self medication and it hasnt really been much help I hope that this is a start to holding them accountable maybe this one woman will open the door for all to see just how pervasive this really is but she is going to have to draw a roadmap to how these people do the things they do! I pray that everyone keeps the pressure on our Justice system to get real Justice for all of the children affected by the ELITE!!!,uselessbystander34,16391724080,5
ho3w5mo,rdg5q3,I clearly dont support this and I dont like the connection being shown in the photo **but** OP did not bother to read the article The Atlantic is calling out a specific problem to a Qanon group called Save the Children who go on tv claiming that a million kids a year go missing in the US These people are like a church in the US laundering money in the name of donations for saving children and are under a criminal investigation as someone else mentioned Someone else also mentioned that these fucks would be seen with *anyone* so that it didnt look suspicious they were hanging out with specific people,jlumsmith,16392201410,0
h3fdkef,o9w3t8,I really dont understand how normies manage to still exist Literally every direction you look there is corruption and evil I mean with the littlest effort you can quickly uncover that evil people are doing whatever it take to acquire power and money throughout the world and naturally these evil people are working together while we The People are being convinced to hate and fear each other but to trust the evil people that control the laws and reality we live We have the technology and knowledge to be so much better but there is no motivation to do better all they care about is how strong their power and control is They believe they are better then The People and are meant to control us that we are nothing more then slaves meant to serve them and make their lives enjoyable We fight with each other over scraps and they keep us in line because the people in power worked harder then anyone else right? Wrong they or their family just were willing to kill or do what ever was necessary to gain the power Even though shit doesnt make since to these normies its to difficult to except how fucked we are I guess or maybe they relate to the evil people and would do the same things if they had the chance I could never blindly listen and obey I question everything around me in the pursuit of knowledge and enlightenment Constantly thinking about how I can improve and better myself with my main focus being to spread love and happiness unity Unfortunately normies are to busy hating each other taking every word said on their favorite MSM source like its the holy gospel It really saddens me how bad this has gotten Dont just believe anything someone is telling you everyone has their own agenda My agenda is to unite and for The People to see how loving each other can change our lives and that we can easily do so much better then the evil people in power Their is only on thing more powerful then hate and that is love The agenda of the evil people who have worked very hard doing what ever neccessary to gain power and money is to keep that power,dillmayne2sweet,16249647110,3
h3eel42,o9w3t8,This should be an issue everyone gets behind to say F you to big corporations for trying to play the woke game to seem like they give a shit about anything but their profits Why we keep electing politicians who take "bribe" money from these cancerous entities is beyond my comprehension,jwg529,16249365910,1
h3fqt1l,o9w3t8,I pledge to not make money with insider trading of disasters like australia and california fires as well as fukushima 911 and oil spills,FloDaddelt,16249733330,1
h3gsy5e,o9w3t8,They dont make billions in revenue by burning oil for the heck of it They sell it to people and companies and ultimately through perhaps some middleman its the people that fund all their business by paying for oil and such Im all about pointing out flaws of capitalism and tolerant of reposts from like 10 years ago but this is isnt it chief Its a case where government failing to regulate things results in oil companies having to operate in system where they gain money by destruction of the world And the beauty of free market scenario is those monetary incentives will eventually win Its either consumers or government that needs to change those incentives,KapteeniJ,16249902980,1
guq8jaw,ms2o0d,Right I believe there are three companies that are manufacturing insulin The thing is the person who discovered insulin I should look his name up Sir Frederick Banting that wonderful man He never put a patent on it because his morals were in the right place He wanted everyone to have it But these three companies decided to patent insulin so that no one else can create it and market it themselves A shitty thing to do So I know there is a huge movement to start getting insulin cheaper and free from this bullshit monopoly that is hurting a lot of people And that one guy was talking about how money is all people talk about,Wonkarosa,16185836600,179
gupzbll,ms2o0d,Yep and the reason? Because the drug companies spend HUGE amounts of money on greasing the political wheels so they dont get as much scrutiny as they should,Moto_Davidson,16185793760,241
guq65w9,ms2o0d,People want free health care and sure I do but it shouldnt cost $700 for medication so these companies can profit so much off sick ppl They also dont care if there is a recall later and they already made millions They make money off the sick So healthy people there is no big money in Wake up,zacattack777,16185826090,62
guqfr1c,ms2o0d,What gets me its a couple things about how the system is fucked 1- we tax payers give grant money to smaller pharmaceutical companies The big companies dont want to do research and make medicine for very specific diseases that are rare and only affect a smaller pool of the population they want big net many fish So these smaller companies know this so they know they only way they can compete Id by looking for what disease is getting ignored/not being addressed directly so that becomes their niche But they dont have the money so they get a grant from the government This boosts their budget they increase employment and research and voila theyve created a treatment Now here comes the bigger pharmaceutical companies they see the need medicine and buy out the smaller company They then in turn self the new product at an outrageous price Talk about a winning scenario All you got to do is wait for a smaller company to get grant money do all the work and just buy them So we as tax payers pay to have these medicines made just to then pay for them at a steeper price and we dont get the grant money back 2- There is so much money in lobbying from Pharmaceutical companies (#1 lobbying industry by far) that they were able to convince Congress to vote against themselves being able to negotiate Medicare pharmaceutical prices with those companies A major reason these companies love America is because every other first world country has a system in place to make sure prices dont get out of hand We are their cash cow 3- Along with the pharmaceutical industry the health insurance industry (another top lobbying industry) is also a giant racket that takes advantage of us all These companies have done an amazing job to label things like universal healthcare as "socialist" and yea it might be but they dont care about that they just want you to be afraid of it because it would lead to them losing money The other thing that gets me is people who say "I dont want to pay for your insurance" thing is you already do we already do When an uninsured person goes to the ER they have to be treated When they cant pay the hospital gets that money through the insured by up charging everything Healthcare shouldnt be a for profit business at least to a point Healthcare doesnt fit the traditional supply and demand economic model of capitalism because the demand is always going to be high People are willing to spend whatever it takes to be alive You cant put a price on your life and theres companies know this Need a new heart? Well there isnt a discount store for that heres your bill Need life saving insulin? Well pay our prices because we convinced the government its illegal to go to Canada for 1/10 the price Healthcare and medicine shouldnt be political We put the most into our broken system than any other country and we get the least out of it All we have to do is follow the money and see whos profiting because odds are theyre the ones who stand to lose the most by changing the system Its the same thing with all the sentiment against renewable energy Whos profiting now and whos going to lose out by going to renewable energy? Fossil fuel companies None of this shit will probably be fixed in my lifetime I just hope more people see how much money is being spend to make us against certain things for all the wrong reasons,Asfastas33,16185867790,8
guqmsco,ms2o0d,Amen brother The poorest of the poor can afford this because the government pays for their healthcare The rich can afford it because theyre well rich The people that suffer are the working class If they either allowed universal healthcare or actual competition the price would drop down to what its actually worth The American system however combines the negative aspects of both socialism and capitalism The prices are controlled by the government via regulations to reduce competition increase prices and create artificial scarcity This whole emergency response to covid is a testament more to the inadequacy of our healthcare system than to the actual danger posed by the virus Hospitals actually limit supplies and space to save money and keep people from being treated Its easy to justify refusing to treat poor people if one "doesnt have the supplies to treat them",FailOsprey,16185898100,3
guqz51c,ms2o0d,This is what I dont get about you people Here is evidence of an ACTUAL conspiracy among powerful elites to hold peoples health hostage and extract ruinous amounts of money from them for the privilege of livingand you pass right by it Its all in the open its all made legal by a corrupt political establishment but you jackasses go haring off on insane tangents about voting machines and vaccines Heres a fucking conspiracy for you to fight; the rich and the corporations they own have bought our representatives so they write the laws that let them take all your fucking money and leave you to die anyway Go make some fucking YouTube videos about that Tell everyone you know about it Make Facebook groups about it and organize to change things,AtomicSamuraiCyborg,16185951250,11
guq8zr1,ms2o0d,Unfortunately this sub has become a rescue shelter for r/thedonald,Tmoney420,16185838560,18
guqjb10,ms2o0d,Its just one of the many things which prove that it is about the money not the interests of anyone,hulkstert07,16185883130,2
gusd8v3,ms2o0d,My dad explained this to me I cant explain it as eloquently as him (he was an engineer for a major pharma company for 30 years) Basically the reason its cheaper in other countries is because their governments will not allow it to be sold at higher rates So companies basically operate on lower margins over there It needs to be sold for more in the US so they can fund R&D,s-moneyy,16186191200,2
guqypbw,ms2o0d,Imagine if some of our military money went to free healthcare No that would be un-American /s Just for reference 48% of all annual spending is for defense funds and 7% is for education and 7% for transportation (badges trains etc) No problem there though,Legirion,16185949330,2
guqu388,ms2o0d,We waste billions of tax payer money on useless organizations like the FDA NSA TSA EPA IRS and so forth They all need to be de-regulated and some need to be canned for good It is sad when diabetics and other Americans with ailments have to go on the black market to find reasonable priced medicine,alphabuzz88,16185929190,1
guqze4y,ms2o0d,Americas own fault for being so against healthcare funded through taxation All they see is taxes and dont realise the cost reduction created by the competition for a state contract I have had this conversation so many times and damn do i get alot of backlash My brother has literally gained a small amount of money from the diabetes he was born with im in horror just thinking what would have happened in america with no mother and a poor father,aset91,16185952360,1
guqdnv7,ms2o0d,Weve known these companies are evil and put money first for a long time before the pandemic Amazing how brainwashed people have been I mean J&J couldnt even figure out how to make BABY POWDER How the fuck did they get the green light to begin with?,RedditIsPoisonTrash,16185858810,1
