gun7anr,mre4hz,It isnt a partisan issue folks,TheRequiemMask,16185172940,2
gum36gu,mre4hz,Well if we did that then there wouldnt be anyone to rule over the masses and make us bend the knee,maskedfailure,16184999210,1
hvype15,smbfer,Ty for posting some real shit and not another mask rant,IRBaboooon,16442525900,3
h8idgx1,p21kbm,Plastic surgery name change a different hideaway especially with masks you wouldnt know it was him if he was in front of you,PhilOffuckups,16286677030,2
gvagaue,mv1oik,Why dont they pull out some more masks from the ocean  millions and billions of them,Jessica_lowel,16189798120,1
hlc89n0,qxp41y,All my indoctrinated mind can focus on is her nose hanging over the mask Its a major pet peeve of mine,Bubba-ORiley,16373754300,3
hleo3s2,qxp41y,Shes not wearing a mask!!!! *head explodes everyone get Covid within 6 feet*,Newspaper_Correct,16374296480,1
hlbi8iw,qxp41y,And yet even murders are exempt from mask mandates ,Mikeman0206,16373636390,-3
hlbqix4,qxp41y,The Ghislaine trial implicates a huge list of rich and powerful politicians actors and industrialists so I bet thats got something to do with why its a federal case and hence no cameras allowed True Detective Season 1 has shocking resemblance to real world stuff- the elite / rich involved in ritual masked human sacrifice and pedophilia As per what Marty says to Cohle whos lamenting that they didnt manage to take down the elite ring only the lower level serial killer; "That aint the kind of world we live in",azraelus,16373672170,0
gv3dypq,mu01bz,Just curious but if the sub has as many bots and shills as suggested; why are these posts still in the positives? It seems like it only matters when they oppose your individual stigmas or beliefs I mean look I dont trust big pharm for one Which is mainly why I am not taking the vaccine But Im also not going out there trying to save people over a virus with over 05% survival rate If they want to put a mask on and social distanceisnt that their choice? Just like it is our own choice to live without it?,Fireba11jutsu,16188475320,1
h0ek019,nqukms,IF its true: 1 Get Vaccinated 2 Wear A F-ing Mask 3 Trump knew and traveled the country anyway allowing his fans to infect each other,bunnyjenkins,16226958270,1
h0eaf07,nqukms,So if it was deemed a lab leak from the beginning would you have wore a mask?,fongaboo,16226902800,1
h0dmj6t,nqukms,Funnily enough I just posted a comment but it failed to post Got error message: "that comment has been deleted" Not sure which was deleted but I wanna comment so here: Just had my 75th birthday so I guess I qualify as an elder Total anti-vaxxxer here but I will wear a mask cause its mandated Also I like to appear as a team player not a conspiracy realist edit: phrasing,PremDikshit,16226782240,-1
h89o3jm,p0j98z,What if conspiracies were used to control people and keep them afraid so they could purposely orchestrate disastrous events (pandemic) to keep their citizens ignorant and dependent on them and thats one of the reasons mental illness has been rising? lol Perfect case is Plandemic Now look at whats happening a year later The people who believed in Plandemic caused the issue to become worse and now next month looks pretty horrific given the numbers All the vaccine conspiracies and mask Thats causing a lot of people to die Right now All the virus conspiracies So many virus conspiracies saying its real and pointing the finger at somebody or its fake news What good does any of that do? What good does saying a foreign country did it or its some coordinated effort or its fake news? None of that matters Its here and were fucked and need to deal with it Why is it so hard to understand for people?,xynapse,16285018590,0
hb7tmaj,pfz4xc,Remember the quote from V for Vendetta? " Beneath this mask there is more than flesh Beneath this mask there is an idea Mr Creedy and ideas are bulletproof" They can silence the voices but they cant kill the idea,GutiGang,16305202540,27
hbaahyz,pfz4xc,Internet "cleansing" is definitely here This isnt just a reddit thing I feel a bit bad cause I didnt know what that sub was I admit I got real tired of reddit after being banned from subs for ridiculous reasons Also the covid subs have become just complete cult shit shows (pro mask pro lockdown type) Came back to focus on other more hobby and interest subs but this is annoying How tf is pokmongo sub going in quarantine  shows how much power we give mods and others Too much red tape ,Joeyzona48,16305636370,6
hb8jsqw,pfz4xc,So what platform is really left to discuss these topics because if Reddit gets censored then I guess I gotta find somewhere else to go,facemasklingerie,16305310260,2
hb8a5j4,pfz4xc,People are bad over this mask shit but are fine that china overlords controlling reddit for ages is fine? Lmao Wow,MrkJulio,16305269870,2
hb8v7nn,pfz4xc,Not a big deal appnonewnormalcom This is the new nonewnormal,Masksforever,16305364350,2
hb82fmt,pfz4xc,I will never vaccinate ever again I will never wear a mask I will never submit to this Communist push for power I am still young and I will resist till my dying breath This I can promise,Kerath,16305238770,1
h1q48hc,nzlzfq,SS: From climate change to the mask debate there is a common tactic where companies and governments shift the blame onto regular people The genius of it is the way people flock towards wanting to be part of the "solution" then those people try to shame others to accept the blame for something they had no control over in the first place,ProfessionalRich0,16236749620,27
h1q9qwn,nzlzfq,This is a false debate masking the true issue People dont care about the environment (if they have to do anything about it) and companies dont care about the environment (if it lowers profit) Only legislation can cause any change The government is the only entity that can combat a tragedy of the commons issue,scott90909,16236780510,-7
h1rewa2,nzlzfq,"A perfect example was the absurd "mask debate" we have had for the past year Instead of blaming the public health system and officials who funded dangerous and unsafe viral experiments in China the blame was shifted to everyday people who happen to not wear a mask or wore one incorrectly" Eh,dkclimber,16236968780,1
h1s77t5,nzlzfq,I think the ELiTeS sometimes make up rules just to be able to laugh at us *"Look at them cleaning out their little yoghurt jars! They dont know we just BURN all the plastic anyway! Hahahaha!"* *"Can you imagine they actually bought that idea with the facemasks StOpPiNg TrAnSmIsSiOn?! They have them on ALL - THE - TIME! Hhohoho!"* Thats why I never do anything I find ridiculous,robotmats,16237096140,1
h7ln0ni,ox6zut,Just to be clear for the dickheads - hes talking about torture assassination surveillance militarized police indefinite incarceration drug war corporate/ banking bailouts Hes not talking about people wearing fucking masks during a pandemic,Hazzman,16280254070,2
i112fgs,tg0kom,CNN advising us to stop having basic survival shit while their owner probably chilling in a mansion with huge ass pool a private jet I hate it when these celebs who splurge and damage environment the most question ordinary people to minimise the basics,awesomask,16475310920,1
i11gz9u,tg0kom,eat the bugs wear the mask flatten the curve save the planet get the passport just stay home build back better,MeLittleSKS,16475366790,1
h0ynban,nu8oko,This weeding was in a town I live near in upstate NY Very strange There were all these people wearing bill and Hillary masks and driving around in convertibles waving Creepy Like the purge,snippysnapper23,16231037870,2
h26ki29,o2bv1j,every tragedy is also an opportunity to make money off of it Masks online infrastructure online stores delivery logistics automation but most importantly lobbying the government to buy shit no one in their right mind would otherwise pay for,FloDaddelt,16239975200,1
gvpypbk,mxjajh,Lets say you wanted to train AI to focus on eyes only for identification Everyone must wear masks everywhere!,50caddy,16192803030,7
gvpydmj,mxjajh,Imagine if the algorithm needed people to be more spread out in public places (Social distancing) Or perhaps the algorithm need to focus only on peoples eyes? (masks),DISCIPLE-5,16192802020,1
gvs15bn,mxjajh,Yall just figured this out? Now try it with masks,SeaLab2050,16193184860,1
gvpespz,mxjajh,Also make people wear masks so that the algorithm has less of the face to train with,jizzbasket,16192745420,-4
hwsmp13,srhaii,Never tested never wore a mask & will never take the fake vaccines willingly The wheels are coming off the narrative or so it seems but this is planned just read the SPARS " war game " scenario I hope people are becoming more aware to the FACT that were dealing with Occultist freaks,Moonoid1916,16447707070,3
hww1e39,srhaii,Not Vaxxed havent wore a mask anywhere ever pretty much lived my life as normal Still havent caught covid let alone die,RyanBJJ,16448293340,3
hws6n4v,srhaii,Since the plandemic started 2 yrs ago ive never worn a mask stayed 6 ft apart from others etcand im still here,Recent-Excuse-9090,16447639020,2
hwu3zi4,srhaii,According to The Branch Covidians Ive been dead for years living in Florida mask free and unvaed,Avioli_ravioli,16447920180,2
hwsahos,srhaii,Never wore a mask never social distanced never locked down never got sick and no vaccine Walking fucking miracle here,Kirby_hill8245,16447656310,4
hwsiajc,srhaii,I was sick for a week I think it was food poisoning because I tested negative and I didnt have any respiratory problems (although I was coughing a lot because of a dry throat) If it was covid in spite of the negative test then I want to personally thank the hundreds of millions of Americans who have endured months of lockdowns and mask wearing and vaccinations to postpone my illness for a year and a half It would have been nice if all those exertions had protected me from getting sick at all but I still appreciate the effort Your personal sacrifice on my behalf will always be remembered But next time how about sending me money instead? Skip the lockdowns and jabs and just send me a buck and if I get sick again Ill just sleep it off like I did this time,sjryan,16447689140,1
hwsp84t,srhaii,Hi yes I died from the rona Dont be like me kids Remember to wear your masks and take your vaccine Thanks,TiredOfTheLies69,16447717180,1
hwszt15,srhaii,Was at parliament with the truckers in Ottawa Im vaccine hesitant and we were all running around outside without masks on for two weeks According to the science Im dead and this is my ghost typing right now,jackspratt88,16447758940,1
hws5ts1,srhaii,Still good no mask no vaccine still havent gotten covid,odo_0,16447635320,1
hwsg4fk,srhaii,Unvaxed unmasked and freshly masturbated ,Crypteggo,16447680250,1
hwsozdy,srhaii,There are 12 people on my floor not a cubicle farm so we have adequate distance between us 9 of them of have had covid since the fall one of them twice Out of the three of us who didnt get sick in the only unvaxxed one is a 30 year old male Asian immigrant with a traditional healthy diet the other is 65 year old healthy woman who also moonlights as a bartender The one thing the three of us had in common was still socializing in groups Myself and the bartender in bars and going out of state to non mask areas from the start of covid the other guy has a huge family and lots of travel,raka_defocus,16447716220,1
hwsw2v1,srhaii,I work in an office with one unvaccinated person Hes not been sick this whole time He goes everywhere without a mask Everyone else either caught it is testing after every outing and generally miserable,el_smurfo,16447744280,1
hwswdfp,srhaii,Hahahahhaha I didnt get sick and didnt die My unvaxxed sister and her husband got covid and survived just fine about 7 days of under the weather My vaxxed bestie and her entire vaxxed family went down with covid for most of January each of them ill for almost exactly 10 days My 13yo son just took a week off school with mild covid symptoms (but negative test results) Oh and Nevada mask mandate was finally lifted yay!,Petraretrograde,16447745450,1
hwtjama,srhaii,i can confirm that i died at least 3 times during this pandemic at first for not wearing a mask secondly for not respecting their guidelines such as distancing etc third for not getting vaccinated,Angerfist96,16447835860,1
hwtz6mr,srhaii,Still around Had covid in Dec 2020 nothing major since but sure Ive been exposed to most variants work retail on a large floor in mask optional work I might have omega-variant antibodies already,aukir,16447899740,1
hwu4pwx,srhaii,im alive never had covid asthmatic and i have chronic faituge at first at the start of the pandemic (in china) i ore googles gloves and a mask everywhere before anyone else in the city after that i realised it was bullshit since it wasnt as deadly as the black plague while the entire world got crazy,DarkMadDog21,16447923340,1
hwv9u16,srhaii,I caught covid a couple weeks ago and got over it last week Was out of work for 2 weeks My symptoms included but were not limited to: fever sore throat one runny nostril and one stuffy nostril that would change sides daily dizziness lightheadedness a pressure on my chest and a cough I only caught covid because my girlfriend gave it to me and she got it from a vaccinated coworker at work (her and two of her coworkers are the only ones not vaccinated) where they require everyone to wear a mask I am not vaccinated and do not plan on getting it anytime in the future but I did wear/put on a mask when I was asked to (prior to catching covid) I am overweight (300lbs and 64) but had been working out for a month before I caught covid I took the vitamins my body needed and nyquil if I couldnt fall asleep at night This is what we shut the world down over This is ridiculous Edit: spelling and grammar errors,yorton00,16448105330,1
hx55ax7,srhaii,Unwanted unvaxxed unmasked,nick25276abc,16449930810,1
hwrz41l,srhaii,Thank god for that mask I never wore,No-Ad3188,16447601840,-1
hwsh7gn,srhaii,Ive been working at Walmart maskless all winterhavent even had to call out of work for more than a couple days for illness Dont even know if it was COVID or not,emforay216,16447684660,-1
hysgiyc,t3gua0,The real conspiracy is that leftists and liberals successfully tricked conservatives into dying of covid "Yes you see my fellow conservatives! We shouldnt wear masks or vaccinate! This virus is a lie!",juliakeiroz,16460636740,-7
hyuksdo,t3gua0,In California people still have to wear masks if they are on public transit or in jail It will become a status thing those with money and/or political power wont have to wear them but the poor and less desirable elements of society will have to wear masks forever no matter how many injections theyre given,1_p_freely,16460941360,1
hyu274n,t3gua0,Ukraine is reportedly running out of O2 between covid and casualties Theyre trying to figure out how to get it transported in safely You see the masks in all the videos they just arent a high priority when bombs are flying,JuanOnlyJuan,16460859520,1
hywpcxd,t3gua0,Covid is still very much a thing Its covered here in the media every day and many stores still require masks Bunch of dumbasses in these threads,HauntedDragons,16461407640,1
hyswrm9,t3gua0,Mask mandate over in Chicago today ,Environmental_Flow47,16460699890,0
hyuf5ty,t3gua0,Covid trends have been going down for two months now my county is no longer asking for masks indoors and for awhile it was pretty bad here I think the real conspiracy is rightwingers using this trend as a "conspiracy" to try and distract from how bad Putin and Russia are and somehow turn the Russian invasion into talking points that help the left and hut the right per the norm of this sub,suphater,16460915240,0
hqli9la,rs1onc,I love how in a conspiracy subreddit after not witnessing a single real picture of her in jail just some artist drawups of some lady that looks nothing like Maxwell everyone has just accepted that shes just going to jail that easily Lmfao Considering who her father is and what her connections and Intel are that bitch got swapped for a double the double wore a covid mask the whole time and we never got to see or hear the trial But Im so glad everyone in this subreddit is so quick to advocate ivermectin and accept bullshit hope cuz theyre aint shit else to do with how much crap were being fed,BlackOmipotentSheep,16408992310,6
hql04vc,rs1onc,BTW was Ghirlandaio even in the courtroom? She had a mask on the whole time It could Have been anyone and that person could sit in jail and she can be on an island somewhere Easily The trial was insanely short Nothing was revealed it seems like the perfect plan of protection,Border-Round,16408921300,1
i0d8wig,tcdedn,OP probably didnt even wear a mask and take an experimental shot either smh,vegetableTelevision,16470927980,1
hygdjzw,t13g2q,90% of users on this sub voted for a man who used a made up medical condition to avoid Vietnam You consider truckers whining about wearing a mask heroes Shut the fuck up with your condemnation of this man in the comments Trump would have shit his pants and hid in a bunker with golden toilets while the rest of you fucking bled to death on the streets Pussies Fuck I hate this sub,dickforadolla,16458361540,2
hyfoxu2,t13g2q,Why is he not wearing a mask? What about the Covid pandemic?,Dark_pony,16458256600,2
hyf53sx,t13g2q,Oh imagine sco mo (Scott Morrison for Aus) Heres a gun for a photo shoot Looks down barrel and shoots himself in the face Havent got a link but shouldnt be hard to find Recently went to a welding shop /factory took the mask off and nearly blinded himself! But seriously the Ukrainian President is badass!,sweattyboi,16458178740,1
hyg2vhv,t13g2q,Wear a mask,bigmikemcbeth756,16458313990,-2
gupfga3,mrpuku,Yeah the elite definitely fear white people who have boughten so deeply into the narrative that they walk around carrying flags supporting billionaires whilst wearing a mask outside cause thats what the government wants What a scary sight for them How will they handle this? lol,smellyscrotes27,16185657110,2
guo5in0,mrpuku,Makes sense that the Biden guy is wearing a mask,Meimou,16185336850,-5
gupmjb3,mrpuku,I just notice one masked and one not,Saltyreefer1,16185717110,0
guo6y78,mrpuku,They fear masked cowards participating in partisan politics? Okie dokie Sharpen the sticks throw some pitchforks in there then you might have a good start,Awesomo3082,16185344370,-9
hw3nrl4,snj9i6,The seatbelt analogy was for masks Ive never seen someone refer to vaccines with it,xMasterMelonx,16443388840,6
hw38iyt,snj9i6,Ive only heard the seatbelt analogy applied to masks before,gorgias1,16443330500,4
hw3xg1a,snj9i6,I thought the seatbelt analogy was for masks,top-knowledge,16443423920,4
hw3c4ht,snj9i6,It could be argued that seat belts physically limit the ability for your chest cavity to fully expand and therefore restrict breathing Equally legitimate to the same complaints about masks People who wear seat belts are manipulated by overlords!,Meaning-Flimsy,16443344940,2
hw4bit9,snj9i6,Also seatbelts actually work Masks and jabs dont,crash6871,16443474440,2
hw32nkr,snj9i6,When people say the seatbelt analogy (I usually hear it used as analogy for masks) I reverse it on them  yeah its exactly like a seatbelt A seatbelt made of soggy tissue paper you must now keep strapped on at all times Even when youre not in a vehicle even when youre nowhere near another human And you wear it strapped over your face forever That seems to end the argument lol,__MEOWFACE__,16443305670,-1
hw3jwr9,snj9i6,Careful not to over analyze analogies guys doing so completely misses the purpose of an analogy as an argumentative technique I mentioned this in some comments below but wanted to throw this out there because there seems to be some misunderstandings Analogies are NOT meant to be 1 to 1 comparisons; they are a form of comparison to shed light on a specific aspect of an argument in a different light Attacking an analogy without the context of how they are being used on specifics that arent relevant to the comparison doesnt defeat the analogy it just misses the point being conveyed in the first place The seatbelt analogy is not saying car safety and corona safety are the same thing The analogy is a response to arguments along the lines of "why do I need a mask if Im already vaxxed?" If you ignore this context and just attack the details of why seatbelts arent like masks/vaccines you have missed the point and are instead arguing against a point no one made A better argument would be something like a better analogy or an explanation as to why the analogy doesnt work For example: "seatbelts and airbags are great for a collision but not very helpful when your car gets rammed not lake Omicron" This is an actual argument against the analogy because it conveys the normalcy of overlapping safety measures the original analogy was pointing out is irrelevant when the safety measures are designed to protect against a different harm than what has occurred Dont lost in the weeds like OP about random stuff like how seatbelts dont cause long term health effects (an argument literally no one made thats irrelevant to efficacy of overlapping safety measures aka the point of the analogy) Instead focus on actually refuting point the analogy was making in the first place If you want to successfully attack an analogy you have to stick to the topic actually being analogized Otherwise youre totally missing the point and refuting the wrong argument,Popular_Ad4115,16443374590,1
hw586we,snj9i6,Lol nope Seatbelt analogy is for wearing masks not for the vaccine,Yatesthegreat,16443595240,1
hw2rnvd,snj9i6,Seatbelt analogy is mostly used for mask mandates Its a 1:1 analogy with that,arctic-lions7,16443252360,-31
hw497h0,snj9i6,You seem misinformed on the vaccine in general The reason comparing a seatbelt to the vaccine is an analogy is because its similar in some ways but the two are not exactly same And you must remember the context the seatbelt analogy is often brought up as an answer to "why do I need to wear a mask if I already have a vaccine" the answer of course being that we wear seatbelts as well as airbags because we want to improve our chances of not only not passing it on but also not dying You also seem to think that the risk of blood clots in the vaccine are bad would it surprise you to know that the coronavirus as a much much (x10) higher chance of blood clots "necrological disorders" and all manor of other side effects? You also seem to think theyre are some secret "long term results" were still waiting for but this is a strange thought No vaccine before has ever been present in the body for more than 6 months at the absolute most Vaccines as you know are there to train the immune system and dont stay in the body long usually around a month or less With 2 billion+ doses administered we still have no addition side effects so it seems strange to wait for these Covid on the other hand seems very capable of permanently damaging a lot of lung ear nose and throat systems with long term effects like difficult breathing lung capacity smell and taste and many more just being permanently changed Im not sure what "hiding the safety data" the cdc and all the drug agencies have been very forthcoming on all their trials You all even got mad at the cdc for saying there was no evidence of airborne contagion early on and then changing that stance after they researched it and got evidence Same thing with when they said dont wear masks at first as they were no thought at the time to be necessary but new data came out and the cdc adapted its message to the studies The cdc has been reflective of the data from the begining You might be talking about the preprint studies and the VAERS database stuff Those Im sure you have heard are flawed for many reasons their results may be correct or not but we need more data before we can say anything If the researchers and doctors at the head of the preprints or VAERS claims believed that they would want to wait for these studies But we did this cycle with monocoidal antibodies ivermectin and hydroxychloroquine and each time they put in the work for a big double blind study these drugs are reveal to do nothing or so little as to be nothing You also seem very concerned about the companies themselves but for all your conspiracy you dont look at the positives These companies are looking to make big money from government contracts and to get the biggest ones you need an effective vaccine as verified by the FDA and the 40 other countries the vaccine will go too including France Britain Germany and even our enemies China and Russia It in their best interest to make a working vaccine especially because they must compete in a hot market theyre now like 7 different vaccines from different companies so competition is fierce I mean just ask yourself if the vaccine was truly dangerous why wouldnt Russia or China talk about it Or the hundreds of journalists looking for hot stories or any of our allied countries to alter their friends or peoples or the competing companies after their government contract All these people and more would have to work together its impossible,rascalrhett1,16443466010,-4
