gyd40mx,ndkvik,At some point this was going to happen Its inevitable that when mask restrictions are lifted there will be unvaccinated people wearing masks But vaccines work They can infect each other if they want but Im vaccinated so Im done wearing masks,halolover48,16211969990,1
gyd4dxn,ndkvik,Of course The exact people that didnt get vaccinated are almost the exact same group that will lie about it (Not that theyre more immoral Rather those who are anti-vax arere the same ones that were anti-mask),AJayHeel,16211971650,1
gyd4mwf,ndkvik,Honestly itll be the same people who come into the stores and buisnesss and say " i have a condition" or "my doctor said i dont have to" which will probably just be one universal lie of "im vaccinated" Not to mention the buissness are bribing the employees into getting vaccinated with "small bonuses" Therefore the employees will be saying it too when the companys release the mask mandates,pyrosiren20,16211972790,1
gyd4oee,ndkvik,The Venn diagram of people who dont want to wear a mask and people who wont get a vaccine is basically a circle so yeah,ozymandiasjuice,16211972980,1
gyd4ow9,ndkvik,I am vaxed If I werent and was comfortable going out in public because everyone was maskedwell now thats over I feel bad for those who cannot get the vax due to medical reasons The people who can get it but havent? No sympathy when they get sick I just wish it didnt affect the rest of society adversely,AnneFrankenstein,16211973050,1
gyd4w6l,ndkvik,It doesnt take an expert to figure that out But anyways if youre really vaccinated and have no mask on the only people who are gonna get sick are the liars and their family You might have a sniffle for a day,Justryan95,16211973970,1
gyd57ej,ndkvik,Liars all! The same Dickheads that refused masks will refuse vaccination Then they will mingle with those of us that took civic responsibility seriously People that gave up more than a year of life sheltering at home to keep others safe The assholes that think its ok to go out and mingle with us unmasked and refusing (still) safety guidelines will be the same assholes buying fake ass vaccination cards This is the the real issue Heres where I support the government getting involved We will perpetuate a never ending cycle of stronger and stronger mutations of Covid until people freakin man and woman up and COMPLY!,snugglebug72,16211975360,1
gyd5m5i,ndkvik,"I have a medical condition that prevents me from wearing a mask and I dont have to disclose that condition to you" -every moron during the pandemic Of course people are going to lie about if they received the vaccine They are currently buying a fake vaccine card instead of getting the vaccine for free The same people also took the hydroxy chloroquine and some of them are hoarding gas in plastic trash bags because of a pipeline shutdown,thailandblack,16211977220,1
gyd5z1p,ndkvik,The people that have been vaccinated and played by the rules for over a year should not be punished because others may lie If they get COVID thats on them Others a free to continue wearing a mask and quarantine as needed,Blue2200x,16211978780,1
gyd7wx7,ndkvik,Most of you are so cynical and incredibly off the mark I went to Walmart today in a fairly poor and uneducated area in the states 95% of people are still wearing masks in the store If anything more people need to take them off so we can eventually get rid of them,blazersorbust,16211987410,1
gyd8j13,ndkvik,Not an expert but the ones lying are the ones who arent getting vaccinated anyway Get your vaccine wear your mask until you do and recognize that we are in a good place to start opening back up,itsallthesamejames,16211990180,1
gyd8s6b,ndkvik,I think the point now is that being vaccinated will offer enough protection against the virus killing you that it is an acceptable risk for many people Therefore if you decide to go maskless AND without vaccine youre just taking a huge risk with your own life,cloudydaytday,16211991330,1
gyd8x4q,ndkvik,Well based on Lowes Home Improvement this morning Id say a good amount of people are lying Im vaccinated and still wore a mask because its well not that hard,AdamDet86,16211991950,1
gyd96fo,ndkvik,These people made fake medical exemption cards so they didnt have to mask up in Krogers,snarfalarkus42069,16211993120,1
gydafg7,ndkvik,Andrew Cuomo doesnt give a fuck what the CDC and President say we still need masks regardless,cpuff69,16211998800,1
gydarnt,ndkvik,Fully vaccinated but this is why I continue to wear a mask in public inside I dont want people to be concerned about my lack of a mask or imagine any solidarity between my lack of a mask and theirs I am perfectly happy to keep wearing a mask to show I care for others Its such a tiny thing Im so exhausted by the continual arguments,42Petrichor,16212000330,1
gydat5y,ndkvik,Ive seen people go out workout masks long before the CDC made that announcement People at the end of the day are going to do what they want,Wotan17,16212000520,1
gydbaem,ndkvik,I continue to be amazed Im gonna have to tell my grandkids "So then the CDC blew the whole thing open by declaring anyone vaccinated could stop wearing masks and then pulled a surprised Pikachu face when Americans started lying" Waitthey probably wont get that reference ,appledaveon,16212002710,1
gydbuhi,ndkvik,who was the genius that said it would be okay to stop wearing masks?,wanpan10,16212005270,1
gydbwq0,ndkvik,Ive had both my shots but my family isnt fully vaccinated so I still wear a mask! At least 75% of the people Ive seen out this weekend have been maskless statewide here in indiana full vaccine rates arent even 40%,sportjunkie420,16212005550,1
gydby9y,ndkvik,I went to Cave City in Kentucky yesterday and did some cave tours and stuff with the family Seen thousands of people out doing shit Id say less than 10% were masked up Our vaccination rate is only 362% fully vaccinated So yea theyre lying,Jebduh,16212005760,1
gydc41k,ndkvik,My feelings are mixed Like of course theyll lie but also anyone who wants a vaccine barring children has had an opportune for about a month so why should I continue to be inconvenienced by anti vaxxers who were the anti maskers? Not trying to be rude Ive been wearing a mask at work 8 hours a day since august and Ill comply with the rules Im fully vaccinated now so whats the point other than theater?,ciaopau,16212006500,1
gydcfgd,ndkvik,That was my first thought when I heard that the CDC or whatevs its called (Im not American) said its no longer necessary for vaccinated people If I was a business Id keep up with the requirements personally Dont trust the anti-mask types to be the people to get vaccinated nor tell the truth,i_broke_wahoos_leg,16212007980,1
gyde6ky,ndkvik,Fully vaccinated but will continue to wear masks indoors in stores and commercial buildings no indoor dining -- until there is some kind of vaccine pass for admission or the pandemic is really under control in US and in reasonable control globally - which may be never Perfectly fine ordering food at home ordering groceries for curbside pickup using Amazon or equivalent outdoor recreation meeting friends who are fully vaccinated etc We still do not enough about the disease (long term effects epidemiology/health effects of new variants) and a significant portion of the population is not vaccinated (in some cases by choice),stej008,16212016130,1
gydec14,ndkvik,Honor systems never work because it relays solely on the good nature of individuals This is bad because individuals are susceptible to doing bad things such as lying and manipulation I personally think its way too soon to be removing mask mandates,yaoigay,16212016830,1
gydein2,ndkvik,Given the lockdown protests mask protests fake medical exemption cards vaccine conspiracy theories covid hoax conspiracy theories to name a few things the chance that a large number of people wont lie about their vaccination status is non-zero Get ready for the third wave and more death because this will be with b1617,derangedmutantkiller,16212017670,1
gydemik,ndkvik,If people are wearing masks they probably got the vaccine already if they are not wearing masks they are lying about the vaccine,Sid15666,16212018160,1
gydenmm,ndkvik,I seriously dont understand why we cant just stick with what we know that works! Just wear the mask!,galloway188,16212018310,1
gydeoi4,ndkvik,The people who arent going to be vaccinated were never wearing masks in the first place,Snoo-68727,16212018420,1
gydf2e6,ndkvik,Ofc they will this give the anti-mask-anti-vaxxer more excuses to refuse to wear mask Most people who wanna get vaccine have already gotten vaccines But on the other hand those who refuse to get vaccine and wear a mask deserve to have a real taste of the virus,datguboy,16212020210,1
gydffbl,ndkvik,Vaccinated and all but still rather wear a mask in public seems to me that i gotten less of my fair share of the flu this past year,lenninct,16212021890,1
gydfiop,ndkvik,Yes We will Americans are awful Glad I got my shots but Im kinda use to the masks and I got one with a zipper mouth that says assholes live forever" that hasnt gotten much wear,ih8yogutzzz,16212022320,1
gydft9j,ndkvik,I have a collection of masks though,effiezilla,16212023730,1
gydfu0d,ndkvik,I went to the store yesterday and now 80% of people were not wearing masks This is was also in an area where there was a lot of push back against the masks mandated by antimaskers but at least most people still did it Theres no way that many were vaccinated as a majority still believe it doesnt exist Now? Good luck! How many waves will this next one be? Idek anymore the amount of areas like this across the US is way higher than it should be,Leongard,16212023830,1
gydhbt1,ndkvik,Theyve been lying the whole time "I have a medical exemption" "I cant breathe in a mask" Thanks for the insight experts,knylifsvel1937,16212030890,1
gydhpx5,ndkvik,I really hope these new guidelines are not being rolled out just because they believe the public will not lie about their vaccine status and mask up when needed,Sergeant_Arms,16212032710,1
gydi1nh,ndkvik,Heres a Venn diagram of people who didnt wear masks and people who have been/will be vaccinated: O O,tendeuchen,16212034240,1
gydid4a,ndkvik,Well I am going to wear a mask in the UK even after Ive had both jabs for some time Dont think we fully understand it yet and I still think theres more pain to come,Elgarr2,16212035760,1
gydj1g4,ndkvik,70 million morons that would rather drink the orange blood of there God trump We will never be able to not wear a mask in America,Sock744,16212038960,1
gydj2dp,ndkvik,Well its not like theyll suddenly start lying simply because the mask rules change The same unvaccinated people who havent been wearing their masks will continue not wearing masks I mean if a person hasnt cared so far why start now? I frequently wonder who reads these kinds of articles and is surprised by the Captain Obvious findings,Xarama,16212039080,1
gydl87k,ndkvik,WTF is the big deal with wearing masks indoors- I just dont get it- I can see outdoors- I have no problem wearing it 20 minutes in the focus store or shopping at the mall- if it helps anyone- Im good with it and Im fully vaccinated- these people will all lie- Ive seen it already- I have friends that say they have a condition or some shit like that- sad it has come to this,Capo33,16212049740,1
gydlovh,ndkvik,Trumpicans have the freedom not to be vaccinated wear a mask or distance yourself from others Since this is the case "God speed to you good people you will be meeting your orange maker much sooner that you expected!",rustyseapants,16212052060,1
gydlu7e,ndkvik,Might as well just ask people if they will be wearing a mask because thats how people will read the question,him_johnson,16212052810,1
gydm098,ndkvik,Honestly we really need to fire the chief of CDC This is the 2nd time for them to screw the Americans again Last year they told us we didnt need to wear masks because they werent effective Now theyre telling us we dont need to wear one indoor in public places as long we are vaccinated without considering children and individuals who cant get vaccinated and to trust the Americans to put on a mask if theyre not vaccinated What a joke! Does the CDC read the news or live in America?!,hatescammersJJ,16212053660,1
gydm0q4,ndkvik,This is literally giving them the excuse they need to not wear a mask absolutely idiotic,ThatGuyThatSaysWords,16212053720,1
gydm9zc,ndkvik,They wont wear a simple mask to save other peoples lives but you expected them to not lie about getting vaccinated? LOL,HoneyBHunter,16212054980,1
gydmakd,ndkvik,At this point let Americans make their own choice No more mask policy for anywhere The vaccine is available to everyone who wants one If people dont want it then fine their choice People who fear about covid can get the vaccine and be fine So fuck it back to adults being responsible for themselves,Jacob8386,16212055060,1
gydmejn,ndkvik,This is gonna be buried But I predict that there will be another "wave" of covid infections because of this and it will be because of those people who lie about being vaccinated And we will have another lock down mask mandate and more people will die,waterresist123,16212055600,1
gydmu2q,ndkvik,Not all states had the same mask rules Many Americans were already going maskless regardless of what the CDC said They havent thought of Covid in months,bitchalot,16212057780,1
gydna72,ndkvik,The people who are vaccinated will continue to wear the masks whereas the non-vaccinated will continue to not wear masks like theyve done this whole time,modohobo,16212060020,1
gydnc46,ndkvik,Where Ive been over the past three days everyone has been wearing a mask Im in Georgia I went to Target Kroger a boba shop And everyone minus a couple people were wearing masks Are the stores enforcing this or are people really sticking with this? It doesnt bother me and actually makes me happy because I dont plan on not wearing a mask anytime soon,getin-loser,16212060280,1
gydo1oc,ndkvik,Oh no! You mean the idiots lying about having mask exemptions and whatnot will now lie about being VACCINATED!? No!,KiraIsGod666,16212063820,1
gydo5ca,ndkvik,I dont think theyll lie Anti-maskers would rather pick a fight than let others think they got vaccinated,stadrpos,16212064330,1
gydo7l8,ndkvik,Lets be honest the people who arent wearing masks already are not the ones lining up for the vaccine,Least_Ambassador3170,16212064660,1
gydoofl,ndkvik,They were already lying **before** this change We know that the people who are **not** vaccinated have been the ones most likely to ignore mask guidance most likely to not answer vaccine questions truthfully or refuse to answer when asked (often making huge confrontations about it) You cannot base a system on trusting an answer to a question that has been made into a political litmus test and repeatedly proven to be unreliable,ssa35,16212067040,1
gydp0hf,ndkvik,I dont think they will I think that anyone who didnt get a vaccine will tell you straight to your face that they didnt while not wearing a mask,Comfortable-Ear484,16212068750,1
gydp2p8,ndkvik,Not sure if this is related I live in Cheyenne Wyoming a State that voted 699% for Trump Today May 16th coming up on a week after President Biden and the CDC told us the good news I went to one of our local Walmarts this afternoon and I would say that approximately 80% of the people in the store were wearing a mask It was my first time out since the announcement and wasnt sure what I would see in the store I was fully expecting to only see a handful people wearing a mask,wyoflyboy68,16212069060,1
gydpabs,ndkvik,Yes of course theyll lie Most people are tired of the masks,Throwaway943020,16212070130,1
gydprxr,ndkvik,Its like the anti-maskers are also anti-vaskers,MadVillainG,16212072620,1
gydqn0u,ndkvik,Still waiting on my vaccine but once I get it Ill still be wearing a mask until the last person is vaccinated To be honest Id love for masks to remain post COVID in some capacity like in Japan If youre ill and out in public it should be considered common courtesy to wear a mask,Cannonieri,16212077180,1
gydqp2w,ndkvik,My county Health Department is still enforcing masks No change despite what the CDC says,Ohnezone,16212077470,1
gydqq0s,ndkvik,Everyone in my city must have gotten vaccinated Not a mask in sight! Considering only 37% of my entire state has gotten vaccinatedthe odds of all them being in my city is pretty weird,piehead678,16212077610,1
gydr7pk,ndkvik,Once you get the vaccine you protected from covid If you choose not to get the vaccine thats your personal choice The whole country has had the opportunity to get the vaccine Why are we still arguing about masks? Ive heard the argument that children arent able to get the vaccine and may get covid but the mortality rate for children is 000-03% Can someone explain the end game for this? Are we going to force Americans to get the vaccine?,jooocanoe,16212080130,1
gydrovk,ndkvik,Nah in my state theyre blatantly saying they arent vaccinated and wont wear a mask anyway,quietloofah,16212082610,1
gydrya9,ndkvik,Everywhere I go people are fully masked Its like reverse psychology or something I feel like it used to be 50 percent of people I would see in a store Now when I go its closer to 75-80 Im fully vaccinated but still feel like I shouldnt go without it,junkemail09,16212083980,1
gyds1m3,ndkvik,Duh About 70 percent of people at the store today didnt have masks No way is 70 percent of my county vaccinated,positiveonly938,16212084460,1
gydse4k,ndkvik,Im fully vaccinated and anybody who cares about their health is most likely vaccinated partially at this point We dont have to really take any more precautions at this point I dont wear a mask if I dont have to now Just make sure people still have quick access to get vaccinated if they change their mind If youre not vaccinated but you want to be just be careful as usual and get one ASAP,evilcheesypoof,16212086300,1
gydshyk,ndkvik,Sure some will lie But mostly they werent wearing masks right to start with Im going maskless wherever its not required Just kinda ease into it :),DeadlyEdly82,16212086860,1
gydsrwl,ndkvik,This new CDC guidance doesnt put those who believe in vaccinations or their effectiveness at risk the only people that the unvaccinated and unmasked will harm or risk is themselves and the other unvaccinated around them My biggest concern is for the kids under the age of 12 who still cant get vaccinated regardless if they or their parents want them to or not,Bobswarly88,16212088330,1
gydszvq,ndkvik,Ironic that those who refuse to wear a mask and anti-vax will be in same area who got the vaccine Hard to be different if you are grouped the same,MeowMaker2,16212089490,1
gydv2v5,ndkvik,Some Americans can be trusted But the whole reason why the US has such a dire situation with the virus is because of the selfishness of those who dont want to wear a mask Whenever you go outside or are in public places and see someone without a mask You should always treat them as if they have the virus because theres a chance they might,TheYellowFringe,16212100110,1
gydw367,ndkvik,Im in California am not super old and received my first dose on April 15th (the first day I was eligible) I still have about 1 week to go until Im 2 weeks post the second dose This weekend I went to the park with my kids And not a single parent wearing a mask! Is it that EVERY parent is an essential worker? Ha!,Any-Rise-6300,16212105120,1
gydw9za,ndkvik,The problem is that each store has their own policies about wearing a mask no matter if youre vaccinated or not and idiots dont understand this,ripler16,16212106070,1
gydwax8,ndkvik,Am vaccinated and still wearing a mask,Lumiela,16212106200,1
gydwu7p,ndkvik,For people outside the US Americans still wear a masks The people that dont right now generally are avoided anyways Some believe that this is a prelude to providing proof that you were vaccinated In our school systems you already have to provide documentation from the dr that your child has the appropriate immunizations according to their age AND to have a baby in the hospital here in the US you also have to be "up to date" with valid insurance There are extended circumstances to both though Religious reasons for the children or a near death experience for child or mother are a few an example of each We are a Free Nation but for the betterment of everyone certain factors apply Some people have problems with this but for most of us completely acceptable Message for OPI have read many people struggling to understand us especially since the Nation is divided on so many issues I thought I would assist inquiring minds ,tara12miller,16212108810,1
gydx5uf,ndkvik,Well DUH! I will politely request that anyone wishing to come closer than six feet wear a mask REGARDLESS for at least the next six months for EXACTLY this reason Not only do people have a strong tendency to be scum but there is a large and busily active pro-scumminess political party in this country,john_m_burt1960,16212110430,1
gydxgrf,ndkvik,ofc they will ppl just want to remove their mask but lets have integrity,TheeBaebarian,16212111960,1
gydypb2,ndkvik,I keep hearing the more people that catch Covid the more mutations will occur and the vaccine will become less effective As of today only 120M US residents Fully Vaccinated this leaves 200m bodies to gestate a new Super Covid strain I still dont see how asking non-vaxers to be honest and wear a mask is going to actually work They didnt want to do their share up until now why would the change? They feel vindicated like they won some battle,max1030thurs,16212118230,1
gydyqul,ndkvik,This is generally about as bad of a scenario as we could get short of a 2nd term Trump ordering masks gone without vaccines Were already seeing significant pushback in the media from doctors and epidemiologists which really destroys the last notions of the "the CDC follows the science" narrative Its not insane to think that the CDC has become just as corrupted by business influence as DeJoy running the post office,SpicyCrumbum,16212118450,1
gydz5xo,ndkvik,Vaccinated people will continue wear masks because we dont trust the anti-vax anti-mask crowd,vwmwv,16212120610,1
gydz6it,ndkvik,Costco in SLC has signage stating that masks are not required for vaccinated people I saw many people wearing trump and anti-mask shirts who were not wearing masks These people either smacked their heads on every branch of the cognitive dissonance tree when they fell or they are clearly lyinggolly gee I wonder which,gizamo,16212120700,1
gydz6lq,ndkvik,A business requires a mask and instead of these people spending their money elsewhere they lie or argue for the privilege to give their money to people who would rather them spend it elsewhere Literally "shut up and take my money" How the fuck are we not extinct?,ScreamingBM,16212120710,1
gydzd7e,ndkvik,If youre vaccinated then it shouldnt matter I got my vaccination so I could confidently not wear my mask and not give a shit if entitled people got their shot or not,Yawheyy,16212121660,1
gye1cni,ndkvik,I went in to a couple of stores today with no mask Im fully vaccinated Felt weird like wearing masks in the beginning did Felt like I was getting some death stares,googlybunghole,16212131880,1
gye1jsx,ndkvik,My boss is photoshopping her vaccine card because she doesnt want the vaccine She says nobody whos vaccinated needs a mask so she doesnt need one She nearly died of Covid this December I wish she was the only person at my work who said this but alas,jman12298,16212132910,1
gye2u8f,ndkvik,This shits a joke If you are concerned and worried wear a mask and get the vaccine If you arent then dont and live life how you want If the vaccine is effective (but not yet proven SAFE long term) then why the fuck is that so hard lmao The very few that are at risk should be the ones monitoring where they go and how they protect themselves Not the 99 percent of people that would be fine and kick it in a couple of days especially now that there is a vaccine available If you are worried just get the vaccine and stay masked up all times,coryosu,16212139600,1
gye3ej7,ndkvik,Why does it matter? Im vaccinated have been waiting to not wear mask since early Feb Finally!,pharaoh26,16212142440,1
gye3mxa,ndkvik,But I mean so what? If they dont want to get the vaccine which is freely available right now and they dont want to wear a mask why should we mandate that they avoid COVID? If these people dont care about whether or not they catch the virus why should we?,Pradidye,16212143610,1
gye3zbp,ndkvik,"You LIEyou DIE" That should be the new slogan to convince people to wear masks unless fully vaccinated,Daddy-OH-77,16212145280,1
gye4a5s,ndkvik,Im gonna be the one weirdo telling the truth I havent been vaccinated yet (dont worry I will eventually) But I am still wearing masks and honestly plan to for as long as possible because I like them for multiple reasons,bex505,16212146810,1
gye4snk,ndkvik,My old boss is already doing this He gave until this weekend was over then he was going to stop wearing a mask,RyMc47,16212149400,1
gye524t,ndkvik,I dont care If you lie about being vaccinated and dont wear a mask and you get sick its your funeral,Artifycial,16212150750,1
gye55v1,ndkvik,In Ohio mask mandate officially ends June 2nd Ill be fully vaccinated on the 3rd Im still very happy I got vaccinated but I wont have an obvious flex over all the nay sayers,martynic385,16212151260,1
gye5cre,ndkvik,No shit theyll lie They already dont wear masks anyways what makes you think they care about anyone other than themselves,danger_zone30,16212152260,1
