hr7bfi9,rvbeq4,My wife came home with a stuffy nose on Christmas Eve On Christmas morning she woke up so tired that she was wiped out putting the gifts under the tree and went back to bed after the kids opened their gifts That night she was vomiting and for the next 3 days she literally slept all day I have never seen her that sick For 3 days following that she was awake but easily fatigued as well has still being congested She took two at home Covid tests 3 days apart and both were negative but I personally think they were wrong We couldnt get a pcr test for 4 days from onset of symptoms and since shes vaccinated and was at home for the 5 days the cdc recommended she just went back to work with a mask on on the 6th day after her first symptom once she was feeling better,lovelymsvalentine,16412970930,1
hr7bp7p,rvbeq4,I still havent gotten it Omicron is starting to skyrocket in my country as expected Im vaxxed and boosted i wear masks religiously but still im bracing myself for impact,KcoolClap,16412972690,1
hr89164,rvbeq4,Still covid free Yet they said that masks do nothing humm seems like they work when you use then correctly,generationdestroyer,16413133440,1
hr8netj,rvbeq4,Im gonna start wearing a mask in the gym again,pizzamassage,16413189370,1
hrogebv,ryb5hr,The hard part is theres nothing I can do about it Hardly anyone in my area even pretends to wear a mask anymore Myself and my spouse are vaxxed and boosted but our kid is too young for anything And while I know the odds are with us getting a mild case the fact that its almost inevitable well catch this thing after all the time we spent protecting ourselves and our family is incredibly stressful and disheartening Adding to that is the complete disregard my coworkers have about it Its just exhausting,Rook1872,16415845320,44
hroan32,ryb5hr,Yep I work in healthcare tried to explain to my anti-mask/anti-vaccine brother that the reason his wife had to wait two days for an icu bed in an ER bed was because of COVID then she had to wait in the ICU an extra two days before she could be moved into a regular floor bed His response was "no they said its a staffing issue They cant find nurses to work" I then had to explain why nursing were taking traveling jobs and how other regions are taking your local resources to staff their hospitals Not to mention burnout Its just so hard to get them to see the domino effect,k1dsmoke,16415824170,265
hro4ye1,ryb5hr,Professionally the Covid deniers Antivaxxers have caused me a great amount of burnout hardship and reason to question if I even want to be in healthcare I went from Hospice to the front lines because I felt so helpless After a little more than a year I went back to hospice Personally Ive been estranged from my family by blood People I used to associate as "friends" wont return texts calls and pretend I dont exist Despite having completed college courses in biomedical statistics organic chemistry microbiology and anatomy/physiologytheir Facebook and Fox news were just more reliable than my access to scientific and research rendered data Ive been spit on by my patients in the ER when they learned they were Covid+ Ive been accused of propagating the "Leftist" conspiracy Been told I will burn in hell by loving evangelicals Scoffed at and heckled for wearing a mask when I absolutely had to go into public places No its not mild at all Never has been,Registered_Nurse_BSN,16415803500,495
hrnxli7,ryb5hr,\>In the US many health-care workers told me that theyre already seeing that effect: COVID patients are being discharged more easily Fewer are critically ill and even those who are seem to be doing better "Its anecdotal but were getting patients who I dont think would have survived the original virus or Delta and now were getting them through" Milad Pooran a critical-care physician in Maryland told me **But others said that their experiences havent changed perhaps because they serve communities that are highly unvaccinated or because theyre still dealing with a lot of Delta cases** Milder illness "is not what were seeing" said Howard Jarvis an emergency physician in Missouri The people most likely to end up in the hospital are the ones least likely to protect themselves or adhere to any sort of restrictions Get boosted wear your mask and you will be fine to go about your life,JoeSchadsSource,16415777400,54
hrofs5l,ryb5hr,I live in very rural area and pretty much everyone here acts like its already over I wear a mask but I have to be around people more often than Id like I had a breakthrough case in October before I was eligible for the booster but I still got boosted as soon as I could (I was too lax after getting vaccinated and I didnt realize until too late that it lost efficacy over time) I even have a hard time convincing the people in my family to wear masks in public because they just see everyone around here acting completely normal as if its completely over Its hard to do things like that when no one else is I get the psychology of that and I dont know how to convince them that they still need to do it,ArcticTrek,16415843040,42
hrpanar,ryb5hr,The deceptively hopeful narrative that Omicron is somehow good is just downright disgusting No its not good Theres nothing good about a pandemic or a new strain of a viral pandemic No its not an excuse not to wear your mask No its not an excuse not to get vaccinated No it doesnt mean its now okay to force people into risky environments for the sake of "the economy" This whole ridiculous positive spin on Omicron has been just another in a long line of disheartening moments punctuating the pandemic,lankist,16415959560,14
hrqk2ay,ryb5hr,can someone ELI5 why during the start of the pandemic we were told to stay home to prevent situations like this but now the situation has returned but we are being asked to go back to doing what we were doing but with masks on?,Ron_1n,16416156650,3
hrryvsl,ryb5hr,I am curious: How much of the depletion of healthcare shortage is the absurd number of dumb nurses (and possibly doctors but Ive only heard of nurses) bragging about how they refuse to wear a mask or get vaccinated then whine about losing their jobs for doing so? Is that situation common it is it just outrage clicks lying to me?,Davethe3rd,16416499160,1
gz9pbx7,njv3nr,Well the nurse wearing her mask below her nose is disappointing,crazyreddit929,16218620710,34
gz9urt0,njv3nr,The governor has made it "amazingly" not safe by preventing mask mandates in school and other pro-plague measures,livinginfutureworld,16218648830,2
gzb1chr,njv3nr,Thats good news Apparently only 34% of Texans are vaccinated right now I really want to drop the mask and occasionally do but those numbers suck for herd immunity so far And being in Texas who knows if well ever hit something like 50-60%,Ayroplanen,16218838150,1
huzlo8g,sgzsi0,Good mandate as far as Im concerned How about willingly not wearing masks in the (overcrowded) NYC subway and not paying for their travel fares? Will we hear anything about that? Edit: Right after demonstrating theres videos of the incident 100s of officers storming in the subway unmasked and skipping the fare tolls,Deschain53,16436344240,994
hv0a46n,sgzsi0,Is this why I kept seeing videos of a parade of maskless NYPD officers over the weekend?,bbressman2,16436452210,27
hv02961,sgzsi0,What about unmasked smoking and on their phone while in uniform? Fuck the NYPD bunch of lowlife corrupted mofos,thefamousunkown,16436420920,0
huzywl9,sgzsi0,Cant access the news from my country But why some idiot antivaxxers are downvoting all the comments? Unbelievable how theres people who are so selfish and dont care about fellow human beings or themselves The vaccine prevents people to not getting deathly ill And face mask prevents people from spreading this virus that is very deadly for some people and also random people without obvious cause But noooo "my freedoms" Its proven and tested science Thats what it is,emayelee,16436406950,-10
hv0iak7,sgzsi0,Ive seen cops where I live in FL walk right past "masks required" signs on the doors of local businesses since the pandemic started There was a morning during one of the especially bad upticks in the pandemic when I was waiting to pay at Cumbys & watched as one deputy & then a 2nd strolled in sans masks then stood a few feet away from the side of the counter & poor cashier (they had the plastic partitions up in front of the registers at the time but nothing on the ends) just gabbing & laughing & taking their sweet time making coffees I had to literally bite my tongue it was so infuriating,kimlion13,16436483110,-3
hv0kd6q,sgzsi0,What about the ones with the fake vaccination cards? Also well they still be flooding the subway without masks?,TheBigPhilbowski,16436490780,-4
hv17v9g,sgzsi0,Well Judging by the videos of all those maskless cops on the NYC subway the other day Im betting a whole lot of them will have terminated themselves in very near future No need for mandates when youre unvaccinated and dead,TakaraGeneration,16436577410,-3
hv1jql6,sgzsi0,I wonder how many of them were maskless at that funeral the other day? And how many decided to ignore the turnstile and ride the subway maskless to get home?,dieinafirenazi,16436621940,-3
hv0zxpy,sgzsi0,Considering 100000 unmasked LEO descended upon new york this weekend I wonder if the "retirement" will come early for some of the currently unvaxxed post,lostkarma4anonymity,16436547890,0
hr8mm2k,rw0223,I mean if it turns into something similar to the flu shot then I think thats fine Push it in the elderly and immunocompromised Maybe theres mandates for elderly care facilities and health care workers But you cant essentially hold a large % of people hostage who wont get these additional shots and say they cant participate in most aspects of society It doesnt seem sustainable at all long term and I think a lot of people who are and have been pro do their part have lost some faith in how we end this pandemic and get back to living our lives without any restrictions/masks/mandates,VerneLundfister,16413186330,500
hra8vb9,rw0223,I dont think anyone is expecting us to Like every other vaccine the science will progress to the point theres a vaccine that lasts a year or longer Also people are becoming more use to masking and isolation when theyre sick which slows the potential for spread and as more and more get vaccinated the spread will further diminish so it wont be as dangerous to go unvaccinated for a few months as it is now,toastymarbles,16413412090,1
hrcsuqx,rw0223,Have to kind of agree with this guys sentiment Its just not quite feasible long-term Best one can do is get another booster if greenlighted and wear a decent mask that can filter out Ill get my booster as often as theyll let me and use a halfway decent mask,petchulio,16413919810,1
hra3m2i,rw0223,Work and school from home are absolutely critical in necessary conjunction with masks and vaccines It will absolutely never get better without all 3,HerLegz,16413390740,-1
hraojv4,rw0223,"Oxford vaccine scientist" please tell us your genius plan then Going to ask the Coronavirus to kindly please stop mutating? Best we can seem to do is figure out how to convince people to actually wear masks and wash their hands Barring that I dont know theres a better way,Lefty_22,16413477230,-3
hr9qg6x,rw0223,There are so many people here complaining that its hard to wear masks and get shots and that theyre "done" Its just so hard to do /s We practically eradicated the flu last year just by wearing masks,thedude0425,16413338850,-2
hqqz7ew,rt54vc,I know of an event (a company Christmas party) where all participants (around 100) had taken a covid test before the event and quick test before the event at the door 0 positives There were some serving staff all wore FFP2 masks About 5 days after the event 50% of the people there tested positive,puupi,16409971860,671
hqrm3o3,rt54vc,Federal government basically is saying youre on your own is why And theyre not wrong since states dont want to cooperate and people are tired Some places like NYC are really good at wearing a mask Others like Philly not as much and where Im at for the holidays Houston well LOL COVID ended in March silly!,cougar618,16410083810,102
hqripxf,rt54vc,TLDR; If youre using an antigen at-home rapid test wait until 2-3 days after symptom onset (but quarantine before then ofc) Family of 4 (50M 14F 16F 22F (myself)) We were exposed to COVID either on Christmas or the 26th (a close family friend (50Ms girlfriends son 15M with whom he was in the car with for 3+hours on the 26th) had a fever on the 26th confirmed positive PCR test on the 28th) Weve been quarantining since the 26th Day 0: 50M 16F and I took a QuickVue antigen test on the 28th They were all negative At this point 50M had a scratchy throat and was mildly coughing The rest of us had no symptoms I started getting a tickly throat (that feeling of "oh here it comes") late at night Didnt test 14F that night because the tests arent cheap :) and we were quarantining anyways At this point if one of us had it the rest of us did Day 1: The next morning 14F woke up with a fever Myself and 16F woke up with sore throats a headache fatigue and coughing 50M stayed the same I felt pretty rough that night had intense night-sweats and lots more coughing 14F broke her fever half-way through the day Day 2: 14F and 16F are feeling much better! Yay! Hardly any symptoms just mild coughing and runny nose I have worse coughing fatigue scratchy throat runny nose nausea 50M doing pretty much the same as he was--just a scratchy throat and coughing At this point its just been a bad cold for us or akin to a case of bronchitis We all took more at-home tests: 2 QuickVue 2 BinaxNOW All 4 came back positive Day 3 (today): 50M lost his sense of smell dampened sense of taste This didnt happen during his first run with COVID (April 2020) Still has similar symptoms but theyve gotten better Im doing much better still occasionally coughing & headaches/cold symptoms 14F and 16F are practically symptom-free now just a bit of coughing 14F and 16F were 2x Pfizer vaccinated in June 2021 (date of second dose) 50M was 2x Moderna vaccinated in January 2021 but caught COVID early-on from hospital work in April 2020 Was a fairly severe case lasted 15 months but no hospitalization I was vaccinated 2x Pfizer in April 2021 None of us received the booster yet I think we all caught Omicron as the symptoms are relatively mild 14F 16F and I have never had COVID before A bit sad we caught it after 2 years of not catching it 50M isnt as cautious with masking/avoiding crowded areas procedures as we are Some anecdotal evidence if you will We all tested negative the first round of testing and all tested positive the second round of testing So you may want to wait until 2-3 days after the start of symptoms before you do an at-home test Best of luck to everyone! Stay safe out there PS Im updating this as the days go by because why not?,tigerflower21,16410066340,208
hqsiupf,rt54vc,Because no one is giving a shit about social distancing or wearing masks properly anymore,XenoXHostility,16410312950,13
hqrrvct,rt54vc,Im in the New York Area and I got it despite being triply vaccinated Took the at home test and showed negative So I didnt think anything of it Question: did anyone experience feeling dazed while they were sick? I had a day where I almost felt like I couldnt keep my balance at all and minor head movements caused my vision to blur Thought it was weird especially after my girlfriend caught it from me and had the same symptom Only lasted a day for both of us It was really bizarre Edit: For those of you that havent caught this yet dont be surprised when you do Both my girlfriend and I are doubly vaccinated with Pfizer and got the booster 3-weeks before we both got sick We were good about washing hands spraying things down with alcohol and wearing masks outside We werent perfect but we werent any more lax than we were when the pandemic first hit New York and neither of us caught it then The symptoms apart from the one mentioned above were like those of an extremely aggressive cold I had no fever but I averaged more sneezes in a day than at any other time in my life and had what was basically an open-faucet for a nose It wouldnt stop running and spent literal hours in the shower just because it was the best way to save on tissue paper It was by far the worst symptom (which is good because its shitty but not life-threatening) Also really bad nausea I had really bad body aches as well but it was all over in 3-4 days max My girlfriend is currently going through it and shes lost her sense of smell and taste No nausea no fever and definitely no where near the runny nose or sneezing fits I had Cough and sore throat though Very different symptoms with a few weird ones shared Her smell and taste are improving apparently and its only been 4 days since she lost it This is a weird fucking virus,Apprehensive-Grade81,16410115440,51
hqrih0s,rt54vc,Everyone having to take their mask down in the exact same spot almost immediately after the person in front of them did at TSA checkpoints is just fucking **insane** You could be 100% perfect with your precautions and mask properly with the right kind of masks but **every single person whom traveled via plane over the last two weeks was royally screwed by that TSA policy** Personally I dont see how anyone could be confused by how fast this is spreading when you consider the above in unison with the fact were at pre-pandemic travel levels Shits insane,GeneralScreening,16410065040,129
hqqxgbc,rt54vc,Tell the scientists to go to any grocery or department store and restaurants and look at all the people not wearing masks Thats why its spreading too fast,Ithinkyourallstupid,16409963560,275
hqr9og5,rt54vc,No one wears masks half the populationor lessis fully immunized A true mystery indeed,dehydratedbagel,16410021610,58
hqrrsss,rt54vc,> But heres an interesting additional point: For unvaccinated people there was no significant difference in rates of infection between delta and omicron That would indicate that both variants are about at the same level of transmissibility among the unvaccinated  in other words under those circumstances omicron is not necessarily more transmissible than delta > > If confirmed the findings would support the idea that omicrons increased transmissibility can be ascribed to its "immune evasiveness"  not some other characteristics that make the variant inherently more transmissible the authors conclude Basically everyone thought the vaccine was going to protect them so society got careless with masking disinfecting distancing etc and omicron took advantage of it,Mydst,16410115040,32
hqrp0iq,rt54vc,My kid had the sniffles Other kid got very mild sniffles We still had no idea that was covid Husband got sniffles and was very tired Talked to my mom on the phone and she said thats omicron Its mimicking a cold Husband tested positive Two days later I tested positive We would have went to Christmas not even realizing it was more than a cold Its spreading so fast because by the time you realize you have it youve already been around a bunch of people Monday the kids go back with no masks required so this should be fun Were all vaxed but it didnt matter wearing a mask with omicron Of course our symptoms are a lot less being vaxed This shit is crazy,IDidIt_Twice,16410099180,47
hqrbngx,rt54vc,Had third shot the 23th of December mask when outside/inside My wife and I positive on self tests We did the test just in case before to go to meet friends for new years eve,Crimcrow,16410030850,19
hqs4y4x,rt54vc,I know why Cause fuckheads get it then go out to run errands knowing they have it and dont wear a fucking mask or anything I know this because I witnessed it yesterday Dumb shit told the cashier at the grocery store she had covid The cashier them bleach wiped all the things,funktopus,16410198720,4
hqqml1q,rt54vc,Because nobody is masking or distancing theyre too busy at parties concerts on airplanes cruise ships at gatherings movie theaters and shopping malls My idiot in laws just both got covid after spending 5 days on a Caribbean cruise when they got back they went to their local bar and infected all their "regular"friends,thegreenman_sofla,16409913160,208
hqskxod,rt54vc,Hi yall I did everything I was supposed to all pandemic long: Wore a mask social distanced gave up all my social activities even though it fucking sucked got vaccinated didnt even spend holidays with my family and to be honest Im feeling so over this all The vaccine has been out long enough We have masks We even have boosters People have made up their minds If you arent going to get vaccinated or take precautions any longer I honestly cant care any longer for your safety Im ready to live my life again I bought season tickets to the local college football team but sold them at an insane loss because I didnt want my (unvaccinated) diabetic mother to die I did everything I was supposed to and it feels like it wasnt enough Im tired of this Im tired of trying so hard when there are people that literally act like the whole pandemic was imaginary Im done caring Im fucking done,Barkingcat29,16410331520,6
hqtub4l,rt54vc,Trying to figure out why? Wtf?? Fucking go outside Go into any store and look around at all the maskless unvaccinated idiots rubbing their eyes and coughing all over everything Who are these scientists?? Can we replace them with humans with brains?,Most-Attention-5077,16410597350,3
hqsckd8,rt54vc,And yet the cdc bent their knee to the corporate overlords with this new joke of quarantine guidelines "Just wear a mask after 5 days and youll be fine to go back to work",GalacticKrabbyPatty,16410258230,9
hqrh4cg,rt54vc,Those who say masks or vaccines would have helped this and blame on others I am really sorry to say but Omicron seems to be not caring about that Just by reading other redditors comments show that I do also think I got one even after getting fully vaccinated etc This one is a completely different one I just hope that this is a sign of Covid19 turning into a common cold,tedbakerbracelet,16410058110,15
hqt6p9l,rt54vc,Florida dude here Uh if other places are looking anything like it looks like here in FL where Im usually the only person wearing a mask literally everywhere I go It might have something to do with that Edit: a letter,Floridian_Robot,16410490670,2
hqt7gdf,rt54vc,1 Its much more contagious 2 A lot more people arent bothering as much or at all with preventative measures such as masks because a lot more people are just so sick and tired of this nonsense that they just have no shits left to give They also understand that if theyre vaccinated (the overwhelming majority at this point are) its practically guaranteed to be nothing more than a mild cold for them so they figure "If I catch it I catch it its no big deal and gets it out of the way plus itll probably give me immunity to this strain" Im one of them,mypervyaccount,16410494710,2
hqt908h,rt54vc,Its more contagious (and spread by the vaccinated) and hit at a time when our society has pretty much given up on stopping and decreasing spread through basic measures like masks and not having massive gatherings That wasnt a hard one,stblawyer,16410502730,2
hqt9459,rt54vc,Do you really need to be a scientist to know people arent wearing masks and spreading it?,Memphisrexjr,16410503290,2
hqtrdkl,rt54vc,Because it spreads through the ACE receptors in your eyes and most people dont cover their eyes We should add glasses/goggles to mask wearing,CORKscrewed21,16410585290,2
hqtrz6z,rt54vc,Highly suspect I have covid Have not been able to find an at-home test yet Double vaxxed and boosted with pfizer Started with a sore throat which had turned almost unbearable with a lot of coughing and occasional sneezing I suffer from fatigue spells already so hard to say on that front I mask everywhere but my brother was sick around Christmas and went to the doc twice-- was not tested for covid told it was likely sinusitis now the rest of the family is sick,scssypants,16410587750,2
hqt8d2q,rt54vc,Scientists know why: claimed vaccine protection was no where near accurate and immunity wanes after 6 months coupled with everyone deciding the pandemic was over and packing malls and restaurants Sports events had tens of thousands unmasked worldwide,Professorbubba,16410499420,7
hqrmopf,rt54vc,In my city bars and clubs are full without any mask restrictions About 30% are on the streets with no mask And still alot of people appear to not have a clue that you can be asymptomatic and still spread covid,4twinkie,16410086870,3
hqrwaal,rt54vc,Its weird watching the news about overwhelmed healthcare workers and record cases and then flipping to the ball-drop where half the people arent even masked and packed in like sardines It feels like a bad horror movie,CoasterThot,16410142600,2
