h988bku,p5gzct,Can they claim religious exemption like they do in my area? Im referencing for employment purposes tho as Im in a red state and I dont see masks even coming back,KCP348,16291599610,0
hmvmjhx,r6ejmd,I remember when the pandemic started that " you dont need a mask" I dont believe anything WHO or medical officials say anymore When they say " omicron aint that bad" screw your WHO Im going back to my bubble and wearing triple masks,Invu8aqt,16384106200,6
hmt52db,r6ejmd,"no evidence" That means they havent confirmed it yet they used this term with masks originally which put people off wearing them,Mike_Nash1,16383746180,5
hmupdug,r6ejmd,Other then the bit in SA (which could have been Delta) are they mild for unvaccinated as well? Obviously less so but are they life threatening so far? Also I know we still need more data and shouldnt get ahead of ourselves - but lets say it ends up being both mild *and* outcompeting/taking over Delta Would there still be logical reason to enforce masks? Other than politics of course,IDrinkMyOwnSemen,16383963180,2
hmspg9f,r6ejmd,I hope other research bears this out but the WHO hasnt proven themselves trustworthy at all these last many months Their botched investigation into the origins of Covid plus their disastrous delays on recommending masking mean Im going to wait for more data and rely on other policymaking orgs,HazelFrederick,16383678330,4
hmui9g3,r6ejmd,Is this the same WHO that said COVID-19 wasnt airborne in early 2020 and that masks werent needed? Im not sure they are a reliable source,smithsp86,16383936040,1
hmvushl,r6ejmd,This is yet another media scare Vaccinate mask up and keep your distance Youll be fine,fdntrhfbtt,16384141610,1
hmvwq04,r6ejmd,So why in the fuck is it being sensationalized? Fuck the media Ive been on board with all of it Im Vaxxed I wear a mask without issue but for fucks sake,Libidomy94,16384150200,-1
h31ee46,o7uhad,Given that not wearing masks was soon as a reward it be hard to double back on rules I think getting vaxxed is gonna be very important as we enter the fall,onesugar,16246549420,1067
h319q0d,o7uhad,Whether they suggest we wear masks or not is irrelevant; people will not resume wearing them Theyre over it The vaccinated are safe and most of the unvaccinated dont care or arent worried Its unfortunate but those with health issues precluding them from being vaccinated will be caught in the crossfire herethose in this category will need to continue staying out of public indoor spaces and/or wearing masks,jeebuzpwnz,16246527090,617
h31ehg9,o7uhad,That was quick Went from "fully vaccinated people can gather together outdoors or inside" to "fully vaccinated people should still wear masks",_sideffect,16246549880,628
h319h64,o7uhad,At this point if youre not vaxxed when youre fully capable of doing so its your fault if you get sick and die from a non-mask-wearer,OldAcctWasStolen,16246525960,277
h326139,o7uhad,Lets be clear vaccinated people who have stopped wearing masks are not the problem at this point,sprugglr,16246698060,79
h312rn7,o7uhad,My dad has bad RA and its agonizing for him to lift his arms up to put on an N95 every time he has to leave home I have to help him with it He has no choice but to wear it everywhere now with no one around us wearing masks He didnt develop antibodies from the vaccine Every time I hear people whine about the potential prospect of having to go back to wearing even a simple cloth mask I get angry,monolith212,16246495010,488
h31c9u9,o7uhad,They are gonna have a HELL of a time convincing people to go back to masks if this variant is serious they fucked up by telling people to bring their guards down if this is gonna be round 2,Negan1995,16246539200,130
h31l6qi,o7uhad,I dont have anything against masks I wear them still because they are mandatory But I got both of my doses everyone around me got vaccinated why should I keep wearing them when they are not mandatory anymore? Because of ppl that REFUSE to get the vaccine? I think not,NecVoluerunt,16246583410,116
h31tktq,o7uhad,Mask deez nuts,FitHead5,16246627750,46
h31xno4,o7uhad,The premise of lockdowns and restrictions was not "just" preventing death but preventing the collapse of the healthcare system from a disease of unknown impact Im vaccinated My area has it under control The hospitals are running at a stable rate I am not going back to always-masks unless we get told there is a severe variant that renders current vaccines ineffective,Professional_Sort767,16246650390,27
h323zw3,o7uhad,Yawn I got covid despite wearing a mask so I had the antibodies I went ahead and got the vaccine anyway Im not going back to wearing a mask Its hot as hell where I live and I hate not seeing peoples faces and having trouble hearing them,Mr_Suzan,16246686570,20
h3208f6,o7uhad,Yeah man I not wearing a mask if I dont want to Im fully vaccinated The CDC needs to decide if vaccines work or not,Poop_On_A_Loop,16246665050,16
h321je3,o7uhad,No thanks Im fully vaccinated and Im not going back to wearing masks,throaway7634,16246672640,16
h320sdk,o7uhad,Am I an asshole for admitting I genuinely dont know what to do anymore and cant stand these masks? Its not even for political reasons My self esteem has tanked because of the damage these masks have done to my skin,Ebiki,16246668250,20
h320mip,o7uhad,I dont care Im vaccinated and if I wind up being one of the 5% who get sick let me die because 15 months of wearing a mask in addition to isolation was murder Id be happier dead than alive wearing a mask and distancing myself from humanity,lavurso,16246667320,26
h3212p9,o7uhad,Get fucked The mask isnt coming back,comicsanscatastrophe,16246669920,15
h31hz1a,o7uhad,What like everywhere? should I wear it around the house? Should I sleep in it? Maybe wear it down the field when I take the dog for a walk? Why is it always just some dumb simple "wear a mask" message? Perhaps there should be better guidance on where it is most suitable to wear them and it might have more credence Im not being funny but if this is going to be around forever then theres not a chance Im just going to "wear a mask" and "keep 2 meters apart" forever There are more important things in life than just avoiding getting Covid I was already very low risk of harm and now after vaccination I am 93% even less at risk of harm I am fully capable of taking personal responsibility when I feel ill and being careful around old/vulnerable people/settings but this weird psychosis needs to end Its not any way to live life,jimmy011087,16246567180,16
h321rh0,o7uhad,Im already vaxxed No mask for me,brandoniravioli,16246673950,15
h31hygu,o7uhad,So when exactly will we be able to take off our masks? When deadly viruses stop mutating or appearing - not credible When the whole world has herd immunity against every variant of every deadly virus? - never happening If the WHO wants to restore even a shred of credibility they need to back up the pronouncements with actual science,johnnydangr,16246567100,11
h31eqou,o7uhad,Ive just started using grocery delivery apps and avoiding any and all events at this point just so I dont have to deal with all the fighting over face masks Im tired,SlyCoopersButt,16246551180,6
h3237v4,o7uhad,Hell yeah boys I can finally go back into banks with a mask on without drawing suspension,aDrunkWithAgun,16246682210,8
h322dcc,o7uhad,WHO is free to continue wearing masks as needed,Blue2200x,16246677420,7
h31vjwf,o7uhad,Thats a no from me dog Get vaccinated or pay the price I wore a mask and followed the rules all the way up until I got vaccinated and then I continued to wear a mask for months I have had enough especially when the expense I pay is for people who choose to remain unvaccinated If you are immune compromised and need to wear a mask I understand but you cannot ask the entire population to continue to suffer at the hands of a couple ignorant people who choose to ignore science,Captain__Zanzibar,16246638630,8
h31zmcb,o7uhad,Im so sick of this shit I work retail Nobody listens Ive been vaccinated since february Been wearing a mask since it was first encouraged back in the early part of 2020 and it just constantly feels like Im being punished for other peoples selfishness,SHAnaNEgans,16246661550,2
h321fay,o7uhad,Today was the first time since the pandemic started that my fianc and I went to a restaurant We are both fully vaccinated and for the first time and finally took off our masks for some lunch Reading this feels like a punch to the gut,sixthusernametry,16246671980,9
h316ev0,o7uhad,1 mask 2 masks or 500 masks should i wear? Or if im not vaxed i continue to wear the multiple masks and if im fully vaxed i wear 1 mask,herrrrrr,16246511800,28
h31thq8,o7uhad,I figured we would be in masks the rest of our fucking lives ,Sylveonne,16246627270,6
h315czo,o7uhad,>The Wall Street Journal reported Friday that about half of adults infected in an outbreak of the delta variant in Israel were fully vaccinated with the Pfizer-BioNTech vaccine prompting the government there to reimpose an indoor mask requirement and other measures,de6u99er,16246507050,13
h31u18i,o7uhad,How many times has the WHO been wrong on this I guess this is confirming yo me masks are not required after getting fully vaccinated Fuck the stupidity of the WHO,Purple_oyster,16246630280,3
h31p7dt,o7uhad,Honestly it does seem like every other week WHO seems to change their minds Either way Im immunocompromised and Im not taking my mask off for a long time,SaintAnarchist,16246604160,1
h32498y,o7uhad,But masks dont really protect the wearer which would mean they think fully vaccinated people spread the delta variant?,LegoLady47,16246688030,5
h31idx7,o7uhad,Maybe if youve been vaccinated with Sinovac then you should still continue wearing a mask since that shitty Chinese vaccine doesnt work If youve had the mRNA vaccines/J&J/AZ youre fine,seancarter90,16246569220,4
h31iju2,o7uhad,Im thinking about just keeping a mask in my pocket and putting one on if Im in a store and theres kids around or something,BrentMusic,16246570040,5
h31ps36,o7uhad,Not gonna happen I did everything the cdc and our (CA USA) government asked and now Im fully vaccinated Ill wear a mask if the business requires it but not when its my choice unless I hear my vaccine isnt effective against the variant,beachguy82,16246607170,3
h31qk58,o7uhad,Not going to happen Were done with the masks and offices are re-opening Were going to have to ride it out from here,skiesarelight,16246611340,3
h31n9cr,o7uhad,The advisory was because vaccinated people are getting infected It doesnt say anything about vaccinated people becoming severely ill or dying so I dont understand the concern here other than to prevent the spread to unvaccinated people who are inevitably going to catch the virus regardless of masks and measures as long as they choose not to get vaccinated?,mmDruhgs,16246594170,2
h31w9dx,o7uhad,This is just going to give the anti Vaxx people more ammo If vaccinated people cant stop wearing make then its never going to happen Not wearing a mask is a good insentive for people who still dont have the shot,SolomonRed,16246642540,2
h31wxm5,o7uhad,Will we ever go back to not wearing masks  I sure hope there isnt a variant that is resistant to the vaccines  Wed be so fucked,EquivalentSnap,16246646310,2
h322npt,o7uhad,No problem I do need to find a mask thats good for big noses though I cant find any though :/,thornangdol,16246679070,2
h31dnpl,o7uhad,US has like 40% unvaccinated people walking around thats a huge number Im keeping my mask on for a while its not that hard,cjeremy,16246545880,-17
h31fn7a,o7uhad,Honestly why do people want to stop wearing masks in crowded places? I havent been sick at all this last year and its because Ive been protecting myself from all your germy asses Ill probably just continue to wear masks in public from now on,Susanthebea,16246555670,-29
h31amnc,o7uhad,AH HELL Here in michigan we just lifted everything and masks Neverending plague because people are fucking morons,chuck9884,16246531350,-16
h3226v7,o7uhad,My 13 month old has it right now and its a nightmare We basically werent impacted because of the vaccine but man he is doing horribly Keep the kids in mind if nothing else and wear the masks,EvilBertMacklin,16246676420,-1
h31ozje,o7uhad,Id already decided Im wearing my mask for a while I had covid and its not fun Plus Ive lost too many friends to it and Id rather not die as well,Marloo25,16246603070,-9
h3207xb,o7uhad,Never stopped No knock on people who have Cases in my county are low and rules have eased But there was a lot of mask flip flopping early pandemic So I will stop after a few months of continuous "all clear",jackofslayers,16246664970,3
h31yubz,o7uhad,Gonna have a hard time getting me to *not* wear a mask I thoroughly enjoy not having to smile constantly in public,Things_I_Dig,16246657150,-1
h31j1fe,o7uhad,We (me and my high school aged kids) still wear masks and weve been fully vaccinated for a while now,SewAlone,16246572470,-5
h31608l,o7uhad,not a problem been wearing masks and respirators for like two years now kinda got used to it Dont even leave my home without it its like a taking a wallet and your keys :) no issue for me at first maybe it was an inconvenience but now pfff :) Im just wondering where will it end Im not really smart at these things when it comes to viruses but maybe in an alternate and totally theoretical universe could this virus carry on evolving until it becomes a super killer virus which kills everyone it meets?,MidgardSG,16246509970,-32
h31wpnb,o7uhad,Not a problem for me Ive got immune compromised people at home so Ive kept my mask on even after I was vaccinated,LunarxSeven,16246645050,1
h31hths,o7uhad,i already made that decision here in california in spite of mask mandate lifted 6/15 long before delta variant arrived mostly because of the fake maskless supposedly vaccinated bozos running around trolls ridiculed but as usual i am proven right,ccwagwag,16246566410,-13
h31x7va,o7uhad,My state has lifted all mask and distancing restrictions and my work followed suit How the HELL are they going to put the genie back in the bottle now? My state is red and dumb and anti-mask anyway This sucks Ive been vaccinated but will I have to deal with customers up in my face unmasked and its unsafe again? sigh,cozycorner,16246647930,-6
h31fpqo,o7uhad,I think its ridiculous that people stopped tbh the virus is still nowhere close to manageable If anything it should be mandatory to have a mask on when entering any public facility,frantic-no-more,16246556020,-42
h32457w,o7uhad,A mask is a new permanent fixture on my face I dont want to share air with most people virus or no,BruskMonkey,16246687390,-12
h31rc3r,o7uhad,Might as well mask until 2025 at this point every couple months is a different variant ,enterdoki,16246615500,1
h31xazz,o7uhad,The Moderna vaccine just about killed me I got so incredibly sick If a booster is anything like the regular shot theres 0% chance I subject myself to that every 6-months Ill just stay at home wear a mask always and do my best But Im not taking more of those dreadful shots,blackboard_toss,16246648410,1
h321pj4,o7uhad,I never stopped If by now you didnt notice there are too many unknowns and its day to day developments you either werent paying attention of gave up due to fatigue Mask and carry on,ionmushroom,16246673630,-5
h324yii,o7uhad,I dont trust some people without masks Many havent had Covid shots So I wear mine most places,kneecaphap,16246691970,-12
h31seet,o7uhad,I still wear a mask (even when CDC said it was not required for vaccinated) it doesnt bother me Now if CDC changes course a whole lot of people will not only be upset but will not comply,gaukonigshofen,16246621240,-7
h3241di,o7uhad,Maybe we shouldnt have eased mask mandates to begin with After telling people they dont need to wear them it will be damn near impossible to get the ambivalent person to wear one again We never stopped wearing ours (our work still requires it) even to the store or anywhere else Just cause I dont generally want to get sick (cold/flu/allergies) But I can only imagine all the people who already threw their masks to the wind,sideofspread,16246686790,-10
h31i79p,o7uhad,Scary to see anti-maskers and reactionaries getting upvotes in the comments,Nam_Nam9,16246568310,-16
h3256j6,o7uhad,the mask is already a part of my outfitsif done righta mask can make your fit look better imo,memelord_andromeda,16246693240,-7
h321h3p,o7uhad,Am I insane? Or is wearing a mask not that big of a fucking deal? If the cases start going up Im just going to put one on Its not like my life drastically becomes different and unbearable with a mask on,SamSparkSLD,16246672270,-8
h31nsxs,o7uhad,I dont trust people anyways lol the masks stay on,laisity,16246596940,-7
h320git,o7uhad,My family says theyll wear masks but theyre still planning a 10+ hour drive through multiple States for a week in Florida,ClassicT4,16246666350,1
h31oygc,o7uhad,I just drove 2700 miles from California to Colorado Utah is spiking and I didnt see one mask in either Nevada or Utah I also got a cold And Im thinking of going to get a testing kit even though Im fully vaccinated The Delta virus is big in Colorado God its everywhere I think I might go back to a mask which is easy to say for a 66 guy that someone wouldnt make fun of Mask shaming is the most insecure shit ever,unclefishbits,16246602910,-9
h31oikf,o7uhad,Oh this Sub isnt going to like this If the CDC reissues their guidance on masks this sub may catch on fire,piehead678,16246600630,-2
h31rpim,o7uhad,I am and increasingly I am getting looks from my largely leftist community They actually believe you dont need a mask if youre vaccinated,Pizza-is-Life-1,16246617480,-3
h31ljhz,o7uhad,Ive never minded the masks because theyre nothing so I dont mind this but what is the reasoning?,SpikyCactusJuice,16246585250,-6
h31szv1,o7uhad,Thank you for this confirmation that yes I still need to be masking though I have been fully vaxxen since May,ConsistentHair4,16246624510,-5
h31t4o4,o7uhad,Why does anyone not want to wear a mask? Its like Im incognito every where I go No one knows who I am No one can fuck with me,Free_Joty,16246625270,-4
h31u7en,o7uhad,I still wear mine unless there is no stranger nearby during my jog I have a fairly comfortable sports mask I got at costco and its not hard to wear Even in Bay Area there are still some cases despite 81% 12+ having at least 1 dose of vaccine,shawman123,16246631210,-5
h31jnz4,o7uhad,95% of people were wearing masks in the US daily while we were spiking with hundreds of thousands of cases This is anti vax propaganda Vaccines and medicine are the only tools to fight covid Now Im not saying masks dont work but wearing one for 5 minutes while youre grabbing something in target isnt gonna matter when you go home and have 10 people over maskless which happens Most transmission happens inside the home If anything they should recommend masks inside your home the most,TrevOrL420,16246575650,0
h31ot9k,o7uhad,It seems like theyre saying this publicly for countries that have low vaccination rates even though it is said in general terms Because it does make sense to keep wearing masks if you are in a country with only 15-20% of the population vaccinated even if you are vaccinated,Antman-is-in-thanos,16246602140,0
h31yely,o7uhad,Oh God I just got used to not having a mask,AI-MachineLearning,16246654690,0
hrctr4d,rwn229,As an EMT this scenario has been dreaded but anticipated for weeks now We show up to your house and transport you because you had a heart attack or stroke or fell off a ladder and hit your head Or maybe you were in a car accident caused by a drunk driver or bad weather or just bad luck Where do we take you? Hospitals are full no ICU beds Here in upstate NY we sometimes wait 3 to 4 HOURS outside the hospital with the patient in the ambulance because there are no beds in the ER And while we are waiting we cannot respond to other calls that come in People will die in this scenario from injuries or medical issues that were treatable And that makes me angry Not sure who to blame Government anti-vaxxers anti-maskers businesses that dont enforce rules the list seems endless But watching a patient die in the back of an ambulance 100 feet from the ER doors because there is no capacity to provide care is something I dont wish on anyone,IronScaggs,16413923930,8260
hrd6com,rwn229,Time to break out the field hospitals sitting in shipping containers all over the US Should also redeploy the USNS Comfort and USNS Mercy Hospital Ships to coastal areas This would however require leadership that thinks beyond "Get tested Get all x# vaccinations Wear x# masks" rinse and repeat,PplPrcssPrgrss_Pod,16413975940,155
hrec96n,rwn229,Meanwhile everyone in my office is walking around like nothing is happening no masks no social distancing nothing They shot down my request that we all wear masks again until this dies down,PositivelyAwful,16414132030,13
href6ur,rwn229,Fuck every anti vaxxer out there - so many people died because of their stubborn stupidity and selfishness Sure the government is at fault too but in the end the thick of the problem have been all the anti vaxxers and anti maskers well never get out of this pandemic if people dont listen to science,_GypsyCurse_,16414144350,17
hrd0kje,rwn229,But but all the anti-maskers/anti-vaxxers are saying that Omicron is no big deal and will lead to herd immunity and blah blah blah I guess theyre still wrong about everything,dlc741,16413952870,35
hrd4ra2,rwn229,Well I saw that coming We were doing really good and people got too comfortable When everyone was getting vaccinated I saw like no masks around and now were back to this Thankfully I spent New Years in Boston and I could count on 1 hand the amount of people who didnt have a mask on,Jabrak,16413969710,2
h6tu2iz,ot7vtq,bruh wtf : ( I dont mind the masks Ive been wearing a mask after vaccination it just sucks that viral loads in vaccinated people are still infectious,krispykailua,16274792400,1704
h6u2oh9,ot7vtq,Im just gonna say it Im pissed Ill wear a mask to do my part but Im furious about this I had to cancel my wedding last year after 6 months of planning my company imploded and had mass lay offs because were in live events Ive had friends and family lose their jobs and someone who passed away And through all of that my husband and I my close family and friends all did our part last year We stayed home as much as we could we wore our masks we social distanced the whole nine Then as soon as we could we got vaccinated because this was the way to get back to any semblance of normalcy And the same assholes that wouldnt do their part before (wear a mask social distance) just generally running amok are the ones refusing to get vaccinated and keeping this damn virus perpetually going How long are we going to keep carrying these useless people who are not team players and literally care about no one but themselves?! Rant over,ihaterunning2,16274831840,1761
h6u08hy,ot7vtq,Lets be honest we cant do it forever I got my vaccine I always were a mask even if its not obligated and convinced family and friends to get the vaccine But I refuse to do that forever We will reach a point when even the younger can get a vaccine I dont want to still have all this restrictions because people refuse to get vaccinated and are okay with getting it Also everybody panicking because of breakthroughs If we compare the numbers the breakthroughs are not so high Get your fucking vaccine and lets move faster the give the vaccines to poorer countries and prevent other variants,Grumpy23,16274821100,80
h6u4kda,ot7vtq,Instead of clearly articulating the problem which is 80 million adults have chosen not to get vaccinated and they are largely also unmasked the CDC says that the real threat is rare transmission from vaxxed to unvaxxed people How does this make sense?,Nyzeified,16274839960,373
h6utu9i,ot7vtq,Im very torn about this mandate I wore masks everywhere without question As soon as my eligibility came up I got vaccinated I kept wearing the mask until it was officially lifted Now the people who wont wear masks and wont get vaccinated are going to cause me to have to wear a mask again? What is the point? They wont change They dont want the vaccine and they refuse to wear masks Who are you saving? Let kids get vaccinated and call it good Make schools require the vaccine to attend and let it be done,_________FU_________,16274944550,73
h6tgpcu,ot7vtq,Sorry forget to check the subreddit Its time to be "the bad guy" and enforce mask wearing at my jobsite whether people like it or not,kinyutaka,16274714640,589
h6u68z2,ot7vtq,So the CDC "confirmed" that vaccinated people "may" be infectiouswhat is this? Come back when there is some actual data Data - even with the Delta variant - vaccinated people are hospitalized at a rate of 0003% The answer is not to make people "mask up" again - the answer is to get the idiots refusing vaccines to take the vaccine The vaccines are VERY effective The unvaccinated people are the same people who dont wear masks Mandating masks at this point would only protect the RARE case of vaccinated to unvaccinated contagion Instead of focusing on vaccinated infectiousness - focus on getting the unvaccinated to take the dang vaccine,sadpanda___,16274847280,107
h6vr0d4,ot7vtq,I dont follow the logic If viral loads in vaccinated people with Delta may be infections **vaccines** are necessary Im not spending the rest of my life wearing a mask to protect anti-vaxxers and conspiracy nuts since it seems they will always be vulnerable to a resurgence of the virus due to their own irresponsibility and lack of foresight,Bacontoad,16275084670,13
