h5cxd1g,okyu6g,Want to know another interesting and true conspiracy happening in broad daylight? Bernie Sanders is part of it and hes using situations like this to get support and power I mean come on guys ever since this sub has had change of moderators and infiltrated with people from r/TopMindsOfReddit we had nothing but a bunch of dumbf*cks with boners for Bernie I mean does [him promoting the vaccine](https://twittercom/SenSanders/status/1403055153234726919) not seem sketchy enough?,Hermandro,16264080180,2
h5cddva,okyu6g,Theres no conspiracy corporations are corrupt and have been paying our politicians to screw us over in their favor for decades We live in an oligarchy thats the reality but half of this country lives in alternate factual reality and wont take vaccines for a deadly virus because they believe a literal billionaires global propaganda machine over an 80 year old Doctor who they are convinced by millionaire pundits wants to take their freedoms,lonewolfncub3k,16263971820,1
gusypsn,mre4hz,How many of these people were involved in making the vaccines? Bill gates was noted on that plane a few times And he was caught financing Epsteims private experiments at Harvard labs Epstein who stated he wanted to spread his seed amongst everyone in the world,HMaeCoggin,16186312430,1
ho1acey,rdg5q3,Inflation was fake a couple months back Lab Leak was fake a couple months back Vaccine Passports were fake a couple months back 2020 Election Fraud was fake a couple months back 5G and COVID connection was fake a couple months back COVID camps were fake a couple months back Graphene Oxide in the vaccines was fake a couple months back,amazonkevin,16391703010,-9
h3fg10o,o9w3t8,Yup another corporation owned Next up sucking Elons musks dick and shilling the vaccine,anusguy69,16249666280,1
guq5d21,ms2o0d,In fairness this subreddit is always jumping to defense of corporations so are you really surprised theyre A-OK with the pharmaceutical industry hiking prices? Like Vaccines are the devil but charge 12 000 dollars for a paracetamol tablet and folks here start talking about how we cant do anything about it cos globalism,InnsmouthMotel,16185822400,81
guqz51c,ms2o0d,This is what I dont get about you people Here is evidence of an ACTUAL conspiracy among powerful elites to hold peoples health hostage and extract ruinous amounts of money from them for the privilege of livingand you pass right by it Its all in the open its all made legal by a corrupt political establishment but you jackasses go haring off on insane tangents about voting machines and vaccines Heres a fucking conspiracy for you to fight; the rich and the corporations they own have bought our representatives so they write the laws that let them take all your fucking money and leave you to die anyway Go make some fucking YouTube videos about that Tell everyone you know about it Make Facebook groups about it and organize to change things,AtomicSamuraiCyborg,16185951250,11
gurceu3,ms2o0d,But yet theyll sure give you a vaccine that hasnt been out long for basiclly free,Oxiraven,16186010620,1
gurt5fm,ms2o0d,This is a valid argument Over 1/3 of Americans are diabetic or pre-diabetic This absolutely smokes covid numbers Dont forget about the guy that got shit on for price gouging hand sanitizer and whatnot It is also estimated that deaths due to diabetes as an underlying cause are very underreported(it goes hand in hand with infections obesity heart disease cancer etc) Many would argue covid had the opposite treatment Why isnt this considered a national health emergency? Maybe because they dont really care about peoples healthand maybe because its already a cash cow Maybe they just wanted to add covid in as another: millions of tests sold millions of vaccines sold and more to come dont worry! Youll get free donuts though,anon_lurk,16186087170,1
gusrvev,ms2o0d,Why you think we dont want the vaccine,Wpns_Grade,16186271950,1
guteej8,ms2o0d,Now everyone praises and trusts Big Pharma for covid vaccines,HIVnotAdeathSentence,16186430510,1
gutknj6,ms2o0d,Aye but theyll give the vaccine away for freezy,portland_jc,16186487010,1
guqmltn,ms2o0d,But but the healthcare industry really cares about us and we should all get the vaccine ASAP!,pletteezy,16185897310,-1
hntoox5,rc13h3,Finally this sub is not talking about the vaccine,charlespenn1,16390321850,3
gxm0aj9,n908zu,The first shark to fall the Vaccine lord Bill Gates Amazing that right after the AMA probably his wife read all the horrible things and coincidentally she filed for divorce,KillRoyTNT,16206567160,0
gxmyadk,n908zu,It went away because the CIA has moles in every media company in the US They are actively promoting pedophilia and participating in it and almost got caught He had to go Bill gates is controlling vaccine narratives on Tuesday and raping children on Wednesday The whole of government is corrupt and involved in it to some degree Eventually people will wake up and say theyve had enoughbut might not be for a while with brainwashing tools like instagramfacebookInstagram and tik tok,DiscombobulatedDig69,16206711910,0
gve75be,mvs3oq,You dont care about it because this subreddit is too busy trying to prove it covid-19 real or that the vaccines are trying to implanted microchip or remind you about Hunter Biden Its almost like this subreddit has been infiltrated by people who are trying to get us to stop asking the important questions Oh wait my mistake There isnt much talk of Hunter Biden now that theres a lull in the Mike Gaetz coverage GEE I WONDER WHY THAT IS?,Cityman,16190542270,0
hbtb6a8,pip7yv,No they just want us to do all the suffering so that *they* can eat whatever the fuck they want on their private jets taking their thirteenth vacation of the year to a another country while we have to stay at home eating fake meat and working 16 hours a day also not being allowed to vacation to another country because we dont have the passport saying were on the eighth generation vaccine with the twenty-third booster shot Totally reasonable,Efficient-Track2867,16309397710,1
hbx2vaj,p21kbm,Maaaaan My buddy worked at that prison and believe it or not they say he died right after getting his mandatory vaccine during intake I guess they didnt want to spook the general population out of taking their jabs and they just went ahead and strung him up Fucking bureaucratic bullshit Now Im not one to believe conspiracies but when your laying in post-coital bliss with your Sunday friend there is no reason to lie Not once Ive tasted the contents of his balls,Memorysm,16310135320,1
gxgj6o9,n7mzgn,Off topic but you guys are definitely getting that government funded take all of our tax dollars vaccine right? No money involved in that just helping my fellow humans and such!,anon_lurk,16205300950,1
heqk3v8,pxsxc6,Finally a conspiracy theory that doesnt involve the vaccine,-AKG45-,16329317090,10
her75m0,pxsxc6,Ollie North just follows wherever the money takes him These people that end up on Fox News dont actually have beliefs they stick to like talking about Covid vaccine doubts on their shows while being one of the first to have been vaccinated,_pls_respond,16329410520,0
gv9vssp,mv1oik,I was warned by an insider that one of the coming problems is with meat we will be unable to eat meat for some reason and we will be forced to become vegetarian [COVID-19 MRNA "Vaccines" Can Cause Prion Disease Resulting in Neurological Degenerative Diseases Spike Protein Could Be Receptor For More Infectious Agent COVID-19 & the "Vaccines" May Be Bioweapon & Gates Involvement | Z3 News](https://z3newscom/w/covid19-mrna-jab-prion-disease-spike-protein-setting-vaccinated-virus/) But it wasnt the meat it was the "vaccine",TheREALRossman,16189680680,-1
gwgjtjq,n1sfuh,Wars are beneficial to the government and even then they had things like war bonds and people dealt with being behind on paychecks because the country was at war This pandemic is supporting the corporations and they sure as hell are not going to be giving money away to the government I cant really say the government is profiting from this as they are taking the initiative for the vaccines and the covid checks and unemployment Its really just the corporations who are the profiteers and who have they helped ah yes themselves,Twincarbine,16198099760,1
hlbvrsg,qxp41y,Too focused on Black Friday Deals Vaccines for age 5 - 11 boosters approval Austrian revolution Thanksgiving plans and NASA crashing into a meteoroid,_DarkJak_,16373695710,1
gv3dypq,mu01bz,Just curious but if the sub has as many bots and shills as suggested; why are these posts still in the positives? It seems like it only matters when they oppose your individual stigmas or beliefs I mean look I dont trust big pharm for one Which is mainly why I am not taking the vaccine But Im also not going out there trying to save people over a virus with over 05% survival rate If they want to put a mask on and social distanceisnt that their choice? Just like it is our own choice to live without it?,Fireba11jutsu,16188475320,1
h0fce74,nqukms,The most insulting thing was that the Wuhan leak theory was the occams razor explanation from the very beginning Gee this virus leaked from a location that just so happens to have an institute of virology where theyre studying that virus? Must be people eating bats from a wet market Those uncivilized Chinese they do things like that On top of that there will be no vindication I was blocked and banned from so many subreddits for merely suggesting this It couldnt have been correct because Trump backed it and we all know hes a nazi and Hitler reincarnate Can I be unbanned? Nah I was just banned from both r/drugs and r/nba for daring to suggest (with proof) that the CDC is obscuring vaccine death tolls for no good reason other than to "not scare people off of getting vaccinated" Reddit is one of the best places for social discourse in the modern age and the way this site is being policed to aid a dishonest partisan agenda is nothing short of criminal In fact Id go as far as to say its evil These sites need to be seen as human rights and while Im not in favor of government control they need to be checked *somehow*,S3gul3h_Se7enth,16227188720,3
h0dqqxe,nqukms,And yeah Im sure that the other things like the vaccine is the safest ever! And the election was the most secure ever! Are also true,FlappinJacks486,16226803040,1
h0dhmr8,nqukms,Shut up and take your vaccine pleb,Dspsblyuth,16226758020,0
h0djrhx,nqukms,The thing is covid isnt the only thing they have lied about its been continual lies for over a 100 years about a multitude of things I honestly dont know how people have one ounce of faith in anything you are told The best advice is believe none of what you hear and only half of what you see and for Gods sake do your own research especially especially especially before you go sticking an experimental vaccine in your arm!,marcb7658,16226768380,-1
h0enw0c,nqukms,My nurse told me it was definitely a bio weapon gone loose lol I was like fuck Im still scared to get the vaccine tho,ThirdEyeSlime777,16226984120,0
h8940pb,p0j98z,Dude ontario is straight up [pushing](https://wwwredditcom/r/ontario/comments/p0ac1h/guys_please_go_get_the_vaccine/?utm_source=share&utm_medium=ios_app&utm_name=iossmf) for the vaccine lol,rawnaldo,16284849580,1
h87wnfc,p0j98z,Some random anti-vaccine actress died today too strange stuff Im getting big Joan Rivers vibes,HoonCranker22,16284614200,-2
h89o3jm,p0j98z,What if conspiracies were used to control people and keep them afraid so they could purposely orchestrate disastrous events (pandemic) to keep their citizens ignorant and dependent on them and thats one of the reasons mental illness has been rising? lol Perfect case is Plandemic Now look at whats happening a year later The people who believed in Plandemic caused the issue to become worse and now next month looks pretty horrific given the numbers All the vaccine conspiracies and mask Thats causing a lot of people to die Right now All the virus conspiracies So many virus conspiracies saying its real and pointing the finger at somebody or its fake news What good does any of that do? What good does saying a foreign country did it or its some coordinated effort or its fake news? None of that matters Its here and were fucked and need to deal with it Why is it so hard to understand for people?,xynapse,16285018590,0
hba2eeb,pfz4xc,Big pharm is making billions off of these vaccines Im pretty sure they have a few dollars to pay YouTube Reddit Instagram etc to silence any opposition,_forum_mod,16305580940,9
hb7tsgo,pfz4xc,Looks like they didnt like the bad press Mainstream media once again cheering on the censorship of anyone who challenges their hegemony over the distribution of information Reddit communities go dark in protest over Covid misinformation: Some of sites largest subreddits switch to private saying Reddit is failing to tackle misinformation: https://wwwtheguardiancom/technology/2021/sep/01/reddit-communities-go-dark-in-protest-over-covid-misinformation Reddits teach-the-controversy stance on COVID vaccines sparks wider protest: PokemonGo Futurology among big subreddits going private until Reddit takes action: https://arstechnicacom/tech-policy/2021/08/reddits-teach-the-controversy-stance-on-covid-vaccines-sparks-wider-protest/ Reddit Forums Are Going Dark to Protest the Platforms Antivax Tolerance: After Reddits CEO demurred on taking misinfo-laden communities down Redditors are taking things into their own hands: https://gizmodocom/reddit-forums-are-going-dark-to-protest-the-platforms-a-1847597530 Pokemon Go Forum Goes Dark to Protest Reddits COVID-19 Misinformation Problem: The subreddit r/pokemongo and r/startrek are demanding Reddit ban and rein in other forums thatve allegedly been spreading misinformation about COVID-19 and the vaccines: https://wwwpcmagcom/news/pokemon-go-forum-goes-dark-to-protest-reddits-covid-19-misinformation-problem Dozens Of Subreddits Go Private To Protest Reddits Covid Disinformation Policy : https://wwwforbescom/sites/carlieporterfield/2021/08/30/dozens-of-subreddits-go-private-to-protest-reddits-covid-disinformation-policy/ After Reddit refuses demands for crackdown dozens of subreddits go dark to protest COVID disinformation: Protest follows a mass unheeded plea for Reddit to ban those who spread false information about the virus: https://wwwdailydotcom/debug/subreddits-private-protest-covid-disinformation-reddit/ 135 subreddits are going dark to protest Reddits refusal to ban Covid disinformation: https://wwwbusinessinsidercoza/135-subreddits-go-dark-to-protest-inaction-on-covid-disinformation-2021-9 Dozens of Reddit Communities Go Dark to Protest COVID-19 Misinformation: https://wwwthedailybeastcom/dozens-of-reddit-communities-go-dark-to-protest-covid-19-misinformation,_Living_Tribunal_,16305203240,22
hb7zwlv,pfz4xc,Yea i posted about my mom dying two weeks after the vaccine and they deleted the whole subreddit Theyre scared of truth and the consequences of their actions,Critical-Emphasis-92,16305228400,13
hbasxsx,pfz4xc,I Will Never Get The Vaccine,Wumbolo83,16305792260,9
hb8wonl,pfz4xc,If NNN was banned for spreading misinformation this would imply that science on the covid vaccines is settled but how can science on the covid vaccines be settled in such a short period of time? Imagine if after several months of developing the polio vaccine it was officially announced that the science behind the polio vaccine was settled and we will stifle your voice for daring to question it What happens when the covid vaccine narrative begins to unravel do they go back and unban these subs? Also if other subreddits go dark to protest the existence of the more controversial covid subs who really cares? Let them go dark,rivensdale_17,16305371580,4
hb8g2w1,pfz4xc,That subreddit was tame as hell too I subbed after the quarantine and never saw anything wild Just lots of people saying they dont feel comfortable taking a vaccine they feel they dont need,Teh_Jews,16305293960,5
hb81ykt,pfz4xc,Lol their members made a fake sub pedophiles to make it seem like they were right about abstaining from the vaccine Stirred up a bunch of drama and got themselves deleted,Chad_Radswell,16305236830,3
hb82oz3,pfz4xc,Its because Canada just officially rolled out its vaccine passport program and they dont want people talking about it,El_Tigrex,16305239830,2
hb8v9e9,pfz4xc,Seems like they newly invented this word "covid denialism" How about "vaccine side effect denialism"?,authenticbrainfart,16305364580,2
hb8d9r1,pfz4xc,What if they are right about vaccines and later we find that out? Every covid vaccine death (13627 so far according to VAERS) should weigh on the mods,WWEtrump,16305282450,3
hb8i6yw,pfz4xc,To be fair NNN got a little out of hand the past few months I joined about 8 months ago and it was mostly anti-lockdown anti-vaccine mandate content and posts questioning the origins of COVID Once it got more popular the top posts were increasingly factually incorrect Im not talking about "Facebook flags your post"misinformation im talking about easily verifiable incorrect or downright fake information The mods of this sub should take note and crack down on some of the ridiculous Facebook meme crap that so often gets voted to the top here,jay2243,16305303110,-2
hb8kxr6,pfz4xc,Look fellas This isnt censoring free speech what this sub is really isnt free speech its essentially "shouting fire in a crowded theater" there are like maybe 100 doctors in the world speaking out against vaccines where there are hundreds of thousands that says its safe There is nothing in the constitution that gives people the right to spread disease People are lucky that the vaccine is optional even if you lose your rights to do some things thats a personal choice People were held down and forcefully given the small pox vaccines by soldiers so be thankful youre given a choice,metallicadad420,16305315420,-5
hb892ay,pfz4xc,I was against getting the vaccine but now that Reddit banned r/NoNewNormal I think Ill follow the science now and schedule my appointment,IRIEVIBRATIONS,16305265500,1
hb91m97,pfz4xc,Reddit said that they banned that sub for brigading and not for spreading QAnon bullshit and anti-vaxx garbage It looks like as long as this sub continues not to brigade Reddit doesnt give a shit if the MAQAs container to circlejerk here with low quality posts sharing low quality misinformation about vaccines and other things Its too bad because it would be nice to get this sub back from the MAQA crowd that only showed up because everywhere else banned their lazy Qspiracies and braindead anti-vaxx garbage,nerdcorenerd,16305396590,-3
hb8imjb,pfz4xc,Fuckem r/conspiracy you are next Trump tried\* to steal the election Vaccines work Covid is real,Wilesch,16305305030,-6
h9c65ge,p6383r,Trump was allowed to spew his dangerous anti science anti vaccine capitol hill rioting nonsense for his entire presidency They kicked him off right at the end They should also boot Taliban off,scrotimus-maximus,16292360550,-1
h9dm0u3,p6383r,Yet if u dont say u love the vaccine you get terminated for life  ummmmm,Jessica_lowel,16292634970,1
h9cro0h,p6383r,Reading this dudes tweets & I kind of want to move to Afghanistan Doesnt sound like theyre mandating vaccines over there,CanadianMapleBacon,16292464540,0
h1qdgrf,nzlzfq,Youre absolutely right but its a much more extensive issue that your post taps into: namely the way that the environmental movement (and all of the various environmental groups like Greenpeace) was hijacked by corporations to push the global warming narrative which has completely overshadowed every other environmental issue for activists and which pins the blame on workers and lower classes and lets the corporations escape blame justice or all responsibility for cleaning up the damage they have done to the planet It started with the Thatcher government in the UK she deliberately funded research to prove carbon emissions had a negative impact so that she could break the backs of the coal miners who were striking It was a deliberate strategy to completely destroy organized labour and it worked and her counterpart in USA Ronnie Ray-Gun was busy doing the same thing dismantling any corporate controls and regulations while simultaneously destroying organized labour Both were agents of the new corporate tyranny The Gilets Jaunes movement in France encapsulates this perfectly: how its a class issue and how the global warming legislation hurts working class people Environmental Activists used to protest major corporations and financial institutions and government institutions nuclear power plant protests factory farms oil refineries hijacking pipelines etc but what happened with this psyop is that the shift led to the faux activism of Greta and Extinction Rebellion (which again attacks working class people by blocking them from going to work etc) which mostly replaced and distracted from the real issues The entire debate has been reframed with "deniers" on one side and on the other side if you care about the environment then you affirm the official narrative and therefore agree with the laws Both sides are incorrect because the entire framing is incorrect The way I approach it is I simply focus on the more existential and urgent environmental issues like microplastics in every living being on the plant for instance and 99% of the time these are the direct result of multinational corporations So take the environmental position but just sidestep the framing and address the real issues: nobody can attack you for actually caring about the environment and instead of getting distracted by entangling yourself in the pro or con global warming game just step back and realize its a psyop People are being pushed to fear something that isnt concretely evident to them a narrative that isnt intuitive (the idea that carbon which is necessary for plants is dangerous and an existential threat -- which by the way Im neither affirming nor denying Im simply stating that you cant see it with your own eyes so it becomes a "trust the experts" issue) while the things that are concretely evident like plastic pollution are being demoted to the bottom of the concern list But people can see with their own eyes the way that giant corporations are destroying the planet The evidence is overwhelming Now the next step is to realize that this exact same formula and process applies to every other major issue from war to immigration Start with the shift from class to race/ identity: From 2008-10 there was mass mobilization of workers and activism focused on class (the 99% vs the 1%) where the masses were joining together and attacking wallstreet and giant corporations So again we see the exact same pattern: the Occupy movement being hijacked and overshadowed by BLM and LGBTQ identity politics and also the exact same formula applies to the Covid-19 narrative and the risks and dangers of the virus and also the vaccine The MO is the same (and it also happened in the 60s with COINTELPRO) Its crystal clear once you put it together Chomskys Manufacturing Consent outlines the Modus Operandi for all of these propaganda and psyop campaigns pushed through by corporate media,FruitFlavor12,16236799210,53
h7lyhoe,ox6zut,He also says "I dont know who needs to hear this but Polio and smallpox never reached natural herd immunity They were eradicated by vaccines" https://twittercom/mhdksafa/status/1416406454857342976?s=21,takethecann0lis,16280305430,1
