i0zezv3,tg0kom,I posted this almost a year ago and have kept copying and pasting it because a lot of it has come true since then Ill warn you its long though This is a copy from another post but lines up the events of history that are being copied right now And why so many *Financial Issues* are being disguised (such as climate issues or pandemic issues) But a lot of this has happened before and is being full-on copied from other time periods and how even blackrock (the single largest hedge fund and called "The Fourth Branch of the US Government by Forbes and Bloomberg) [wrote the entire financial blueprint of what was going to happen before covid even started back in August 2019](https://wwwblackrockcom/corporate/literature/whitepaper/bii-macro-perspectives-august-2019pdf) Were seeing a complete system change why we needed to pump out a ton of money (literally 40% of all Dollars in existence were created in the last year) and why we need a WORLDWIDE unique Identification system tied to single individuals and a unique ID (a passport that is financial in its requirement but right now is being pushed through medical global requirements) Corona is a financial issue disguised as a pandemic issue because it can circumvent local laws and force the wordlwide laws Climate change is a financial issue being disguised as an ecosystem issue because again those laws are "bigger" than local laws and can circumvent normal procedures ----- We know "follow the money" to be the oldest and truest sense of deducing whats going on One of the things that stands out is that this event is following exactly the same events of the 20s and 70s Both times marked by huge inflation both times marked by a currency change and a new system and both times marked by a war that took place to get rid of the old system and expand the system while countries are hit hard by inflation But they all follow the same play ook = a massive amount of money was printed out and a certain assets price was then crashed that people were holding onto In the 20s-30s the asset was gold (whos price skyrocketed as money was printed and then crashed right before a market crash) and now with crypto currency (bitcoin was $7200 in january 2020 and got up to $60000 before crashing down to $32000 and flying back up to $65000 again and will probably crash even further once again before the final drop before it raises to crazy levels in ten years) In the case of gold the conspiracy is that two men formed a group and tried to corner the market and then the US released all its gold shares to crash that market and everyone sold their gold the US then used that price to buy gold from people and then backed the dollar with gold and even made owning it illegal alsoone of those two men who tried cornering the market was the Presidents brother in law so it was clearly a setup and a lot of people lost money but the US gained a lot of gold at cheaper prices right before switching the currency to be backed by gold So it was all about currency So why is the same thing happening again? August was the 50th year anniversary of Nixon ending the gold backed dollar in the 70s and starting the petro backed dollar So what does the end of the currency look like? Remember I said there was a crash for gold because the US released all its stores and crashed the market? Well guess [who owns the most bitcoin](https://wwwwiredcom/2013/12/fbi-wallet/)? Well for starters everyone will need a personal wallet (hence a vaccine passport for tracking is going to come sooner or later but this is the best excuse) The current chair of the SEC (Gary Gensler) who was installed in April taught a class about crypto currency at MIT Sloane (which is an enlightening resource if you want to see how officials view crypto currencies) He even talks about bitcoin finishing a 10 year testing phase and how it survived {what does that even mean? I thought Satoshi Nakamoto was an anonymous person I thought crypto was all about a decentralized financial platform and yet the current head of the SEC says it survived a testing phase?} So what else do we know signifies the end of the petro dollar? Weve all seen how much climate change pops up Well plastics are part of the oil system and thats part of the end too is my guess I know people think its an environmental factor for climate change but we all know that the biggest changes arent happening (a very tiny percentage accounts for the most pollutants but nothing is done about those) But following the money its clear that climate change is a financial issue disguised as an environmental issue This is extremely clear because two separate Senate and house committees met with banks in May about climate changewhy would they meet with banks instead of oil companies or manufacturers? Again the evidence points to a financial issue disguised as an environmental issue But theyre pushing us simply to change what system we consume while avoiding the largest climate change pollutants And even ending the oil system next is energy sourcingwell enter in Afghanistan popping up again and the Taliban/ISIS (which is where the largest lithium deposit is) But the key point is that we will move off of seaparate working grids (because even if you steal gasoline it still works on your vehicle) onto one grid that uses unique identification (which electrical vehicles already do but again is part of the movement away from the machine driven system and into the computer/tracking system) And what about the old infrastructure? Have you noticed how all those hacking attacks kept happening to old infrastructure key points? And the hackers keep asking other countries for huge amount of bitcoin? Have you noticed how war keeps popping up involving all those countries on the old system? Must be a complete coincidence Im sure But well know for sure this is the case if the market crashes soon Hyperinflation is close and technically happening but the FED refuses to acknowledge it (crazy how we dont vote for the FED president and yet they control the entire economy) Weve now had the largest 12 month increase in inflation since 1983 The CPI has changed over and over how inflation is measured true inflation is estimated anywhere from 13% - 25% (but you already know that and likely got your rent hiked already up 20% year-over-year) Thats what happened in the 30s right as they switched to a new backing for the dollar (with Gold) and were seeing all the signs present now that this is true If were about to end the machine driven age and start the computer driven stage then we would each need a unique wallet address and a passport can accompany that It would be the easiest way to install worldwide tracking (since crypto provides a ledger for everything) Also well know bitcoin prices will shoot through the roof after a crash if all this is true and happens Either way this ties corona (an excuse for mass printing of money) the vaccine (more money and a unique wallet tied to ID) end of petro dollar and machine age (climate change is a financial issue disguised as an environmental issue end of plastics from oil) end of the retail to stores system and move to full digital marketplace the beginning of the crypto dollar and crashing the crypto markets (already happened but still can drop much farther along with the rest of the market similar to exact same scenarios in the past) Were entering into the most tracked age of all time everything on the planet will be tracked back to unique ids and monitored on a blockchain/verified by a computer "The Great Reset" might sound like a conspiracy meme but thats an awful lot of coordination to happen in a short period of time Even better since I wrote this the IMF and 10 countries got together in Israel and [Simulated a Cyber Attack that would shut down the Global Financial System](https://financeyahoocom/news/exclusive-imf-10-countries-simulate-133015124html) Im sure thats just a coincidence too! Im sure once it happens everyone will be shocked and demand answersthat they already have Its coming my guess is at the start of Bidens second term since thats when they did it with Nixon Ill keep writing this and if Im wrong I will stop but weve been checking off each point from that paper by Blackrock ever since corona started Every company put money back into their company and was given a massive amount with the PPP loans and every country matched financial and monetary policies and was given massive amounts of money during corona Soif the market started showing signs of a massive failure in 2019 and this paper was put out in August 2019 and weve followed every item line by line of this outline since then and it came before coronathen what does that say about corona This was the single largest robbery in history and unless you are in the 1% then you are going to be the one paying for it You paid for it not just with two full years of your life hearing about this you didnt just pay by having communities torn apart or having to hear people argue about things that arent the actual problem you didnt just pay for it by having to actually stay in solitary confinement that includes the ability to watch your phone and the internetyou literally are going to actually pay for the rest of your life with the inflation costs and debt Well see if this is rightbut weve already checked off most the points from that paper The rich got so insanely rich since this happened It was literally the best year for Wall Street but how was it for most people?,garthsworld,16474938020,2
h26qui0,o2bv1j,Pro vaccine people would say no connection,ivanm1991,16240029700,1
h27or5f,o2bv1j,COVID/Vaccine Profiteering while depopulating impoverished countries Gates "20 to 1 return on vaccine funding research "isnt so bad" re: an interview Back in March-April 2020 hedge funds were "sloshing" futures indices-painting the tape Lots of whipsaw spreads trends I tracked this and filed a compliant to SEC with data evidence Response: Thank you Will use in our education classes,Formal-Raise1260,16240264510,1
h27wp9l,o2bv1j,I like how the great reset went from being mud floods to other catastrophic events to the virus to the vaccine and now its the wealth transfer,Akhanyatin,16240300460,0
gwcbjkq,n13x8h,The video footage they released of him committing suicide was completely fake if you count the number of bars on the window (permanent steel grating bars embedded in concrete) there are more bars in the "suicide video" than there are in images of Epsteins actual cell meaning the video was created elsewhere and someone slipped / didnt think anyone would actually take the time to count the number of permanent bars on the window This was pointed out here on r/collapse maybe 6 months ago or so Think about it as wealthy and connected as Epstein was you think he committed suicide? No they most definitely sprung him and hes probably in some vast subterranean facility where all the "elites" are going once vaccines become mandatory and people realize that they are being killed off en masse and a belated armed rebellion is mounted,Aggressive-Hair9522,16197282370,2
gwaxazv,n13x8h,And i know its off topic but these are the same people that wants us to take a vaccine Like you couldnt keep one person alive but im suppose to trust a vaccine that could have an immediate or delayed reaction Why should i have faith with anything our government does?,CableClassic8333,16197084320,1
h2wo3xf,o707u9,Yup Like the vaccine situation No one has consented no one can consent because we are not allowed to be informed,0701191109110519,16245556910,1
h2xlzke,o707u9,That was exactly my response when people asked me if they should get the vaccine: how the fuck would I know because I dont have any information that is real On another note I hope he is sunning himself on a beach somewhere now,MsKim,16245754190,1
hwrvtxa,srhaii,Its a miracle I survived without the vaccine but somehow I did These comments really infuriate the dumb asses who got it,Reasonable-Heart1539,16447583230,15
hwsmp13,srhaii,Never tested never wore a mask & will never take the fake vaccines willingly The wheels are coming off the narrative or so it seems but this is planned just read the SPARS " war game " scenario I hope people are becoming more aware to the FACT that were dealing with Occultist freaks,Moonoid1916,16447707070,3
hwtblqb,srhaii,Covid is nothing more than a flu to those without comorbidity issues Protection for those people with secondary issues is the only protection we should be concerned with I was sick for a week and had a chance to let my body build a natural immunity instead of pumping an unverified gene therapy into my system The "vaccine" has killed as many if not more than covid,Mammoth-Possession19,16447805360,3
hws5mdy,srhaii,Someone forgot to send me a memo that I was supposed to die when I caught the rona When I caught the rona back in January of this year I felt ill for 2 days and felt better on the 3rd day I did lose my sense of smell and taste for 1 week and now I got those back Literally felt like it was a mild flu Oh by the way Im unvaccinated They can shove their vaccine up there asses for all I care,MarriedCpl,16447634350,5
hwtcky3,srhaii,Unvaxxed and fine here I hadnt even encountered anyone who claimed to have had covid until recently and they said the vaccine was worse for them than the disease Personally Im of the opinion covid was probably real but now they are just claiming every new flu is a new strain and trying to keep it going through any fear they can Im not sure why exactly but its like most things probably just money,balancethescales,16447809230,2
hwthwgn,srhaii,Fuck the vaccine its nothing but poison,killuminati777,16447830290,2
hwvyr6r,srhaii,Yeah dude I refused to get vaccinated and am currently dead I wish so bad I took that vaccine to save myself others and all the grandmas in the world :( what are long term side effects and why the fuck should I care about them? I look forward to seeing all the highly positive results in 75 years when Pfizer releases them #justgetvaccinatedanddontaskquestions,PsychoKnot13,16448270970,2
hwsahos,srhaii,Never wore a mask never social distanced never locked down never got sick and no vaccine Walking fucking miracle here,Kirby_hill8245,16447656310,4
hws0rv1,srhaii,Aint nothing like a good threat from the government Way to protect all the people including the ones who dont want to be lab rats I am flabbergasted that anyone who isnt in the highest risk category took the vaccine There are so many other mitigation efforts that dont include taking an unfounded vaccine,Jadedhesitancycookie,16447610710,2
hws9og0,srhaii,My entire extended family is healthy and motivated The only one who has any problems is the one person that decided to be a contrarian He has heart problems now Hes sorry and thanked me for warning him and we have a doctor that specializes in vaccine injury Shes booked full and going to make a fortune,Teletimeflexrelic,16447652680,1
hwsp84t,srhaii,Hi yes I died from the rona Dont be like me kids Remember to wear your masks and take your vaccine Thanks,TiredOfTheLies69,16447717180,1
hwszt15,srhaii,Was at parliament with the truckers in Ottawa Im vaccine hesitant and we were all running around outside without masks on for two weeks According to the science Im dead and this is my ghost typing right now,jackspratt88,16447758940,1
hws28sv,srhaii,Alive and the family also no one got covid in my family only my father after the third vaccine,EconomyLife3978,16447618240,1
hws5ts1,srhaii,Still good no mask no vaccine still havent gotten covid,odo_0,16447635320,1
hwsgbeo,srhaii,I regrettably suffered an extended period of extreme illness followed by my death I wish I had gotten the vaccine!,nothingspecialrealy,16447681030,1
hwso06l,srhaii,100% alive inside and out! Im not letting this climate of fear stop me from enjoying my life absolutely not! Life is precious and an incredible undertaking Last year my new doctor kept trying to encourage me to take that shot and almost succeeded that is until towards the end of our visit she told me the shot might make me bleed thats when I said hold up *why* would a vaccine make me bleed? Luckily Im very perceptive when it comes to bullshit and my doctor stutter some reply that just didnt add up she said something like "its just going to effect your entire immune system" Im not a doctor but her reply just sounded so made up on the spot plus it didnt make any sense at all I was talking to my friend yesterday telling her that what helps me is sun medicine I get out into nature every day and enjoy the sunshine/nature Im happily alive and unvaxxed Dont let them kill your spirit!,gianttigerrebellion,16447712330,1
hwt0d4x,srhaii,:( im trying to mentally prepare myself for when the triple jabbed get crippling diseases and require tons of medical resources The world will be very upset when the vaccine veil is lifted for everyone,CosmicPhoton,16447761140,1
hwt4694,srhaii,Less than 05% death rate for majority of people on Reddit Its a pandemic of elderly Merely an annoyance for younger population If the clot shot vaccines prevented transmission then there is room for debate Anyone under the age of 60 (or with relevant Illnesses) to receive these shots is was and will continue to be a complete waste of tax payers money resource health and in some cases death,Recaldental,16447776110,1
hwt8cs7,srhaii,You should take the vaccine he was rightIm currently dead,duceduce23,16447792540,1
hwt8g16,srhaii,Recovering cancer patient w/ low immunity over here never even got a cold this winter which was surprising The stress and hardships our bullying ass politicians put on me will kill me long before COVID or their poison ass vaccine will,Connect_Narwhal_7100,16447792900,1
hwtkxpg,srhaii,Also just checking my fellow vaccinated citizens are we still Alive or did we drop dead from the vaccine already?,KoncepTs,16447842490,1
hwtsxbt,srhaii,Im here loud and proud I later had to take 2 vaccines to continue to work if I wanted to keep my job This is where the world is going No ones dying from covid its all a hoax Stand up fir your rights people!!! This is the end,victornowak,16447874220,1
hwu7a0d,srhaii,I died in a hospital bed on a ventilator My last words were "if I just got that fucking vaccine",lancethruster12,16447934510,1
hwuazo5,srhaii,Im dead inside does that count? But yeah it was all bullshit scare tactics I got the Shanghai Shivers no vaccine either now I have antibodies T cell immunity pretty much for the rest of my life in addition to the prophylactic measures I take,AlBundyIsMyHero666,16447951020,1
hwuf0gq,srhaii,They told me the COVID vaccine saves lives but I didnt listen Died horribly when I was pursued by a psychotic murderer and tried taking refuge in a hospital lobby only to be turned away based on vaccination status Stabbed 72 times in the street and no one saved me because I was a plague rat I got better though,vonHakkenslasch,16447969060,1
hwv3qyb,srhaii,I find it abhorrent that they would actually say this on a government website I know people who have died from covid without a vaccine sure but Im afraid that illness is apart of life Why are they trying to segregate us,Leather_Tea3147,16448077870,1
hwvn4yc,srhaii,Is the vaccine effective against Nuclear Winter?,jefe4959,16448183580,1
hwvoeph,srhaii,This wont age very well when all the vaccinated people are suffering from vaccine enhanced diseases in a few years,baby-einstein,16448192130,1
hyyzgna,srhaii,Isnt there hiv in the vaccines ?,AdvisorReasonable718,16461738600,1
i0djvn3,srhaii,Vaccines work,BamBamAnotherThinMan,16470983130,1
hv0myu2,sh2zq9,Unfortunately its primarily just conservatives who are burning books and /r/conspiracy is far more of a conservative/trump/antivaccine sub than an actually conspiracy sub these days The sub has seriously declined its barely even has any conspiracies anymore,Popular_Ad4115,16436500290,23
hv1ifjq,sh2zq9,So what i see are comments like "this sub is a far right echo camber" which gets heavily upvoted which contradicts that claim No nuance when it comes to "bans" some are just not mandetory readed while others get removed from libary Reinforing the "its all antivaxx now" when the term antivaxx is a propaganda term pushed by corperate media Everyone long enough in this sub has seen the massive corruption and change of narratives and the narrative control around this vaccines Republicans will not be the solution even if they now push hard that they are the party of freedom I think the left made a big mistake letting all critique on bigpharma for the right the right will probably get the majority in the upcoming years simply for this But also because they stand against the woke agenda They use a few videos of woke teachers to portrai that most teachers are like this (And please dont defend the woke agenda its a rascist and sexist worldview and keeps the worklingclass divided) The best explanation i read is that everything that happens now is the beginning of the end of the us empire Massive focus on identity gender race rejection of any traditional moral views the massive problems with the currency All this happened to previous empires before their fall But its a long process it can easily go for 50years,nelbar,16436617050,8
hv0k8tc,sh2zq9,I had this conversation/discussion a few weeks back I asked the question of how is it allowable that a public library or a public school could ban books? They are arms of the state and therefor the first amendment applies to them It should be grossly unconstitutional for them to be allowed to ban *any* books I was met with "well you dont want a fourth grader reading 50 shades right? Some books are inappropriate" And yes I agree some books are inappropriate Except that I believe if a teacher can turn a book into a learning experience why should we just ban that book? I get a lot of it is based on religion and the conservative based of these areas But that doesnt make it right Banning books is no better than mandating vaccines,WhatTheNothingWorks,16436490330,4
hv2b2ir,sh2zq9,Because this sub is all obsessed with the vaccine It is seriously every single post No other conspiracy matters,joegoodfart10,16436730220,0
h101c0c,nuw9cw,Go back a few comments in my history and see me catch dozens of downvotes for saying that we should be upset with the government for the way the pandemic was handled instead of screaming at people who want to get vaccines or calling the cops on our neighbors because they had a friend over for dinner [link](https://wwwredditcom/r/ottawa/comments/nuh8p8/i_knew_one_of_the_2_covid_deaths_from_yesterday/h0ya17g?utm_medium=android_app&utm_source=share&context=3),Dirtymikeandtheboyz1,16231306290,19
h10fyed,nuw9cw,Same shit is happening with vaccine vs non Vax I dont want to get the jab and meanwhile my family peer pressure me to get it,LGAMER3412,16231436470,1
h55ckwp,ojrh7c,Guys guys It was about vaccines Minister Psaki said so,Soy_based_socialism,16262666410,1
h53wcbn,ojrh7c,So sad and disturbing to read this and realize our own US government is doing just that in order to promote the pandemic and vaccine scam,luvtolearn13,16262278850,0
h547i4v,ojrh7c,At the same time in Canada I saw mainstream media reports of the protest saying with a straight face that the cubans were protesting to get the vaccine and more COVID measures With the social networks down its much harder for common people around the world to get the truth,jelsaispas,16262342300,0
hyt53x3,t3gua0,A two day old war in Europe is bigger news than a 2 year old pandemic? Im so shocked! Please last month most of you were saying this would go on forever and that vaccine passports were the future Wrong Last year the pandemic was going to end as soon as a dem was elected Wrong,didsomebodysaymyname,16460731580,12
hyu0672,t3gua0,A month ago we had around 900k new cases! With around 800k a week avg Today? Only 9k Also theyre now telling us COVID vaccine was basically useless for kids age 5-11 Good thing they really pushed that Source: Type COVID in Google and play with the graph,Brandle34,16460851440,6
hql60jd,rs1onc,I think that a pretty good deal of them are the same people running our government both in the public eye and behind the scenes the same people trying to force this vaccine on us the same people who want our guns and the same people pitting us against one another on any number of issues,Just-STFU,16408943980,4
gw6iow2,n0evko,I dont give 2 shits about what a president says they aALL lie I care about what he does Trump presided over the greatest economy this country has ever known He had the lowest unemployment numbers across the board for every demographic except white men There were at least 4-7 million people that came off of welfare during his tenure He signed a tax cut that benefitted over 90% of the population that actually pays taxes He had illegal immigration to a trickle He had China on its heels and finally paying their share on imports and exports North Korea wasnt testing bombs Iran wasnt talking shit Put programs in place like operation warp speed to get a vaccine developed and to the public in less than a year which is unheard of And much more And were talking about a guy with 0 years of politics In comparison Biden who has been in politics for well over 40 years and what has he done besides grope kids in front of their fucking parents and smell womens hair oh and pretty much coerce Ukraine into firing a prosecutor that was investigating his fucking pedophile crackhead sons employment in an industry he had no knowledge of in a country he knows nothing about And dont forget to give "the big guy" his cutya know ;-) And theres people out there that really think that senile old fuck got 80 million votes,LordClaranceMcDonald,16196230910,1
