gw940sx,n0evko,fbi got search warrants for Guiliani cuz he was orange man bads lawyer but where is the tech for the kids nobody is talkin about trafficking just climate control and a suspect vaccine they got the nerve to blame us for climate change jim caviezel called em out he said adrenochrome and child trafficking is in fact real you feel otherwise God is keeping score not me i said what i said meant every word any law enforcement reading feel offended catch me in traffic,Grizzl6,16196645830,1
hmj0dvo,r45a5n,Theres many more like her as mods on Reddit Literally have been banned from like 4 or 5 subreddits all because I dare say something negative about their genetic altering frankenvaccines,tjcloutier3,16381918280,7
hmgz8vy,r45a5n,This is the shit I like to read about not the same regurgitated "I will not take the vaccine" shit,MiQueso_SuQueso,16381468250,15
i0dh7v1,tcdedn,The same way it offends people that a good chunk of the population doesnt feel the need to get the vaccine when their immune system is in good health,Thatgirlisamystery,16470970690,0
hygx0cq,t13g2q,So r/conspiracy went from 99% Covid and vaccines to the Ukraine- Russia staged conflict/diversion tactic overnight LOL Theres a sucker born every minute,sky5878,16458453800,3
hyftv9g,t13g2q,Oh my god get out of here with the WEF propaganda The guys an actor His entire rise to power was propped up by the WEF and I dont know the deep details of whats going on but I know this: Theres more to whats happening right now than what appears on the surface And also -- the way the entire system is pro-Ukraine right now is suspicious because this is the same system that brought us pointless wars in the past corrupt bank bailouts 30 trillion in debt with an ever widening gap between rich and poor and two years of Covid-restriction and forced-vaccine nonsense So if theyre pro-Ukraine then I have to say "slow down because these arent good people" Im sure there are two sides to the story as to whats really going on and --- Im also sure Zelensky isnt going to be in combat Show me a photo of him when hes been injured in war Blood limbs blown off Deaf from bomb blasts Or lost his mind from PTSD near death experiences and seeing all his friends die No thats not going to happen because this photo is just propaganda,JunkyardSam,16458276360,2
hhi9y41,qcsqbl,Naaaah couldnt possibly be because the ask Reddit rules specifically remove these types of question that are just a flip of the #1 question on the sub atm This is probably one of a few dozen that got deleted You shouldnt have to try this hard to be a victim get your vaccine and trun r/conspiracy back into posts about bigfoot,gingerking87,16348335450,-2
hhiiwty,qcsqbl,Couldnt have anything to do with you saying all Biden voters are pedophile supporters or you advocating for people getting fake vaccine cards to avoid mandates at all could it?,killeoso,16348370630,-5
gyh9su4,neivkb,There ALWAYS money for aircraft carriers vaccines and Israel,cjweisman,16212783800,30
h6705gu,opbmcz,Mainstream media vilify this hero now hes dead Mainstream media is vilifying non-participants in a non FDA approved vaccine,heirloom0691,16270015920,1
hw50y7c,snj9i6,The seatbelt analogy is perfect for demonstrating the fallacy of saying >"You can still catch it when vaccinated therefore the vaccine doesnt work and people shouldnt bother receiving a vaccine that does not work" This is of course a non sequitur In that it does not follow logically A similar non sequitur would be >"You can still die or be severely injured in a car while wearing a seatbelt therefore seatbelts dont work and people shouldnt bother using seatbelts that dont work" You can point out how vaccines arent seatbelts all day still doesnt change the fact that seatbelts are a good analogy to point out the fallacy in stating that since vaccines are not 100% effective they dont work and should be avoided for that reason Another good analogy if you dont like seatbelts is birth control Same analysis Condoms are not 100% effective so no one should bother using condoms Thanks for giving me an opportunity to point out that fallacy again,zensins,16443567850,3
hw5bes3,snj9i6,The main difference between seatbelts and the vaccines is seatbelts actually work,Shim-Shim13,16443607860,3
hw3nrl4,snj9i6,The seatbelt analogy was for masks Ive never seen someone refer to vaccines with it,xMasterMelonx,16443388840,6
hw37hzo,snj9i6,*B-b-b-but its akshuaully covid causing the blood clots and myocarditis! Nevermind the fact that we only saw this surge in myocarditis and blood clots after the vaccine rollout! If you dont believe me Ill call you a Russian nazi terrorist!*,silvercat90,16443326210,7
hw4ygq2,snj9i6,I broke my collar bone and bad shoulder from a seatbelt in a major accident And had the worst rug burn like rash youve ever seen These injuries were directly from the seatbelt Seatbelt do cause damage; but like vaccines they are worth it >Wearing seatbelts never has possible short term side effects like: blood clots myocarditis guillan barr neurological issues menstruation disorders and even death I had a short term effect of having a terrible pain from my seatbelt >Wearing seatbelts doesnt cause potential unknown long term side effects You can easily have long term effects My seatbelt did irreparable harm to my shoulder >If my seatbelt malfunctions and/or is faulty can hold the manufacturer liable Nope I got injured from it and it operated just as it was intended >can take off a seatbelt at a click of a button Nope as that accident happened there was no way I couldve just taken off my seatbelt >The seatbelt manufacturer and agency that approved seatbelts did not try to hide safety data for 75 years The safety data is out there >Seatbelt manufacturers have not been convicted and havent paid the largest criminal fines in history for fraud malpractice bribery etc Nope There was a fair bit of drama around seatbelts [See here](https://feeorg/articles/the-fraud-of-seat-belt-laws/) But just because there are allegations of bribery and scandal it does not mean theres anything wrong with the seatbelt itself,Cobmojo,16443558680,4
hw3hx9p,snj9i6,Where can I find data showing vaccines can cause menstruation disorders? Ive read that before but have also read that its just a hoax If anyone could drop a link to some info that would be well appreciated thanks in advance,infinitetekk,16443367180,2
hw3bw88,snj9i6,This is the correct seatbelt analogy: Worrying about someone who is not vaccinated is like worrying if the person in the car next to you is wearing their seatbelt If they slam into you it makes no difference to your safety if they have their seatbelt on Edit This applies to covid Not other vaccines that actually work for the real scary diseases You know,notphysically,16443344030,2
hw3dq29,snj9i6,Infringing upon citizens rights always (at least here in Canada) has to be the least infringement for the maximum amount of good Seatbelts are a great example of that It removes a minimal right- to drive without your body obstructed- while offering an incredibly effective safety feature And as you pointed out it can be removed with the click of a button The vaccine mandate is the exact opposite It removes a deeply fundamental right to medical consent It goes inside your body and cant be reversed And (especially now) we know it offers extremely limited protection in proportion to the rights it infringes,motherfailure,16443351180,2
hw3f3cc,snj9i6,You know its an analogy means its not the same like a vaccine It describes how many people can do a small procedure to save their own and others lifes,fr_nzi,16443356460,1
hw3a69m,snj9i6,>Wearing seatbelts never have possible short term side effects like: blood clots myocarditis guillan barr neurological issues menstruation disorders and even death >Wearing seatbelts doesnt cause potential unknown long term side effects It wouldnt be surprising if some particular freak accidents led to a seatbelt causing unnecessary injuries >If my seatbelt malfunctions and/or is faulty I can hold the manufacturer liable Im pretty sure you cant hold the manufacturer liable if the seatbelt operates as intended but the situation was such that the seatbelt caused the situation to be worse >I can take off a seatbelt at a click of a button Ok? >The seatbelt manufacturer and agency that approved seatbelts did not try to hide safety data for 75 years Neither did Pfizer The issue there is entirely a FOIA request directed at the FDA The request has fuck all to do with safety and far more to do with flooding the FDAs FOIA department with a request for hundreds of thousands of pages of documents Meanwhile have you read the paperrs [that Pfizer points out in this filing (page 2 and 3)?](https://phmptorg/wp-content/uploads/2022/01/041-Memorandum-in-Support-filed-by-Pfizer-Inc-re-40-MOTION-to-Intervene-for-a-Limited-Purposepdf) Theres a bunch of papers and presentations about the efficacy and safety of the vaccine there Have you or will you read any of them? >Seatbelt manufacturers have not been convicted and havent paid the largest criminal fines in history for fraud malpractice bribery etc You think auto manufacturers havent paid fines for criminal activity?,chowderbags,16443337170,-6
hw3jwr9,snj9i6,Careful not to over analyze analogies guys doing so completely misses the purpose of an analogy as an argumentative technique I mentioned this in some comments below but wanted to throw this out there because there seems to be some misunderstandings Analogies are NOT meant to be 1 to 1 comparisons; they are a form of comparison to shed light on a specific aspect of an argument in a different light Attacking an analogy without the context of how they are being used on specifics that arent relevant to the comparison doesnt defeat the analogy it just misses the point being conveyed in the first place The seatbelt analogy is not saying car safety and corona safety are the same thing The analogy is a response to arguments along the lines of "why do I need a mask if Im already vaxxed?" If you ignore this context and just attack the details of why seatbelts arent like masks/vaccines you have missed the point and are instead arguing against a point no one made A better argument would be something like a better analogy or an explanation as to why the analogy doesnt work For example: "seatbelts and airbags are great for a collision but not very helpful when your car gets rammed not lake Omicron" This is an actual argument against the analogy because it conveys the normalcy of overlapping safety measures the original analogy was pointing out is irrelevant when the safety measures are designed to protect against a different harm than what has occurred Dont lost in the weeds like OP about random stuff like how seatbelts dont cause long term health effects (an argument literally no one made thats irrelevant to efficacy of overlapping safety measures aka the point of the analogy) Instead focus on actually refuting point the analogy was making in the first place If you want to successfully attack an analogy you have to stick to the topic actually being analogized Otherwise youre totally missing the point and refuting the wrong argument,Popular_Ad4115,16443374590,1
hw3pejv,snj9i6,Had a coworker who wont wear a seatbelt He was once in a car accident and had great difficulting escaping his burning car due to the seatbelt Lets us do medicine versus vaccine instead All medicines have short-term effects including death All medicines can cause potential unknown and known long-term effects So should we stop taking medicine? If you decide to stop taking your medication you might get sick and die The true comparison is between dying of the vaccine negligible or dying of Covid 1% probability BTW the long-term side effect of living is death,stewartm0205,16443394840,1
hw4ufcb,snj9i6,Neither do the vaccines Covid however DOES cause all of those things The only thing you put to rest is your last brain cell ,militantleft,16443543980,1
hw521gt,snj9i6,I would literally just say you can take the seatbelt off If for any reason the seatbelt isnt comfortable doesnt fit or doesnt work correctly you can simply unclip it and its no longer a factor in your life Comparing *that* to a multiple round vaccine using freshly develop technology without long term studies is a comedic stretch of the imagination I find that its becoming harder to argue against dumb shit like this because its people who are already ignorant to begin with making the arguments - which always boil down to a pretentious appeal to authority,Popolar,16443571870,1
hw586we,snj9i6,Lol nope Seatbelt analogy is for wearing masks not for the vaccine,Yatesthegreat,16443595240,1
hw3hp9x,snj9i6,Can we all STFU about the vaccines and post about real shit again Jesus,buddyfluff,16443366340,-3
hw32v4b,snj9i6,Wearing a seatbelt is the law Its in place bc wearing a seatbelt can save lives There are lots of laws in place to protect peoples health Seatbelts no smoking inside no drunk driving you need a license to operate heavy machinery cars need to be inspected before they can drive on the road OSHA rules and regulations expiration dates on food and on and on Do all these laws keep people safe 100% of the time- nope Do these laws save millions of lives every year- yes Please look up the information on vaccine side effects throughout history Its negligible compared to their effectiveness for saving lives What exactly are yall gonna say down the road when all vaccinated are fine and we havent been implanted with a disease or 5g chip? When the future looks back on this time in history and learns about how terrified yall were of science and civic duty,SlightlyRukka,16443306570,-18
hw2the3,snj9i6,Wearing seatbelts can have side effects but theyre tiny compared to what they prevent Just like vaccines Thats why they got approved,Simon_787,16443262100,-25
hw497h0,snj9i6,You seem misinformed on the vaccine in general The reason comparing a seatbelt to the vaccine is an analogy is because its similar in some ways but the two are not exactly same And you must remember the context the seatbelt analogy is often brought up as an answer to "why do I need to wear a mask if I already have a vaccine" the answer of course being that we wear seatbelts as well as airbags because we want to improve our chances of not only not passing it on but also not dying You also seem to think that the risk of blood clots in the vaccine are bad would it surprise you to know that the coronavirus as a much much (x10) higher chance of blood clots "necrological disorders" and all manor of other side effects? You also seem to think theyre are some secret "long term results" were still waiting for but this is a strange thought No vaccine before has ever been present in the body for more than 6 months at the absolute most Vaccines as you know are there to train the immune system and dont stay in the body long usually around a month or less With 2 billion+ doses administered we still have no addition side effects so it seems strange to wait for these Covid on the other hand seems very capable of permanently damaging a lot of lung ear nose and throat systems with long term effects like difficult breathing lung capacity smell and taste and many more just being permanently changed Im not sure what "hiding the safety data" the cdc and all the drug agencies have been very forthcoming on all their trials You all even got mad at the cdc for saying there was no evidence of airborne contagion early on and then changing that stance after they researched it and got evidence Same thing with when they said dont wear masks at first as they were no thought at the time to be necessary but new data came out and the cdc adapted its message to the studies The cdc has been reflective of the data from the begining You might be talking about the preprint studies and the VAERS database stuff Those Im sure you have heard are flawed for many reasons their results may be correct or not but we need more data before we can say anything If the researchers and doctors at the head of the preprints or VAERS claims believed that they would want to wait for these studies But we did this cycle with monocoidal antibodies ivermectin and hydroxychloroquine and each time they put in the work for a big double blind study these drugs are reveal to do nothing or so little as to be nothing You also seem very concerned about the companies themselves but for all your conspiracy you dont look at the positives These companies are looking to make big money from government contracts and to get the biggest ones you need an effective vaccine as verified by the FDA and the 40 other countries the vaccine will go too including France Britain Germany and even our enemies China and Russia It in their best interest to make a working vaccine especially because they must compete in a hot market theyre now like 7 different vaccines from different companies so competition is fierce I mean just ask yourself if the vaccine was truly dangerous why wouldnt Russia or China talk about it Or the hundreds of journalists looking for hot stories or any of our allied countries to alter their friends or peoples or the competing companies after their government contract All these people and more would have to work together its impossible,rascalrhett1,16443466010,-4
hw378p6,snj9i6,This is completely missing the primary point of when most people are bringing up the seatbelt analogy Yes some people bring it up as a pure example of a mandated safety rule But the primary point of the seatbelt analogy is in explaining to people how a vaccine can be working but that the majority of people in some places who are hospitalized are vaccinated Thats because the ratios matter The analogy then is to how seatbelts work to reduce risk in crashes but far more people end up in hospitals from car crashes who were wearing seatbelts than who werent because almost everyone wears a seatbelt The only other context the seatbelts are sometimes used is analogous to masks and then the analogy works pretty well even in the use-case So this primarily seems to be an argument being directed at what is fundamentally a misunderstanding of the main reason seatbelts get mentioned,JoshuaZ1,16443325170,-7
hw4ae8o,snj9i6,I know right? they try to compare any damn thing with these masks/vaccines I was watching Aziz Ansari his new special not even funny tbh but he said something like my uncle will get a colonoscopy and starve himself before the surgery on his ass but he refuses the vaccine? like ok azisIdk why I watched him I enjoyed his cringey comedy I guess,kushnugzz,16443470310,0
hw3v80b,snj9i6,Businesses arent closed down for serving people who dont wear their seatbelts Also the efficacy of seatbelts is based on compliance If no one complied wed be throwing people in prison and ruining their lives over a personal preference that has nothing to do with anyone else except themselves Why should be do that to someone? What gives us the right? Are we the property of the government? Are we slaves or livestock? Its evil just like the vaccine mandates,jsideris,16443415960,1
hw3w8dr,snj9i6,Why are we ignoring COVIDs side effects when it comes to the vaccine,Yiawwbecm,16443419610,1
hw469da,snj9i6,Seatbelts are meant to protect you unless there is a freak accident and youre ejected hitting someone else Were told masks and vaccines are meant to protect others and you if youre at high risk I even had someone claim no one uses the seat belt analogy even when Oxford University Press put out an argument supporting the analogy which the NIH hosts on its site,HIVnotAdeathSentence,16443455390,1
hw4fje2,snj9i6,The seat belt analogy was irrevocably destroyed when pharma owned CDC and Mainstream Media finally admitted that the "vaccines" so not in any way shape or form whatsoever prevent or even reduce transmission Seat belt analogy: the passenger in the front is protected when passenger in rear wears a seat belt,Aggressive-Hair9522,16443489260,1
hw4l2es,snj9i6,Isnt the analogy that the mask mandate is like being required to wear a seat belt? I have never once heard people compare a seat belt to the vaccine,AwkwardSeth,16443509840,1
hw5n7sf,snj9i6,Sticking to the popular car analogy for vaccine safety "I know heaps of people whove had the vax and none of us have died from it" Therefore it must be safe We all know someone who has driven drunk and never killed anyone Therefore drink driving is safe? Honestly Ive seen them accuse the pro choice of hypocrisy for wearing glasses but being unvaxxed Its easy to see who paid no attention to the long list of known side effects Pfizer provided in their presentation to FDA to be given approval for emergency use Death was on that list Do these people actually think clearer vision seatbelts and death are comparable? All the while claiming we get this info from facebook while they share screen shots of social media to defend their ignorance Forgive them for they know not what they do,ArtisFarkus,16443656850,1
hw5te0x,snj9i6,Also if I get Covid I only have a 03% of dying from it without a vaccine if a hit a telephone pole at 80mph without a seatbelt thats about a 100% chance of dying Seatbelts are far more necessary for most of the population than Covid vaccines are,FormerStyle5,16443682990,1
hw6mlya,snj9i6,Why do people use the seatbelt analogy to compare it to vaccines if anything its more equivalent to using a masks An external non-invasive measure,diogenes45,16443810170,1
hw75us4,snj9i6,I cant account for everytime somebody has used this as an analogy but the way I use it is as an error of inference Lets take a quote: "but you dont know if the vaccine is gonna save YOU" it would be like saying "but we dont know wether seatbelts actually work until it does" Yes we do because the statistics shows that hospitalization and deaths are much more likely to happen to unvaccinated Or simply using anecdotes "People I know got survived perfectly fine from covid" you would stop using seatbelts because somebody you know who survived without a seatbelt because statistically people actually survive using seatbelts all the time This is how I use it to point out errors in conclusions,EddyEdmund,16443924310,1
hw8expc,snj9i6,These vaccines are at best umbrellas They are uncomfortable and mostly useless I wish the government didnt make us haul umbrellas everywhere,transcis,16444199000,1
hw8mpn6,snj9i6,Ive seen people use the seatbelt analogy for masks not vaccines,VTHUT,16444229310,1
hw66ivk,snj9i6,The vaccines have not been shown to have long term side effects Wearing a seatbelt only protects one person whereas vaccines can protect several No one screams about personal liberty with seatbelts like they do with vaccines Both vaccines and seatbelts are preventing large numbers of deaths We will continue to use this metaphor,MiezaruTe,16443739020,-6
hw4dvtm,snj9i6,I asked my Dr for a medically proven reason why I should get a vaccine after he told me to get one His response just like I told my son its like wearing a seatbelt That was medical advice I actually received Scary,CandidateCareless787,16443483120,-1
hw60082,snj9i6,If anyone wants to make comparisons between the covid vaccine and a car part the covid vaccine is similar to an airbag yes it has a fairly good safety profile but it can also really mess some people up And because we dont have an alternate solution right now we still have to use them,Myths-and-Laur,16443711470,0
hw754l9,snj9i6,The analogy wasnt used for vaccines more for why social distance if masks work,Patseiam,16443919140,0
hrfcqzw,rwkj3w,For me personally its not about the vaccine Its about the vaccine passport and what that entails Thats a hamster wheel I will not get on,helterskelta,16414276880,96
hre74q0,rwkj3w,Canadian unvaxxed here and its not because I dont believe in vaccination I absolutely do But these are not vaccines 4-6 month efficacy Still can catch it litany of side effects Whats the point? There literally is NO reason to take it There is no benefit I still follow all the protocols distancing masking and isolating I havent fucked anyone in like 2 years hahaha,J3diJ0nes,16414111350,8
hrh6dl2,rwkj3w,Had COVID Im unvaccinated I wont ever be "vaccinated" using us as guinea pigs trying to lock us all down into their system with vaccine passports and no rights if your unvaccinated Fuck you,donovanberrisford,16414666260,8
hrhxs2x,rwkj3w,Just had covid along with whole extended vaxxed and boosted family Guess who ended up going to the hospital? It wasnt me the only unvaxxed person amongst us I feel vindicated in a way but also what the fuck? Everyone still thinks they would have been much worse without the vaccine Why? They all got it they all had a range of symptoms from mild to severe its like just a roll of the dice Losing hope that people are changing their mind,here-4-amin,16414812400,6
hrfhctm,rwkj3w,Unvaccinated New Yorker here right near NYC I used to go to the city a lot but I will never go again unless they reverse this totalitarian vaccine mandate system,ThisAgedWellCuomo,16414295360,6
hrd3raa,rwkj3w,yes most of the vaccine info is propaganda i have visited hospitals many times and never asked for vaccinations fear and mass psychosis is at a highest now so try to endure!,neuthral,16413965720,13
hrf0t50,rwkj3w,What blows my mind is not that so many people are willing to take rushed vaccines during a pandemic although I am a little surprised No what really blows my mind are the people and governments who expect and even demand others take rushed vaccines This is morally horrible This is part of the psychosis,rivensdale_17,16414230710,4
