hrd21j2,rwkj3w,Wheres the conspiracy? Seriously this sub needs to go back to conspiracy theories or just rename itself to antivax Like if you wanna post conspiracy theories about the vaccine THATS COOL but this sub is just promoting being antivax with zero conspiracy theories and its lame "Oh Im not vaccinated look at me" I dont give a fuck Post some shit on UFOs 9/11 bigfoot government doing some shady shit even the vaccine I dont give a fuck if youre vaccinated or not Dont post it I dont care Give me a conspiracy goddamnit,andrewjackson1828,16413958850,-2
hrg5bu9,rwkj3w,Yall are just sad lol Its not experimental when its been in production for 30 years and the COVID specific vaccine has been out for over a year Youre just grasping at straws and looking to feel special because your lives are so void of anything of value so you make shit up to make yourself think youre doing something when in reality youre only doing harm,nalcyenoR,16414424250,-2
hrcqpoh,rwkj3w,It amazes me how different the social norms are in different sections of America Where Im at in Ohio people dont care about the vaccines or masking I have noticed the closer I get to Cleveland the more people DO care about masking,the_dionysian_1,16413909790,1
hrd1p8k,rwkj3w,Everything is always two weeks or less away for at least two weeks Just hang on guys Just keep pushing the goalposts and mainlining copium Is this why jfk Jr came back? 74% one dose and 63% fully vaxxed https://usafactsorg/visualizations/covid-vaccine-tracker-states/,sammalonespitbull,16413957470,1
hrd3n85,rwkj3w,Unvaxxed Lithuanian here Its tough when you cant enter gyms or go to the cinema without green certificate but i will be strong and wont take this vaccine,doorfix3r,16413965250,1
hrd54v2,rwkj3w,Often time you conspirators forget where the government gets their money Their cash cows Us If they kill us all they lose their profit They give us a genuine vaccine that saves us like they did the first 5 days of your birth- they make more money Use your heads,FartingKetamine,16413971200,1
hrd5l3w,rwkj3w,I would really love a conspiracy on this subreddit that isnt about the vaccine its getting old,Isighteyesite,16413972970,1
hrdcaua,rwkj3w,I got the vaccine Did not get a booster I found out yesterday that I was positive for Covid It is what it is and I probably will not get any boosters in the future,MartingaleGala,16413998640,1
hrddis4,rwkj3w,Lets hold the line!! Without no knowledge about the effects the governmnet starts to give the vaccine to everyone Im not against the vaccine many people really need it and im really happy that it exists even though it needs more work on it But not everyone needs it and we will have to pay all those vaccines when we havent even normalized from the economic crisis so we just dummed Have you seen that the prevision is to be giving vaccines every 6 months to vulnerable sectors till 2024 then maybe another alternative can be taken lets see,EconomyLife3978,16414003220,1
hrdjtoj,rwkj3w,less mouths needed to be fed in the future major cities overcrowded 911 scared tons away from NYC now that more people are able to get rich the older rich people want them gone even more boom covid now u cant even go into NYC restruanants without a vaccine knowing that the conpsiracy is to NOT get the vaccine BOOM more reaons to NOT go and crowd NYC where TRUMP was living by the way,brianpsull,16414026160,1
hrdk2z2,rwkj3w,its just cause i dont have a job yet that will force me to take the stupid thing i feel for the millions out there who have been bullied into getting the vaccine just because they cannot afford to be fired practically everybody i know lives paycheck to paycheck all this shit is just par for the course the US collapsed decades ago and only momentum and cope have been carrying us so far that will only last so long before the real bad shit starts another decade maybe once the climate gets so fucked the food/electric grid/whatever goes down,wharf_rats_tripping,16414027090,1
hrea6z8,rwkj3w,My girlfriend works for a pretty big tech company here in the US Keep in mind she has worked here 2 years and they have never been in the office always working remotely since covid and have not given a date to go BACK to the office They informed her less than a month ago that she will have to get the vaccine or lose her job They "gave" her the option to list medical exemptions She has some underlying health issues that the vaccine could make worse nevermind the fact that ANYONE could have an adverse reaction to the vaccinebut she is trying to go the route of medical exemption She gave a very detailed account of why she feels it is not medically safe for her to take the vaccine She wrote this appeal the day she got this threat! Now 1 month later they send her another threat and it is obvious that they didnt even READ her justification and are now only accepting an excuse directly from a doctor! They are also ONLY listing allergies to the vaccine as a medical excuse I know she is scared to death Ive heard her balling her eyes out asking her superiors at the company to speak up for her and advocate They are all too afraid to be viewed as "antivaxxer" themselves and have done nothing to help her so far Dont want to piss off daddy tech These superiors also had NO IDEA that this mandate was even in place at the company They knew nothing about these threats being sent to unvaccinated workers She is the top performer in her team This is the best job she has ever had by far and she is scared to death of losing it To the point where she is now thinking of getting the vaccine even though she knows it is highly risky for her health in particular! She has done everything right to justify not getting the vaccine and they are completely ignoring her! If anyone in the US knows of any recourse we could take against this measure please tell me! I know that this is illegal and the courts will MAYBE eventually side with basic fucking ethics but she cant wait for that At the end of this month she will be vaccinated or unemployed all so she can continue working from home around nobody else Again if anyone has advice please give itand keep in mind the company is stonewalling her and not even answering her questions,billyjk93,16414124040,1
hredm4y,rwkj3w,Omg I so wish I was still unfortunately I was blacked out on benzodiazepines during the summer and wound up being convinced to get the vaccine first time Ive ever seriouly considered staying sober for the rest of my life,Billderbeast,16414137820,1
hrejat8,rwkj3w,Omicron is Gods vaccine :) Literally a weakened form of the virus that the IMMUNE SYSTEM uses to create antibodies for all other variants Just like a VACCINE is supposed to work,TheRebelPixel,16414161440,1
hreoo9e,rwkj3w,I will never get the covid vaccine,Papasfritas77,16414183670,1
hrer2sf,rwkj3w,Vaccine free test free wide awake and praying,litetender,16414193540,1
hrfj1b4,rwkj3w,Anyone on this thread vaccinated & wish you hadnt been? My family and I have all agreed against the booster and whatever other vaccines (if any) that may be mandated moving forward Still scared for what might come for us health wise in the next 1-5 years since taking the vaccine tho,_meghannboo,16414302240,1
hrfs0jt,rwkj3w,What will be over soon? Vaccines? Covid? Lol nothings going away,4RyteCords,16414349470,1
hsahhbv,rwkj3w,Unvaccinated from Canada Quebec here i gotta say its getting tougher by the minutes They sre pishing us to the edge with compulsery vaccine madate and qr codes everywhere 10 PM curfew and are now saying they will tax unvaccinated more for the medical beds they sre taking lol,Sambilboo,16419516950,1
hsug92o,rwkj3w,The vaccine reduces death rates not contagious rates and thats a fact if you compare the numbers from before and after vaccination Theres no point in not getting vaccinated all the arguments against it are poorly crafted and based on rumors if you dont get vaccinated you are a danger for global health,Business-Question-62,16422977940,1
hu10nr6,rwkj3w,Vaccine Mandates: Crimes against humanity America is one of the worst and most dangerous places to live now since the Vaccine Mandates You cant even get doctors to do their jobs because theyre afraid of losing their paychecks They need to stand with the courageous Doctors who have spoken out and actually treated their patients with Ivermectin and other viable treatments HippocraticOath,ResistGlobalism,16430379180,1
huzc1hj,rwkj3w,I dont understand why do anti-vax people think they know more than medical professionals? Its not exactly easy to become a doctor so what they say should matter right? The vast majority of doctors say to get vaccinated Vaccines have a pretty good track record of working (polioinfluenza small pox etc) I got my Covid vaccines about a year ago now have had literally no side effects Can someone please help me understand how being anti-vaccination is not a problem and a public health risk?,Careless-Kale8024,16436283480,1
hrcsamq,rwkj3w,If you die from covid you wont prove anything In fact it will further prove the point that the vaccine is necessary You are not "owning the libs" when you die from covid or wind up in the hospital with covid It doesnt work that way,FrostyLandscape,16413917230,-6
hreemwv,rwkj3w,I think you all been fooled It is a reverse psychology trick they knew you will gonna question the vaccines the vaccines work the virus is real unvaccinated gonna die This is the easiest plan ever,findergrrr,16414142120,-2
hre7xmf,rwkj3w,The vaccine isnt bad,maneaterunicorn,16414114360,-1
hrgr5mn,rwkj3w,Man These are hilarious Comply to what end? Jus what do you think these vaccines are doing? What do you think youre avoiding???,xjoeymillerx,16414550090,-1
hrd7to9,rwkj3w,This is ridiculous The right have an obsession similar to the left If the left is obsessed with forcing vaccines and mask mandates Then the right have an obsession with forcing people not to take the vaccine and not to wear a mask,hakuno-satube,16413981610,0
hrdt83f,rwkj3w,Was kinda forced to bc I live with my family and theyre paranoid but I didnt want it I think its stupid and pointless my city is fine and I didnt want it especially when I had really bad bleeding at the time and everyone was taking about it messing with your blood Im fine but it did make me sick for about two weeks which was awful and then I had to go to school with everyone thinking I was contagious but i just have an awful immune system and cant handle vaccines very well It was so much worse than the flu shot tho it usually only gives me a sore throat for a day or two after,exuberantraptor_,16414059620,0
hrgabt5,rwkj3w,im vaxxed and a few other ppl i also know or follow aswell one thing i know is we gon live longer and healthier and happier than any of you conspiracy mfs applies to vaccined people aswell that are so strict about that yall dying from stress just eat and exercise edit before u start even if this gets read: nothing wrong with yes or no choice i severly go against extreme people saying vaccine or lose your job or dont vaccine you are sheep!,mogusrequiem,16414449780,0
hqhmidb,rrkf0b,What do you conspiracy theorists think is she Bill Gates biological daughter? Was Epstein just a pawn? Is she a lizard person? Did the covid vaccine cause her to do all that? Is Maxwell actually an anagram for WellMax and some max dude is running this shit?,MickeyZvornik,16408282820,0
gw34g75,mzn77j,There are 13 billion ppl in india If u want to do some population reduction with vaccines A place with a huge percentage of the world would be a good place to put on a narrative/agenda of needing to vaccinate that population,empathetical,16195515470,1
gw29xqj,mzn77j,Deff lying Not sure if they are lying about India itself but if they arent lying then the vaccines caused this uptick in cases,Conscious-Inside-223,16195387610,0
i21wgln,tnc9c7,Man I wish people would have protested the police in mass like they did for the vaccine and mask mandates,DookieBlossomgameIII,16482079530,1
hnnibcm,rb6azk,Seems kind of delusional to think this is the sole reason they removed it and not because of watch time ads and money There are many videos that are highly monetized besides the vaccine videos that have a high proportion of dislikes The vaccine videos make up a very small percent of all high proportion disliked videos on YouTube,PureBigStick,16389190750,92
hnocnhc,rb6azk,I work in healthcare and I am so tired of hearing the word covid vaccine mask etc thankfully our healthcare system has not mandated since the surrounding systems have We have gotten hundreds of employees and are making money off of them firing employees Im constantly told that I should get the vaccine and all I can say is NO THANKS I had covid and Im fine,yepimout,16389340160,9
hnnbcrg,rb6azk,More like because of Covid vaccine videos AND every woke TV show and movie trailers AND White House videos AND anything establishment related,Kayde1210,16389159020,21
hnoee6i,rb6azk,Yes When deciding whether or not to get vaccines i consult youtube like/dislike ratios and internet comment sections full of terminally online weirdos,Sam_Snead_My_God,16389349330,7
hqkpeax,rb6azk,Stop being a little bitch about needles and just get the vaccine ffs,abcdexyz12345,16408880300,2
hno94st,rb6azk,I just saw a sickening post on BabyBumps with all these parents saying they cannot wait to vaccinate their infants and children So many things wrong with giving a baby with a miniscule chance of actually getting fatally ill an unproven vaccine curated by big pharma Cost benefit analysis here people The risk of covid having long term effects in babies is not high enough for me to even contemplate giving my daughter an unnecessary anything in her little body I could go on forever It blows my mind that we all exist in a world that seems to be increasingly devoid of rational thinking,alwaystimeforpizza77,16389322030,3
hnnytwe,rb6azk,counter point: >YouTube took away the dislike button because Covid anti-vaccine videos were receiving an insane amount of dislikes They want to make you feel like youre the only one that got vaccinated There are MILLIONS of us that are fully vaccinated and that shows in all content responses that arent regulated I wish /r/conspiracy upvoted content that wasnt complete bullshit but hey why bother coming up with anything interesting when you can just appeal to the right-wing hellhole this sub has turned into counter point: this subreddit is directly manipulated by foreign entities who are seeing just how high they can make people jump so I guess the upvotes and awards are probably coming from other compromised accounts,extralyfe,16389270140,8
hnnp2zb,rb6azk,No one wants the vax Its a Sophies choice for everyone Im struggling to understand why so many anti-vax people seem to think everything is COVID or vaccine related,KFoxtrotWhiskey,16389222420,3
hnnoytl,rb6azk,This isnt related to YouTube but I had an OBGYN appointment today 12 weeks pregnant yay! She was pushing the vaccine on me pretty intensely saying if I catch the virus it could kill my child yada yada yada I told her I had covid when I found out I was pregnant at 8 weeks and that obviously it didnt kill my child and Id prefer to use my bodys natural response to the virus She just glared at me for a minute and then said "well talk about it at another time but you should get that vaccine" Like No I dont think so and if its going to be that big of an issue Ill go to a different doctor My fiances grandfather has covid right now he is vaccinated and got the boosters and he is still very ill and were praying it doesnt get worse (No he did not get covid from us) I think that shows pretty well that the vaccine and boosters are crap and Im definitely not going to be taking it,ValMarie23,16389221870,1
hno7cck,rb6azk,You people baffle me I grew up on youtube they didnt take it away because of stupid vaccines They took it away because you can weaponize the dislike button ON ANY SUBJECT not just fucking vaccines you people are absurd,GutterCookie45,16389312820,2
hno88gh,rb6azk,Im prepared for the onslaught of downvotes but does a dislike button really have substantial influence overs peoples opinion of the vaccine? A thumbs down? I agree its ridiculous to take it away but I have a hard time believing its a conspiracy to silence vaccine dissenters,pump-and_dump,16389317390,1
hnnpu3n,rb6azk,People are afraid to speak out in other subreddits as well Last spring/summer so many people got banned for speaking out against vaccines or just even sharing their stories of how they received an injury and bam banned for life from that subreddit a few days ago I spoke out on a few boards that were not specifically pro vaccine but the posts were I cant even tell you how surprised I was for the level of support in comments and private messages I received thanking me I told them in private message responses boards they are free to speak openly and hoped they would speak up in other sub reddits so people know they arent alone in their feelings,TheCookie_Momster,16389226070,1
hnneho0,rb6azk,I would argue the Biden administration had more to do with it than the vaccine videos He was also getting ratiod into oblivion,TSPGlobal,16389173300,1
hnon6b2,rb6azk,> YouTube took away the dislike button because Covid vaccine videos were receiving an insane amount of dislikes Nobody cares about your brigading dude,Shamalamadindong,16389400140,1
hnnz1o5,rb6azk,Im guessing you have proof this is why they removed dislike buttons? COVID vaccine videos? Would love to see it!,strangewin,16389271230,1
hno279p,rb6azk,For months now every single video I would look at from any mainstream news source that had to do with the vaccine was *overwhelmingly* downvoted Every official White House video pretty much any video about Biden all heavily downvoted So wild how desperate they are to censor and control the narrative,TheEpicPancake1,16389287000,1
hno3lds,rb6azk,Per usual OP provides zero evidence at all Literally anyone can just post "vaccine = bad" in this subreddit and get a bunch of awards Exploring conspiracies should be about thinking critically and challenging your own beliefs You should be challenging your worldview and open yourself to all possibilities This place is more of a bubble where everyone just feeds their own confirmation bias,ThisGuyHasABigChode,16389293930,1
hnobiyi,rb6azk,So what IS the vaccine then?,THCzHD,16389334310,1
hnoh66e,rb6azk,Its not to hide covid numbers its literally to protect the interest of companies A company releases a video people dont like it get bombed to the ground Its a general thing not a vaccine thing,djentbat,16389364540,1
hnom9dy,rb6azk,Wait we are against the vaccine?,Havic_H_E,16389394450,1
hnoszsx,rb6azk,There is such an easy way for a platform out there to appeal to free speech while still satisfying all metrics of actual needed censorship There are obviously situations which require some kind of moderation or censoring to avoid random stuff like bot spams or ads Much like how too many dislikes hides a comment they can do the same thing with removed material Just make all moderation actions transparent where bans and removes can all be seen in some viewable public space If it comes to a comment needing to be censored according to guidelines just make it a "placeholder" til someone willingly clicks on it No need to try erasing it from history You can just do like bitchute and allow votes only from registered members unless a "guest" verifies being human first Youtube took away the dislike as part of an ever progressive campaign to regulate the flow of human discourse There are far too many bot accounts with pornographic names and user images spamming random content and too many "verified" bot accounts spamming controversial comments in highly politicized videos for there to be some wholly altruistic motive behind it It has personally caused me many times to simply give up on real discourse of a controversial topic when realizing the comment still gets deleted after revising it all possible ways I can imagine The dislike button is merely a part of "hate culture" to a progressive social media reform lobbyist All the comments hating on vaccines are still visible in all the videos as of now so long as they pass the AI filter,NameImadeupjustnow,16389439760,1
hnotozm,rb6azk,I just dont understand why there cant be a middle ground on this issue where we just leave eachother alone I absolutely dont care who is vaxxed or who isnt The hyper fixation on vaccination "conspiracy" vs vaccine "science" leaves no room for individuals to work this out or ask critical questions Im more worried they will use this to crush businesses and curtail freedoms not what is in the vax but even that isnt the dominate conspiracy cause that would require a middle road perspective They dont want that Taking away all nuance is absolutely the goal of social media propaganda at this point Reguardless of which side its coming from I never trust anyone too aligned with one set of ideas,caliburoutsider,16389444990,1
hnovdka,rb6azk,Not just vaccine videos Most leftist political bullshit on YouTube is (was) flooded with dislikes Cant have that now can we,wang__chung__,16389458010,1
hnp6fqf,rb6azk,1 Thats not why theyve been wanting to do it for years Its purely to receive more money from advertisers Cant see video has dislikes > More likely to watch > More advertiser money 2 This sub used to be kinda chill with usual and sometimes far fetched conspiracies but now its been flooded by anti vaccine nonsense and its become an echo chamber Have a little common sense,FrederikTwn,16389551560,1
hnpd02j,rb6azk,Anti-vaxxers will make anything about vaccines They took it away so that we can click more or anything If you see a video with a bad ratio youd know it sucks and wont click But if you only see the likes youre more likely to check And it affects all videos Many anti-vaxx videos have a lot of dislikes too Either way peoples negative opinions have just moved from the dislike button to the comment section I think YouTube is wrong for this though,teal-eaf,16389609640,1
hnps3sf,rb6azk,On top of that Reddit mods are banning everyone with the slightest degree of differing opinion in every sub Common sense good intentions and concerns are downvoted out of existence The slightest mention of vaccines will be jumpped on and circle jerked with absolute BS Mention something important and crickets Its all BS Nothing is real online Lets do bi-weekly BBQs and arm wrestling to work this shit out Everyone I talk to in person seems to be sensible and coherent,justanotherchevy,16389708220,1
hno2t5j,rb6azk,Get the vaccine you dipsticks,threefingersplease,16389290030,0
hnp9ayr,rb6azk,Get the vaccine,hoosierspiritof79,16389577480,0
hwi25dp,spy4ux,Moderna is some sort of CIA/Darpa front company for bioweapons research Founded September 2010 worth billions and released only a single product the "covid vaccine" Yeah right,wfhngio9354,16445859890,260
hwijnpf,spy4ux,>This former Blackrock hedge fund manager started digging into death statistics from insurance companies and funeral homes: >https://twittercom/DowdEdward/status/1491460331813568518 >He also started accusing Pfizer and Moderna of fraud in the vaccine clinical trials Here we go,s0lesearching117,16445935370,6
hwk2hqo,spy4ux,This writing has been on the wall since the vaccine development started And people are STILL getting that s\*\*\* And having their CHILDREN get this s\*\*\* Disgusting,RickieSix,16446137920,9
hwjmfh6,spy4ux,Dr Faucis NIAID and NIH who jointly owned a patent for corona virus mRNA vaccines with moderna had sent corona mRNA vaccine material to Chappel Hill for testing in December 2019 before covid was made public NIH was funding the creation of this coronavirus strain and the vaccine for it at the same time page 105 for ownership and page 107 for date: https://wwwdocumentcloudorg/documents/6935295-NIH-Moderna-Confidential-Agreementshtml,squishsplash,16446078410,5
hwirkq7,spy4ux,If half of these vaccine injury stories are accurate hed better delete his address and change his name,SodometriusPrime,16445965410,4
hwk7ax2,spy4ux,Obviously Moderna really doesnt know what its doing Its just taking shots in the dark to keep its valuation They really have no idea how these vaccines will affect people in the long term and they dont care They justify it as in theyve " saved peoples lives from coronavirus And they probably think they deserve to be rich and powerfulIts like the old "evil scientist" story but playing out in real life Unbelievably creepy,Good_Brief8190,16446156100,2
hwjukxk,spy4ux,Okay what happens if you stop getting boosted will you die or something? Did I do permanent damage to body from the vaccine? I feel fine overall Just curious since I have read a litany of things,jordan2301hoops,16446108550,1
hc4d79a,pkkql4,*\[leaky non-vaccines = pathogen priming conspiracy\]* >***"Intriguingly recent data from England and Wales (February 2021) show the accumulation of the E484K in the B117 background suggesting a selection of this mutation in the response to the vaccination program E484K is also the only shared mutation of both Brazilian variants which possess a similar resistance to neutralisation after two doses of the BioTech/Pfizer (BTN162b2) or two doses of the Moderna (mRNA-1273) vaccines"*** (Source: The Brazilian P1 (20J/501TV3) Variant) *\[/leaky non-vaccines = pathogen priming conspiracy\]*,ShaohKahn,16311446610,24
hc4hod5,pkkql4,Always a good laugh when this sub says they got something right Covid is real It didnt go away when Biden was elected Hydroxychloroquine doesnt work The vaccine didnt kill everyone and women didnt go sterile If you want your science to never change despite new information you probably would be more interested in religion,NeedlePointTaken,16311468140,33
